id,video_description,create_time,region_code,share_count,view_count,like_count,comment_count,music_id,hashtag_names,username,effect_ids,playlist_id,voice_to_text
7466062216996097282,#afd #bundestag #cdu #politik #bundestag ,2025-01-31 12:54:39,DE,161,27807,3035,553,7466062205876734742,"['cdu', 'afd', 'politik', 'bundestag']",bernd.schattner.mdb,,,hallo Leute hier mal ein Bild Aus dem Plenarsaal des deutschen Bundestages immer noch ist die Sitzung unterbrochen zustrombegrenzungsgesetz steht auf der Tagesordnung CDU und FDP ist der Angstschweiß ins Gesicht geschrieben Scholz Habeck haselwander die ganzen linkswoken wissen nicht wo sie hin sollen hier ist momentan richtig stimmung unterm gebälk hier riecht man angstschweiß die panik der altparteien ist spürbar man riecht die panik der verlierer die cdu weiß nicht mehr was sie machen soll es wird zeit für einen echten politikwechsel in deutschland am dreiundzwanzigsten zweiten alle Stimmen AfD für ein echtes konservatives Deutschland ich freue mich auf die restlichen 3 Wochen Wahlkampf ich freue mich auf das Wahlergebnis lasst uns kämpfen kämpfen kämpfen wie jede Stimme zählt euer Bernd Schattner Aus dem deutschen Bundestag
7466026140537228566,"Heute Nacht machte ich in meiner voraussichtlich letzten Rede dieser Legislatur im Bundestag deutlich, warum nur wir von der AfD die deutsche Landwirtschaft voranbringen können und die CDU gar nicht an sinnvollen Lösungen interessiert ist. Deshalb am 23. Februar: Beide Stimmen AfD! 💙🇩🇪 #afd #politik #btw25 #bundestag #cdu",2025-01-31 10:34:37,DE,7,2266,281,23,7466026127627275030,"['cdu', 'afd', 'politik', 'bundestag', 'btw25']",bernd.schattner.mdb,,,"wieder einmal erleben wir 1 Absurdes Schauspiel der Scheinheiligkeit, diesmal in der Agrarpolitik. die Union, die sich über Jahre als Totengräber der deutschen Landwirtschaft betätigt hat, kommt nun plötzlich mit Forderung um die Ecke, die 1:1 Aus dem Programm der AfD stammen. doch lassen sie sich draußen nicht täuschen. die Union ist und bleibt eine Partei der Heuchler, die sich nach Belieben verbiegt, ohne Prinzipien, ohne Rückrat und ohne Ehrlichkeit. beginnen wir mit der Lüge, agradieselrückvergütung die größte von ihnen. jetzt fordert die Union plötzlich die Wiedereinführung der agradieselrückvergütung. was für eine schamlose Heuchelei, denn am 20.03.24 hat die AfD mit dem Antrag 20 Schrägstrich 155 genau dasselbe gefordert. Votum der CDU damals, Ablehnung. im Brei A 2022 als die AfD im Rahmen der Energiekrise die Verdoppelung der Vergütung gefordert hat. Ablehnung. die offizielle Begründung damals, agradiesel subventionierung sei problematisch, weil es um einen umweltschädlichen Stoff gehe. woher auf einmal der Sinneswandel? und jetzt 1 Jahr später tut die Union plötzlich so, als sei sie die Retterin der Landwirte. das ist nicht nur inkonsequent, es ist politischer Betrug. im Bundesrat hätten sie die Abschaffung auch verhindern können. auch da war die CDU für die streichung. das scheinen sie alles zu vergessen. nächster Punkt, die Union ist verantwortlich für das generelle agradisaster. wer hat den Landwirten mit der Düne Verordnung das Genick gebrochen? es war Julia Glöckner, die logischerweise heute nicht anwesend ist von der CDU, die mit ihrer Politik tausende Betriebe in den Ruinen getrieben hat. die Union trägt die. volle Verantwortung für die roten Gebiete, die Verschärfung des düngermittelrechts und die Zerstörung der Tierhaltung in Deutschland. 16 Jahre CDU zeigen ihre Wirkung. und jetzt wo die Proteste immer lauter werden, will sich die Union plötzlich als Retterin der Bauern präsentieren. nein meine Damen und Herren, die Union ist der Totengräber der deutschen Landwirtschaft. nächstes Thema in bürokratisierung. eine weitere Heuchelei der Union. die Union fordert weniger bürokratien der Landwirtschaft. einfach nur lächerlich. am 25.06.24 hat die AfD mit der Drucksache 2011958 genau das gefordert und die Union hat den Antrag Überraschung einstimmig abgelehnt. die Union ist nicht an einer echten Entlastung der Bauern interessiert. sie kopieren AfD Forderungen nur dann, wenn sie politisch unter Druck Gerät ohne jemals ernsthaft etwas für die Landwirte zu tun. kommen wir zum verrat am deutschen bauernstand durch das merkursieren kommen und seien sie entweder ruhig und stellen oder stellen ne Zwischenfrage. ganz einfach, während sich die Landwirte gegen billig Importe Aus Südamerika wehren, will die Union das merkusu Abkommen unbedingt ratifizieren. der nächste Betrug an den Bauern und das ist 1 direkter Angriff auf unsere Landwirte. doch die CDU kümmert sich nicht um die Landwirte, sie wirft sie den klomatenmerkten zum fraßfrohr. und wer trägt generell die Verantwortung für diesen agrarpolitischen Wahnsinn in der EU? wer hat den grindil die ordnungspolitische regilierung da gab und die soziale konditionallität eingeführt? es war die Union und der Ursula von der lein und wieder Julia Glöckner. meine Damen und Herren, wenn sie wirklich eine Agrarpolitik wollen. die diesen Namen verdient. dann gibt es nur eine Lösung, die Union muss weg und die AfD muss die Agrarpolitik übernehmen. nur mit Alice Weidel und der AfD können Landwirte wieder von ihrer händearbeit Leben, nach guter fachlicher Praxis wirtschaften. deshalb am dreiundzwanzigsten zweiten allies für deutschland. alle stimmen für die afd. vielen dank, seksen bir.
"
7473056592234024194,#wahl #btw #landwirtschaft #afd #politik ,2025-02-19 09:16:22,DE,14,1920,438,35,7282498671971780609,"['btw', 'wahl', 'afd', 'politik', 'landwirtschaft']",bernd.schattner.mdb,,,liebe Landwirte ihr seid das Rückgrat unseres Landes aber die Ampel macht euch das Leben mit Auflagen verboten und teurer Energie unmöglich wir stehen für eine starke Landwirtschaft faire Preise und weniger Bürokratie. wenn ihr wollt dass Deutschland auch in Zukunft eigene Lebensmittel produziert dann wählt am 23. Februar mit beiden Stimmen AfD!
7472397095324929302,#wahlkampf #afd #btw #wahlen #migration #politik ,2025-02-17 14:37:11,DE,71,1196,244,19,7472397204532349718,"['btw', 'migration', 'afd', 'politik', 'wahlen', 'wahlkampf']",bernd.schattner.mdb,,,hallo kusel was für ein Anblick in dieser Halle eigentlich müsste man jeden von euch mal kurz hier auf die Bühne holen damit ihr seht was hier los is diese Halle zeigt Mir wir sind Volkspartei wir sind mehr und wir werden in 15 Tagen dieses Land blau färben und Deutschland endlich wieder vom Kopf auf die Füße stellen die schreikinder da draußen die zeigen Mir wir sind auf dem richtigen Weg die haben Angst davor tatsächlich mal arbeiten zu müssen statt fürs demonstrieren Geld zu bekommen durch ne Anfrage durch eine Anfrage von Mir an die Bundesregierung wurde offen gelegt dass die Omas gegen rechts mit tausenden von Euros jedes Jahr von der Bundesregierung gesponsert werden kein Wunder also dass die da draußen singen und klatschen wenn wir regieren ist damit Schluss dann können die zu Hause wieder häkeln und stricken und keine Angst die Enkel von denen die sind schon Lange hier drin in der Halle und die wählen AfD aber aber lasst uns auf die aktuellen Probleme schauen wir haben kein einnahmeproblem in diesem Land wir haben ein Ausgabe Problem wir haben Steuereinnahmen von rund einer Billion Euro aber diese Regierung sagt uns dass für unsere Bürger kein Geld da sei Welch eine Lüge allein im letzten Jahr hat Deutschland 34 Milliarden Entwicklungshilfe gezahlt unter anderem an China und Indien Indien allein bekommt bis 2030 10 Milliarden das würde ich sogar persönlich noch bezahlen vorausgesetzt sie nehmen unsere Regierung mit auf die dunkle Seite des Mondes und lassen sie dann da oben 28 Milliarden gingen in die Ukraine und ohne Haushalt wurden letzte Woche weitere 3 Milliarden beschlossen 48 Milliarden kosten uns der Asyl Wahnsinn und 17 Milliarden zahlen wir mehr in die EU ein als wir zurückbekommen in Summe 130 Milliarden Welch ein Wahnsinn unsere altpartein Politiker haben schon Lange vergessen was am Deutschen Bundestag steht dem deutschen Volke nur dem und wirklich nur dem sind wir als deutsche Politiker verpflichtet meine Damen und Herren und was passiert gleichzeitig hier in Deutschland allein 2023 2024 gingen rund 340.000 Arbeitsplätze durch Insolvenzen verloren dummerweise haben wir einen Wirtschaftsminister den man erstmal erklären muss was Insolvenz überhaupt bedeutet und die trampolinspringende Außenministerin kann ihm das auch nicht erklären dafür ist sie ein bisschen zu oft auf den Kopf gefallen die Wirtschaft wandert Ab die BASF geht nach China ThyssenKrupp will zehntausende Arbeitsplätze in der Stahlindustrie abbauen VW spricht von 35.000 Daimler in Wörth kündigt Mitarbeiter ich könnte ewig so weitermachen und warum das alles wegen der dümmsten Energiepolitik der Welt Deutschland hat die höchsten Strompreise und nach Belgien die höchsten Steuer und abgabelasten der Welt Deutschland schaltet sichere Kernkraftwerke AB und kauft jetzt Atomstrom Aus Frankreich und Polen zu unsere Regierung verbietet den Verbrenner und will dass wir mit E Kutschen fahren wir besteuern die Luft mit der CO 2 Abgabe das hat noch nicht mal Honni in der DDR fertig gebracht und und ich vermute die meisten habens gar nicht mitbekommen AB 2027 wird der Handel mit den CO2 Zertifikaten freigegeben dann steigen die Spritkosten vermutlich AB 01.27 auf einen Schlag um 40 Cent an und Öl zum heizen wird im Jahr rund nen Tausender teurer und da hat logischerweise die CDU auch mal wieder mitgestimmt also nichts mit konservativer Politik von dieser Partei und genau deshalb sind wir die rote Linie für diese Klima Extremisten für diese wirtschaftszerstörer in unserem Land wir haben ein klares Programm um Deutschland wieder fit zu machen für die Zukunft hier nur ein paar Punkte unseres programmes wir werden unsere Grenzen schützen und die illegale Migration nach Deutschland begrenzen ausnahmslos sach statt geldleistung Bett Brot und Seife und auf uns ein One Way Ticket nach Hause keine turboeinbürgerung nach 3 Jahren allein 200.000 Syrer wurden letztes Jahr deutsche auch so kann man sich ein neues Wahl Volk schaffen wir wollen die aktivierende Grundsicherung wer arbeitet soll mehr Netto vom brutto in der Tasche haben mit uns wird das Verbrenner Aus wieder aufgehoben werden weg mit der luftsteuer auf CO2 und weg mit dem EEG damit Energie wieder bezahlbar bleibt und der Angriff auf Nordstream 2 war der größte Angriff auf die deutsche Infrastruktur nach dem 2. Weltkrieg wir werden ermitteln wer die gesprengt hat und der Verursacher wird die Reparaturkosten Zahlen und dann haben wir auch wieder günstiges Gas Aus Russland und zum Abschluss zum Abschluss möchte ich noch eine Frage stellen Wen wollt ihr als neuen Kanzler haben den vergesslichen oh langsam langsam langsam ich hab ja ne Auswahl mitgebracht ich bin ja fair den vergesslichen Olaf den Politik Rentner März von Blackrock den Klima Extremisten und Märchen Buchautor Habeck oder wollt ihr die Kanzlerin der Herzen unsere Diplom Volkswirtin Frau Doktor Alice Weidel danke schön
7471616620197088534,#antifa #afd #alerta #linke #wahlkampf #btw ,2025-02-15 12:08:32,DE,9,2100,386,54,7471616661858339606,"['btw', 'alerta', 'linke', 'afd', 'antifa', 'wahlkampf']",bernd.schattner.mdb,,,"Leute, herzliche Grüße Aus Landau. hier haben wir wieder mal einen Infostand der AfD. man sieht wie Linksextremisten wie Linksfaschisten mal wieder die Demokratie in Deutschland mit Füßen treten. hier im Hintergrund seht ihr den Kandidaten der linken, der das ganze organisiert hat. rassistischen Hetze kriegt hier in Landau kein Platz, keine Bühne der AfD. wir werden immer mehr. die Leute zeigen sich solidarisch und zeigen Landau. in Landau gibt es kein Platz für euch. deswegen alle zusammen gegen den Faschismus, alle zusammen und schließt euch an und stellt euch dagegen, dass hier der Rassismus immer weiter getrieben wird.
"
7470882889148747030,#münchen #terror #anschlag #afd ,2025-02-13 12:41:16,DE,4,1301,205,32,7470882888453458710,"['terror', 'afd', 'anschlag', 'münchen']",bernd.schattner.mdb,,,millionenfache remigration ist das Zauberwort um Deutschland endlich wieder sicherzubekommen wieder einmal gab es einen Terroranschlag diesmal statt Aschaffenburg in München Ein ausreisepflichtiger Afghane fährt in eine Menschenmenge es ist noch nicht klar ob es Tote gibt auf alle Fälle gibt es wieder viele schwerverletzte hier Mein Beileid an die Angehörigen der Opfer es wird Zeit Deutschland endlich wieder sicher zu machen es wird Zeit die Politik in Deutschland zu ändern lasst uns dafür sorgen genau wie in Amerika dass endlich wieder Sicherheit auf unseren Straßen einkehrt lasst uns dafür sorgen dass illegale dieses Land verlassen müssen millionenfache remigration ist das einzige was uns in Deutschland noch retten kann
7470472659390778646,"War früher nicht mal der Karneval dazu bestimmt, dass das „gemeine“ Volk den Herrschenden einen Spiegel vorhält? Heute wollen die „Mächtigen“ ihre Ideologie auch noch im Karneval an den Mann bringen. Irgendwas läuft hier gehörig schief! Danke @DK.Nachrichten für das Video, das hätte ich vorm Fernseher mental nicht gepackt 🥴 #karneval #afd #politik #wahlkampf #btw ",2025-02-12 10:09:24,DE,223,26877,338,680,7470472655805926166,"['btw', 'karneval', 'afd', 'politik', 'wahlkampf']",bernd.schattner.mdb,,,
7473485545465974039,#antifa #wirsindmehr #afd #wahlkampf #btw ,2025-02-20 13:00:56,DE,12,4669,930,76,7473485551376468758,"['btw', 'afd', 'antifa', 'wirsindmehr', 'wahlkampf']",bernd.schattner.mdb,,,"und ich hör da drüben heute die ganze Zeit, wir sind mehr. ich sag euch 1, wir werden immer mehr. wir sind heute schon mehr wie ihr. und wenn wir regieren, dann dürft ihr arbeiten gehen.
"
