id,username,voice_to_text,video_description,view_count,like_count,comment_count,share_count
7469481388085923104,afd_brandenburg,"sind die, die um 5 Uhr 30 aufstehen, 40 Stunden die Woche arbeiten, dem man heute erzählt, ihr müsst bis 70 arbeiten, während andere sich n Lens machen. diese Gruppe, die werden wir zur Priorität Nummer 1 machen. wir werden die einkommensteuern senken, damit man von seinem Einkommen endlich wieder leben kann. wir werden die CO 2 Abgabe streichen, wir werden die energiesteuern reduzieren, die stromsteuer senken, die grundsteuer abschaffen und die Grunderwerbsteuer beseitigen, damit sich auch jemand mit nem normalen Einkommen wieder ne Eigentumswohnung leisten kann.
",Wir stärken die Mittelschicht,84335,9270,801,546
7471336254261562657,afd_brandenburg,"oder eine Moderatorin in der ARD, die sagt, die fragt, warum überhaupt die Kindergärtner mit ihren Kindern durch diesen Park gelaufen sind. der ist doch als gefährlich eingestuft. das muss man sich mal überlegen. da Fragen die Journalisten im öffentlich rechtlichen nicht mal nach, warum dieser Park als gefährlich eingestuft ist, sondern warum die Erzieher Anführungszeichen so doof sind und mit den Kindern da durchlaufen. in was für 1 Land leben wir? in dem wir nicht mehr durch Parks laufen können, in dem wir uns nicht mehr ans Gleis stellen können am Hauptbahnhof, in dem wir unsere Kinder nicht zur Schule schicken können, ohne die Angst zu haben, dass sie nie wieder lebendig zurückkommen? so 1 Land ist krank, das ist nicht normal.
",So ein Land ist krank,57390,9687,668,541
7457447541643234592,afdsachsen,"Allen Wangen steht für die rücksichtslose instrumentalisierung des VS für parteipolitische Interessen und Kramer für einen obsessiven persönlichen Kreuzzug gegen die AfD. wir erinnern den Hintergrund von haldenwangsernennung im 11.18. die Union hatte Stimmen verloren an die AfD. unsere Umfragewerte stiegen immer weiter an. deshalb beschloss die Merkel Regierung den inlandsgeheimdienst als Waffe gegen die AfD einzusetzen. er fand die Hetzjagd lügen von Chemnitz und ersetzte Maßen durch den willfährigen Handlanger halten Wang. der kampfauftrag für den treuen CDU parteisoldaten war klar, AfD diffamieren, echten ausgrenzen und ihre Wahl Ergebnisse drücken. und der bekanntermaßen Entschuldigung Strunz dumme Haldenwang hat das auch noch öffentlich zugegeben. nicht allein. Zitat, nicht allein der Verfassungsschutz ist dafür zuständig die Umfragewerte der AfD zu senken. nicht allein hat er gesagt, aber er ist zuständig und zwar wesentlich für seinen treuen Dienst für die Union darf er nun für die CDU für den Bundestag kandidieren. und als wir dachten schlimmer wird es nicht mehr, da Kam die Apollo Enthüllung über den Präsidenten des Thüringer Verfassungsschutzes. Kramer. es verschlägt jedem Demokraten schiert die Sprache. zweitausendundfünfzehn nimmt der Sozialpädagoge Aus der aktiven rockerszene gemeinsam mit einem putinahen extremistischen Netzwerk nachtwölfe an einer kranzniederlegung für gefallene der roten Armee Teil. der Verfassungsschutz weiß das und macht ihn kurz darauf zu seinem Präsidenten. im Jurastudium war er gescheitert. das ist fast schon ne lapalie, dass er nicht nur persönlich sondern auch fachlich ungeeignet und unqualifiziert ist. als VS Präsident errichtet er dann 1. Regime Aus Angst und Einschüchterung. 1, 5.. der Belegschaft hat den VS Thüringen verlassen. die referatsleitung rechts und Linksextremismus unbesetzt seit 3 Jahren. 1 Disziplinarverfahren wird gegen ihn eröffnet und er wird als Sicherheitsrisiko eingestuft. der Chef des VS. einem Mitarbeiter hat er offenbar gewaltkörperlich angedroht. und was passiert? nichts. kein dementi, kein Rücktritt, kein Kommentar. große Schweigen, so wie jetzt auch. und das die öffentliche Debatte ausbleibt. das ist der eigentliche Skandal, der Totalausfall der öffentlichen Kontrolle durch die Medien, selbst dann, wenn Rechtsstaat und Demokratie gerade brechen. wie haldenmang mischte sich Kramer auch hemmungslos in den politischen tageskampf. 1 er beschimpfte 1/5 der deutschen Wähler als Bodensatz, als braunen Bodensatz. er rief den AfD Prüffall Aus ohne rechtliche Grundlage. in einer internen E Mail erklärte der zuständige Referatsleiter, Herr Kramer habe das zuständige Referat Zitat bewusst außen vorgelassen. die materialsammlung des Herrn Kramer stammt von Herrn Kramer selbst und neucht. einmal gegenüber seiner Behörde erklärt er die Herkunft dieses Materiales und dann lässt er 1 zentrales juristisches Gutachten verschwinden, wo alles das verurteilt wird. Kram und haldenbank sind Symptome eines krankensystems institutionalisierten machtmissbrauchs. in keiner anderen westlichen Demokratie darf der inlandsgeheimdienst gegen die Opposition eingesetzt werden. denn was unterscheidet eine Demokratie von einer Diktatur? in einer Demokratie entscheidet über das Schicksal einer Partei der Wähler und in einer Diktatur der Geheimdienstchef. und jetzt denken sie einmal ganz kurz scharf darüber nach, in welche Richtung wir uns gerade entwickeln. wenn sie hier heute diese Debatte nicht dazu nutzen um zuzugeben, dass dieser Verfassungsschutz und das haltenbank. und Kramer eine Gefahr für die freiheitlich demokratische Grundordnung. sind nicht mal jetzt Bezug auf diese Person, dann sind sie eine Gefahr für die freiheitlich demokratische Grundordnung. vielen Dank.
",Storch zerstört Haldenwang und Kramer! #afd #bundestag,21315,3455,263,388
7468244501547584801,afd_brandenburg,"wir werden den Cola Ausstieg zurücknehmen, wir werden das verbrennerverbot zurücknehmen und wir werden das heizungsverbot zurücknehmen Freiheit bedeutet auch selber zu entscheiden wie man seine Wohnung heizt.
",Freiheit über Verbote,13283,2112,261,66
7471665502092332321,afd_brandenburg,"in diesen Tagen krieg ich ja die 1 oder andere presseanfrage und da wird da wird gefragt, wie stehen sie eigentlich zu der ortsumgehung in armsfelde äh, der 1. oder andere fährt vielleicht regelmäßig zum arbeiten nach Berlin rein und der weiß, was das für n Nadelöhr is. und das war in den achtziger Jahren schon n Nadelöhr. 40 Jahre lang ist da nichts passiert. man fragt sich, woran liegt das eigentlich? und der eine oder andere weiß, dass ich n sehr eifriger anfragensteller bin. ich frag die Bundesregierung immer, wofür sie denn das Steuergeld der fleißigen deutschen ausgibt und wie sieht's denn da im Bereich der Infrastruktur Aus? darum geht's ja in ansfeld. es geht um Infrastruktur. und ich zitiere euch mal n paar Antworten, wo die Kohle hingeht, 20 Millionen für die Modernisierung der Infrastruktur in Tunesien. 14 Millionen für die nachhaltige Stadtentwicklung in Namibia. 21 Millionen für infrastrukturentwicklung in Nepal. 4 Millionen für klimafreundliche urbane Mobilität, gemeint ist der epnv in Kolumbien. 5 Millionen Euro für städtische infrastrukturmaßnahmen in Ägypten. 34 Komma 6 Millionen Euro für klimafreundliche Infrastruktur und Stadtentwicklung in der Region Asien Pazifik. 76 Millionen für infrastrukturausgaben in Angola, Botswana, Kongo, komorin, lesoto, Madagaskar, maurizius und so weiter. die Liste is n bisschen länger, 30 Millionen Euro für klimafreundliche asfaltierung von Straßen in bukina faso, borundi, Benin, Botswana. also jemand, dem eine Straße in Afrika wichtiger ist als die Straße in amtsfeld, die nach Berlin reinführt, dem ist nicht zu helfen. der sollte nicht uns. regieren? der sollte nach Afrika, nach Afrika gehen und dort regieren. diese Leute haben überhaupt nichts mehr verloren im Parlament.
",Für den Straßenausbau in Brandenburg ist kein Geld da. Aber für Infrastrukturprojekte in Afrika investiert die Bundesregierung Millionen!,6045,621,31,51
