id,username,voice_to_text,video_description,view_count,like_count,comment_count,share_count
7461981388523293984,die.linke,"Frederik März will, dass die Staatsbürgerschaft rückwirkend wieder anerkannt werden kann, Karsten Lindemann will 1 Register für psychisch kranke und Julia Klöckner schreibt ganz unverhohlen auf Instagram, wer die Politik der AfD will, der hat mit der CDU eine demokratische Alternative. ich sage nichts an der AfD ist in irgendeiner Form demokratisch. und anstatt sich anzubiedern an eine Partei, die sich remigration ins Wahlprogramm schreibt, die abschiebetickets an Migrantinnen verteilt, muss man klare Kante gegen den Faschismus zeigen. in den Parlamenten und auf der Straße. während andere Parteien in der AfD nach dem Mund reden, geflüchtete zu sündenböcken machen und auf Bürgergeld Empfängern eintreten, zeigen wir klare Kante. wir betreiben nicht das Geschäft von Angst und Hetze wie CDU, FDP und bsw. wir sind das wollwerk gegen den Rechtsruck, denn wir sind konsequent antifaschistisch. wir gehen zu den Menschen, wir reden nicht nur, wir hören zu. wir waren an über 150.000 Haustüren. und das, was den Menschen besonders wichtig war, das haben wir ins Zentrum unseres Wahlkampfes gestellt, wie zum Beispiel die bezahlbaren mieten. 2021 hat Olaf Scholz plakatiert, er sei der Kanzler für faire mieten. und was ist daraus geworden? nicht mal die Zahnlose Mietpreisbremse haben sie geschafft zu verlängern. aber was wir eigentlich brauchen ist doch 1 Mietendeckel, damit die Mieten eingefroren werden können und auch gesenkt werden können. das ist es, was den Menschen wirklich hilft. und liebe Genossinnen, das haben wir schon mal geschafft, nämlich hier in Berlin mit rot, rot grün. das hat unzähligen Menschen. geholfen. die hatten am Ende des Monats mehr Geld im Portemonnaie. und was ist dann passiert? CDU und FDP, die haben geklagt gegen das Interesse der Menschen hier in Berlin, die Taschen prall gefüllt mit dem Geld der Immobilien Lobby. waren sie sich wirklich nicht zu dumm gegen bezahlbare mieten vor Gericht zu ziehen, damit ihre Freunde in den Chefetagen weiter fette Rendite mit eurer Miete machen können? haben sie geklagt. und ja, das Bundesverfassungsgericht hat gesagt, der Mietendeckel muss auf Bundesebene entschieden werden. ja dann entscheiden wir das doch. auf Bundesebene machen wir das doch. die linke bringt den Mietendeckel ins Parlament und er wird kommen, auch wenn wir in der Opposition sind. das hat schon beim Mindestlohn geklappt. warum sollte das beim Mietendeckel nicht klappen? wir machen das Leben so wieder bezahlbar. das ist links liebe genau innen. und auch das hört ihr auch immer wieder an den infoständen an den Haustüren. die steigenden Lebensmittelpreise belasten die Menschen massiv, während Die Grünen ganz dolle Bauchschmerzen haben. bei der nächsten asylrechtsverschärfung haben Menschen mit wenig Geld Bauchschmerzen, weil am Ende des Monats einfach kein Essen mehr da ist. deswegen wollen wir als Sofortmaßnahme die Mehrwertsteuer auf Grundnahrungsmittel streichen, auch auf Hygiene Produkte. und wir wollen das 9 Euro Ticket zurück. das ist konkrete Politik, die den Menschen hilft. ihr wisst, dass ich Milliardäre gerne gar nicht mehr sehen möchte, das hab ich schon oft genug gesagt. aber wir brauchen jetzt unbedingt eine Vermögenssteuer um 1. gutes Leben für die große. Mehrheit in diesem Land zu finanzieren, damit die pervers Superreichen mit ihrem leistungslosen Vermögen von 100 Millionen und Milliarden sich endlich fair an der Finanzierung der Gesellschaft beteiligt. und da geht es ja nicht nur darum, dass dieser unfassbare Reichtum ungerecht ist, sondern diese extrem reichen gefährden auch unsere Demokratie. wir sehen das doch gerade in den USA. Oligarchen wie Elon Musk, die sind die Geisel unserer Tage. das dürfen wir nicht durchgehen lassen, dass Milliardäre sich die Meinung und die Mehrheiten kaufen. niemand muss Milliardär sein. wir legen uns mit Allen hier in diesem Land, mit denen da oben an. das ist links. ohne uns im Bundestag guckt doch niemand mehr genau hin. woher wissen wir denn die ganzen Skandale der letzten Jahre? wer stellt denn immer die richtigen Fragen, bohrt nach und lässt nicht nach und bringt Informationen ans Tageslicht, was die da oben am liebsten verheimlichen wollen. ich will, dass in diesen ganzen Talkshows und rede duellen über das Elterngeld geredet wird, über unbezahlte sorgearbeit, über häusliche Pflege, über eine echte unbürokratische Kindergrundsicherung. wir sind die Stimme der großen bevölkerungsmehrheit in Deutschland im Bundestag. wir bohren nach und ohne uns würden die da oben freidrehen. wir sind wieder die linke, die die Menschen in diesem Land brauchen und verdienen. das sind unsere 3 zentralen Punkte, Mietendeckel Vermögenssteuer und wir fragen nach und kontrollieren die Regierung. alle wollen regieren, wir wollen verändern. das ist links. gemeinsam mit den Menschen in diesem Land sind wir immer noch mehr. also lasst. uns 2025 zum Wendepunkt machen. wir haben jetzt noch 36 Tage. wir gehen jetzt raus und gewinnen diese Wahl. 5 Prozent und 3 silberlocken und wir sind wieder drin im Bundestag. die Zukunft, sie ist links. das ist ja auch gemeint, dass die Partei, das Regime mich jetzt nach Heidi reden lässt, oder?
","Wir sind die soziale Stimme im Bundestag für alle, die ohne goldenen Löffel im Mund geboren wurden. Wir werden uns niemals damit abfinden, dass die Mieten immer mehr Menschen richtig die Luft abschnüren. Wir werden uns niemals damit abfinden, dass so viele Menschen hier sich den ganzen Tag krumm legen und am Ende des Monats das Geld dann doch nicht reicht, weil die Lebensmittelpreise einfach unendlich gestiegen sind. Unsere Aufgabe im nächsten Deutschen Bundestag ist klar: Druck machen für einen Mietendeckel, dafür sorgen, dass Millionäre und Milliardäre endlich ihren gerechten Anteil zur Gesellschaft beitragen und der Regierung ganz genau auf die Finger schauen. Die Zukunft ist links! @heidireichinnek @jan.van.aken7   #bundestagswahl2025 #btw2025 #DeswegenDieLinke #DieLinke #linkepolitik #deshalbdielinke",3774821,480314,8037,31733
7474250499068366102,die.linke,"wisst ihr was ich wirklich nicht mehr hören kann? ja, die linke macht grad tolle Arbeit, aber man muss trotzdem taktisch SPD oder grüne wählen, falls die linke nicht in den Bundestag kommt. und wisst ihr was ich solchen Leuten entgegne? zuallererst, warum gehst du auf Mutter? natürlich kommt die linke in den Bundestag. ich werde Friedrich Merz mindestens 4 weitere Jahre auf den Sack gehen. und wenn's das letzte ist, was ich tue. ah okay, ich hab mich beruhigt. taktisch wählen, das ist wirklich die größte Lüge, die uns gerade verkauft wird. und es ist tatsächlich auch sehr antidemokratisch. warum? na ja, der deswegen. wenn man taktisch wählt, also nicht das wählt was man eigentlich will, dann ändert sich ja nie irgendwas an den Verhältnissen. ihr wollt weniger Miete Zahlen? ihr wollt ne echte Kindergrundsicherung, die nicht nur versprochen wird, sondern auch wirklich durchgesetzt wird? ihr wollt nicht das Superreiche diesen Planeten weiter zerstören? dann ist die Taktik, die ihr verfolgen müsst, die linke zu wählen. also wirklich wer eigentlich uns wählen will und dann taktisch SPD oder grüne wählt. das ist so n bisschen so, als bist du ne Person verliebt, aber traust dich nicht die anzusprechen und am Ende kommt raus die andere Person, die war auch in dich verliebt, aber hat sich auch nicht getraut dich anzusprechen. das ist scheiße. der Aufruf Aus taktischen Gründen nicht die linke zu wählen ist nur 1. Versuch linke Politik zu verhindern. lasst euch darauf nicht 1. wer linke Politik. will muss auch die linke wählen.
","@heidireichinnek erklärt, was taktisch wählen mit eurem unerreichbaren Crush zu tun hat. Wollt ihr ein ""weiter so"" oder eine echte Veränderung? Wollt ihr Druck für einen Mietendeckel und bezahlbare Lebensmittel? Euch endlich mal mit den Milliardären anlegen? Dann ist klar: Wer linke Politik stärken will, sollte auch Die Linke wählen. #DeswegenDieLinke #DieLinke #linkepolitik #btwahl2025",3663835,523209,7102,25354
7470308828496547094,die.linke,,Ihr seid die beste Community die man sich nur wünschen kann!❤️ Gemeinsam kämpfen wir gegen den Rechtsruck und für eine solidarische Gesellschaft!  #Linke #fyp #foryourpage,3559780,427773,7273,7895
7458676036050488598,die.linke,"und sie wollen Milliardäre abschaffen? ich find interessant, dass das so ne ganz fette Überschrift auf der Website der linken ist. ja, ich find niemand muss Milliardär sein und da helfen wir ganz gerne. jetzt mal ganz im Ernst, was macht man mit ner Milliarde aufm Konto? was macht man mit dutzenden Milliarden aufm Konto? das ist ja nicht so, dass man sich das erarbeitet hat. das ist leistungsloses Einkommen, genau das, was immer kritisiert wird. da ist man Reich geboren und das Geld wird einfach mehr, aber nicht durch Zauberhand, sondern weil andere Leute dafür arbeiten. aber woran machen sie das denn fest, dass das leistungslos ist? also bei Allen, wie genau erarbeiten sie sich ne Milliarde? das würde mich mal interessieren. na ja, Milliardäre sind ja auch Unternehmer, die von den Milliarden Menschen bezahlen. ne ich find das immer total spannend, dass äh, Menschen, die niemals jemals Millionäre werden oder Milliardäre werden, die so leidenschaftlich verteidigen. vielleicht wären wir das ja nur. ja ganz sicher wird das. ich drück auf jeden Fall die Daumen. aber äh, die Wahrscheinlichkeit ist eher gering, denn diese Milliarden, die sich da aufschichten, das kommt auch über Erbschaften beispielsweise nicht vernünftig besteuert werden, das kommt über Ausbeutung von arbeiten, denn das ist nun mal einfach so. also wenn ich Mir Mein durchschnittsgeld in der Jugendhilfe anschaue, ne da war ich vielleicht bei 19 Netto. wenn ich so rechne, wie Lange ich dafür ne 1.000.000 allein brauche, ich glaub da bin ich dann schon. Lange in Rente und von ner Milliarde muss ich gar nicht erst anfangen. also warum wollen wir denn nicht gemeinsam die Leute entlasten, die wirklich hart arbeiten in diesem Land, sei es erwerbsarbeit oder Pflege und sorgearbeit und dazu greifen, wo die Leute sich bisher Aus der Verantwortung stehen. Eigentum verpflichtet steht im Grundgesetz. wir helfen gerne dieser Verpflichtung nachzukommen.
","Milliardäre ABSCHAFFEN?! Wohlstand für alle statt Reichtum für wenige! @Heidi Reichinnek, MdB  #fyp #foryourpage #Linke",2750643,320233,9100,18999
7466151357691464992,die.linke,"Mein Name ist Heidi reicheneck und ich bin Gregor Gisi. wir sind ja beide viel im sogenannten Internet unterwegs und sie werden es nicht glauben. wir lesen sogar ihre Kommentare. zumindest lasse ich sie lesen und Mir dann erzählen. und eine Art von Kommentaren hören wir besonders häufig. ich liebe Heidi reiche Neck, aber sie ist in der falschen Partei. der Gisi, der ist super, alles was der sagt, ist einfach richtig. aber der ist in der falschen Partei. dazu möchten wir uns äußern. sind wir nicht? ne wirklich? natürlich vertreten wir beide nich hundertprozentig alle Inhalte unserer Partei. wir sind schließlich linke und eine solche Partei gibt es nich. es sei denn, man gründet sie selbst, man nennt sie nach sich selbst und man kontrolliert alles, was dort geschieht. nur das ist dann keine Partei, sondern eher eine Sekte. aber unsere Werte, die vertritt die linke. wer Gregor und mich mag, der mag uns vielleicht als Person. das freut uns sehr. aber der mag vor allem auch die Position, die wir vertreten. und das sind nun mal die Positionen der linken. dafür stehen wir mit unserem Namen und halten unsere Gesichter hin. und deshalb wählen wir am 23.februar.2025 die linke. machen sie mit. als Höhepunkt können sie sogar eintreten bei uns. auf jeden Fall sollten wir gemeinsam für eine bessere Bundesrepublik Deutschland streiten, sonst macht's ja wieder keiner.
","Sind Heidi und Gregor in der falschen Partei? Nope ❌ Wir sagen: Wer Merz Kontra geben will, kommt jetzt zur Linken! Gemeinsam mit @gregorgysi48, @inesschwerdtner, @heidireichinnek und @jan.van.aken7 und mittlerweile über 68.000 Mitgliedern! Seit Oktober 2023 sind über 25.000 Menschen eingetreten. Wir brauchen auch dich bei uns! Wir sind die konsequent antifaschistische Kraft. Wir bekämpfen den Faschismus in den Parlamenten, auf der Straße. Doch es geht um mehr, wir müssen mit konsequenter Umverteilung der wirtschaftlichen Grundlagen des Rechtsrucks angehen. Wir wollen den Mietendeckel durchsetzen und Lebensmittelpreise begrenzen. Wir müssen um unsere Zukunft kämpfen und neue Hoffnung auf ein besseres Leben für alle Menschen schöpfen. #DeshalbDieLinke",2365423,382000,6830,14405
