id,create_time,text,like_count,reply_count,parent_comment_id,video_id,sentiment
7456271093067645718,2025-01-05 03:41:37,httpswwwecho24delebenverbraucherstromalarmfreitagmorgenengpassstromgedachtbadenwuerttembergladennetzueberlastung93495710htmlgoogle_vignette,0,0,7456123329078938902,7456123329078938902,negative
7456227538966004502,2025-01-05 00:51:31,Sie sind für mich noch viel schlimmer als damals das ZKD SED ,0,0,7456123329078938902,7456123329078938902,negative
7456218790662980374,2025-01-05 00:17:29,Na Frau Badum dann erläutern Sie doch mal warum D laut UBA in 2024 aus RUS 70 mehr Uran importiert hat als 2023 Und warum fällt Uran nicht unter das RUSEmbargo  Naaaa,0,0,7456123329078938902,7456123329078938902,neutral
7456201589997945622,2025-01-04 23:10:33,Immer Pippi Langstrumpf,0,0,7456123329078938902,7456123329078938902,negative
7456197090877965078,2025-01-04 22:53:13,ich hätte nie gedacht das ich das schreib und Grüne lobe aber ich muß sagen gut erklärt alles richtig,0,0,7456123329078938902,7456123329078938902,positive
7456190934489907990,2025-01-04 22:29:07,Na immerhin wird die Existenz einer Dunkelflaute nicht mehr mit Irgendwo weht immer ein Wind bestritten,0,0,7456123329078938902,7456123329078938902,neutral
7456181155433579286,2025-01-04 21:51:19,Zusammengefasst wir importieren Strom damit wir grüne gut da stehen können und unsere Ideologie die nicht funktioniert umsetzen Wie es weiter geht haben wir noch keinen Plan,0,1,7456123329078938902,7456123329078938902,negative
7456179321213453078,2025-01-04 21:44:09,TeamHabeck Habeck4Kanzler CSUverhindern Merzverhindern FDPverhindern Söderverhindern AfDverhindern CDUverhindern,0,0,7456123329078938902,7456123329078938902,negative
7456152968535065366,2025-01-04 20:01:46,von unserem Steuergeld Strom dazu käufen weil ihr Grünen Träume habt ich sage nur Insolvenz ,0,0,7456123329078938902,7456123329078938902,neutral
7456152367017673494,2025-01-04 19:59:28,mir egal kein Strom keine Arbeit kein Problem,0,0,7456123329078938902,7456123329078938902,negative
7456147070388536086,2025-01-04 19:39:02,Grüne Superwirtschafts Plan Also wir kaufen lieber wie selber zu verkaufen sehr wirtschaftlich,0,5,7456123329078938902,7456123329078938902,negative
7456300373470544662,2025-01-05 05:35:22,Früher hatten wir keine Dunkelflaute Ein c,0,2,7456123329078938902,7456123329078938902,neutral
7461004218040976150,2025-01-17 21:47:42,Gasspeicher leer Rücklagenkonto der Krankenkassen leer Mit der Union ging und geht es bergab,218,1,7460970173848227094,7460970173848227094,negative
7461004530025546518,2025-01-17 21:48:44,völlig irrsinniger Untersuchungsausschuss mit dem die Union sich lächerlich gemacht hat,153,13,7460970173848227094,7460970173848227094,negative
7461030998810297110,2025-01-17 23:32:04,Super Wahlwerbung für Habeck unfassbar wie alle gegen ihn hetzen,104,20,7460970173848227094,7460970173848227094,negative
7461101903703786262,2025-01-18 04:10:35,nie wieder grün ist jetzt,83,0,7460970173848227094,7460970173848227094,negative
7461002192607806230,2025-01-17 21:39:56,Die Union müsste die Kosten für den Untersuchungausschuss selbst bezahlen,74,6,7460970173848227094,7460970173848227094,neutral
7461123421726196502,2025-01-18 05:34:59,Team Habeck ,60,1,7460970173848227094,7460970173848227094,negative
7460978318248379158,2025-01-17 20:07:28,Das alles spielt doch auch überhaupt keine Rolle mehr Erneuerbare sind sehr erfolgreich mit Speichertechnik geht s voran In Erlangen gibt s eine tolle Firma Sowas muss man fördern,50,7,7460970173848227094,7460970173848227094,negative
7460975652096836374,2025-01-17 19:56:56,Ich glaube denen kein Wort,50,16,7460970173848227094,7460970173848227094,negative
7461210212948345622,2025-01-18 11:07:14,Es ist wirklich Unglaublich die Union mit ihrer ewigen Stillstandpolitik hat Deutschland Kaputt gespart Jetzt ist Bewegung drin den Leuten geht es zu langsam und wollen wieder Union wählen,40,2,7460970173848227094,7460970173848227094,negative
7461128119564321558,2025-01-18 05:51:39,so ist es Es bekommt viel zu wenig mediale Aufmerksamkeit wie die cdu sich hier wieder blamiert hat Aber naja BILD und co berichten nur wenn wenn es den Grünen schaden kann,40,3,7460970173848227094,7460970173848227094,negative
7461142610490163990,2025-01-18 06:46:03,Darum ,25,0,7460970173848227094,7460970173848227094,negative
7460971900817687318,2025-01-17 19:42:22,und ich habe das Ergebnis grüner Politik es ist unerträglich teuerer,23,108,7460970173848227094,7460970173848227094,negative
7461148948591133462,2025-01-18 07:10:27,Der Atomausstieg ob richtig oder falsch sei dahingestellt wurde ja auch unter der CDU beschlossen,22,6,7460970173848227094,7460970173848227094,neutral
7461183125802435350,2025-01-18 09:22:31,Danke für euren leidenschaftlichen Einsatz ,21,0,7460970173848227094,7460970173848227094,positive
7461217693934043926,2025-01-18 11:36:15,die Grünen merken wieder gar nichts Da ist nur Luft zwischen den Ohren,20,6,7460970173848227094,7460970173848227094,negative
7461108341995029270,2025-01-18 04:38:30,Er ist überhaupt nicht entlastet,20,0,7460970173848227094,7460970173848227094,neutral
7461110515151356694,2025-01-18 04:44:21,Mit bashing gewinnt man keine Wahlen,19,8,7460970173848227094,7460970173848227094,neutral
7461248394980475670,2025-01-18 13:35:06,"Die UNION hat doch das Kernkraft Aus beschlossen und bis auf 3Kraftwerke auch umgesetzt
wieso ist derHabek daran Schuld",17,4,7460970173848227094,7460970173848227094,neutral
7461385606155174679,2025-01-18 22:27:47,Habeck bitte sofort in Sicherheitsverwahrung,16,1,7460970173848227094,7460970173848227094,negative
7461563762580816662,2025-01-19 09:59:13,Niemals grün ,15,1,7460970173848227094,7460970173848227094,negative
7461140294642418454,2025-01-18 06:36:43,Was macht das Geld bei Northvolt,13,32,7460970173848227094,7460970173848227094,negative
7461128495596733206,2025-01-18 05:53:36,Wo ist jetzt die Bildzeitung,13,0,7460970173848227094,7460970173848227094,negative
7461101431735567126,2025-01-18 04:09:16,niemals grün ,12,0,7460970173848227094,7460970173848227094,negative
7461307143268123414,2025-01-18 17:23:22,Habeck4kanzler ,11,0,7460970173848227094,7460970173848227094,negative
7461247357797319446,2025-01-18 13:31:35,habeck4kanzler ,11,1,7460970173848227094,7460970173848227094,negative
7461299822823408406,2025-01-18 16:54:43,Gut  das Robert so souverän ist  8 bis 9 Stunden Befragung ist ja ein Horror  Armer Habeck  aber er bleibt und ist ja cool ,10,1,7460970173848227094,7460970173848227094,positive
7461194836550517527,2025-01-18 10:07:29,Und man darf nicht vergessen das er dann alles durch seinen Dilettantismus noch verschärft hat  danke für nichts ,10,0,7460970173848227094,7460970173848227094,neutral
7461183131836941078,2025-01-18 09:22:05,Team Habeck ,10,0,7460970173848227094,7460970173848227094,negative
7460974786103132950,2025-01-17 19:53:17,Keine Populisten oder Lobbyisten im Bundestag keine Stimme für AfD CDUCSU FDP und BSW in der anstehenden Wahl Habeck for Kanzler,10,2,7460970173848227094,7460970173848227094,negative
7461187823934259990,2025-01-18 09:40:40,Klarer Fall von This meeting could have been an email ,9,0,7460970173848227094,7460970173848227094,neutral
7461185792821838614,2025-01-18 09:32:55,Was hat dieser unsinnige Untersuchungsausschuss gekostet ,9,3,7460970173848227094,7460970173848227094,neutral
7461159767990698774,2025-01-18 07:51:38,Joa und keine Zeitung berichtet drüber,9,6,7460970173848227094,7460970173848227094,negative
7461295295617172226,2025-01-18 16:37:12,War eh nur ein Angriff um Wählerstimmen zu beeinflussen Der csu ging es eh nicht um die Wahrheit,7,0,7460970173848227094,7460970173848227094,negative
7461197663301092118,2025-01-18 10:18:31,Genau so sah es aus,7,0,7460970173848227094,7460970173848227094,positive
7461182407590642454,2025-01-18 09:19:39,das Endergebnis ist doch noch überhaupt nicht verfasst worden wie könnt ihr euch da so sicher sein das er euch nicht noch auf die Füße fällt,7,26,7460970173848227094,7460970173848227094,neutral
7461203825119429398,2025-01-18 10:42:22,Der Untersuchungsausschuss konnte nicht beweisen dass Habeck selbst manipuliert hat oder Anweisungen gab Aber die Fakten wurden verändert von MA des Ministeriums,6,3,7460970173848227094,7460970173848227094,neutral
7461193800309375766,2025-01-18 10:03:27,Was wettert Ihr gegen die CDUmit denen Ihr doch sowieso koaliert,6,18,7460970173848227094,7460970173848227094,negative
7460973258943546134,2025-01-17 19:47:23,schon bei Lanz nicht die Wahreheit gesagt,6,0,7460970173848227094,7460970173848227094,negative
7461319141816468226,2025-01-18 18:09:35,Die gesamte Union ist ein Flopp,5,0,7460970173848227094,7460970173848227094,negative
7461234620451242774,2025-01-18 12:42:17,habeck und Weitblick ,5,5,7460970173848227094,7460970173848227094,positive
7461195187504988950,2025-01-18 10:09:15,War doch nicht anders zu erwarten  habeck4kanzler,5,0,7460970173848227094,7460970173848227094,negative
7461188400223257366,2025-01-18 09:42:49,Richtig,5,0,7460970173848227094,7460970173848227094,positive
7460979101673243414,2025-01-17 20:10:26,Da hat der Leiter des Untersuchungsausschusses aber was anderes gesagt,5,42,7460970173848227094,7460970173848227094,neutral
7460972570167296790,2025-01-17 19:44:38,,5,0,7460970173848227094,7460970173848227094,negative
7461638158652982038,2025-01-19 14:47:31,Auf welchen Titelseiten wird das jetzt täglich erscheinen,4,0,7460970173848227094,7460970173848227094,neutral
7461310934394323734,2025-01-18 17:38:04,Das war sowieso schon absurd dieser UAusschuss,4,0,7460970173848227094,7460970173848227094,negative
7461263657373221654,2025-01-18 14:34:24,Es war wie erwartet ein populistisches Wahlkampfmanöver der CDUCSU mit dem Ziel Robert Habeck zu diskreditieren und den Grünen für diese Wahl das Genick zu brechen Es ist ihnen sauber auf die Füße gefallen ich hoffe sie bekommen es auch bei der Wahl auf ihrer Prozenterechnung abgezogen ,4,0,7460970173848227094,7460970173848227094,negative
7461251718316393238,2025-01-18 13:48:02,War doch klar das keiner die Schuld hat  unsere Politiker haben das vorher schon gemanagt,4,1,7460970173848227094,7460970173848227094,negative
7461226866814026518,2025-01-18 12:11:45,Vollkommen richtig,4,0,7460970173848227094,7460970173848227094,positive
7461203298536768278,2025-01-18 10:40:12,scheinuntersuchung,4,0,7460970173848227094,7460970173848227094,negative
7461187487001182998,2025-01-18 09:39:07,Wer genau hat untersucht Die wahrheit kommt schon noch raus,4,4,7460970173848227094,7460970173848227094,neutral
7461085041688101654,2025-01-18 03:07:55,die AFD und die CDU machen sich nur lächerlich mit Atomstrom usw ,4,0,7460970173848227094,7460970173848227094,negative
7461027362190328598,2025-01-17 23:18:22,in der schwierigsten Situation für Deutschland wegen GasEnergiemangel schaltet er die Atomkraftwerke ab,4,113,7460970173848227094,7460970173848227094,neutral
7460983220172849942,2025-01-17 20:26:13,,4,0,7460970173848227094,7460970173848227094,negative
7460973624569955094,2025-01-17 19:48:55,Die Gasspeicher sind Ende 2021 zu 70 gefüllt gewesen was ist für Sie leer  Und der Abschlussbericht ist doch noch nicht erstellt oder doch,4,7,7460970173848227094,7460970173848227094,neutral
7461696064413221654,2025-01-19 18:32:13, also im Interview hat der Leiter der Kommission bestätigt dass Habeck bewusst gelogen hat,3,3,7460970173848227094,7460970173848227094,neutral
7461302036869645078,2025-01-18 17:03:15,,3,0,7460970173848227094,7460970173848227094,negative
7461242182047253270,2025-01-18 13:11:31,Jetzt sagt der söder bestimmt das hat ja auch die Union vorbereitet,3,0,7460970173848227094,7460970173848227094,neutral
7461206148153213698,2025-01-18 10:51:37,Das ist die Bestätigung dass Habeck ein starker und kompetenter Wirtschaftsminister ist ,3,0,7460970173848227094,7460970173848227094,neutral
7461089998910407446,2025-01-18 03:26:08,ich muss gleich brechen ,3,0,7460970173848227094,7460970173848227094,negative
7461004179273696022,2025-01-17 21:47:46,,3,0,7460970173848227094,7460970173848227094,negative
7460985282365489942,2025-01-17 20:34:15,Na immerhin hat doch ein CSUMdB doch von Robert Habeck erfahren dass Habeck mindestens zweimal gegen AKWs demonstriert hat für mich ein Grund Habeck zu wählen,3,1,7460970173848227094,7460970173848227094,neutral
7461988582372197142,2025-01-20 13:27:52, habeck4kanzler ,2,0,7460970173848227094,7460970173848227094,negative
7461747294984667926,2025-01-19 21:51:17,Habeck kann Politisch garnichst,2,0,7460970173848227094,7460970173848227094,neutral
7461624744875180822,2025-01-19 13:55:44,Wie beim Olaf ,2,0,7460970173848227094,7460970173848227094,negative
7461382646983099159,2025-01-18 22:16:34,Dieser Untersuchungsausschuss war doch eh nur Wahlkampfgetöse CDUCSU und FDP haben sich in den Augen der Fachleute bis auf die Knochen blamiert mit Inkompetenz,2,0,7460970173848227094,7460970173848227094,negative
7461337918671192854,2025-01-18 19:22:35,unfassbar,2,0,7460970173848227094,7460970173848227094,negative
7461296823014146838,2025-01-18 16:43:00,Wo war die ergebnisoffene Prüfung unter Merkel,2,0,7460970173848227094,7460970173848227094,neutral
7461284907887117078,2025-01-18 15:57:21, Was für ein Zufall der Brunnen ist sehr tief und bei vielen anderen,2,0,7460970173848227094,7460970173848227094,neutral
7461247148680741654,2025-01-18 13:30:19,Die Union hat was Gutes gemacht als sie nach Fukushima endlich den Atomausstieg beschlossen hat Dass sie jetzt der Ukraine besser helfen will ist auch positiv Sonst gibts nichts positives an C,2,0,7460970173848227094,7460970173848227094,negative
7461212401783227158,2025-01-18 11:15:33,Oh man,2,0,7460970173848227094,7460970173848227094,negative
7461195949302448919,2025-01-18 10:11:37,Bitte nicht von den Kosten reden wieviel hat er an unseren Steuergeldern sinnlos rausgeworfen Oh ja und deshalb dürfen wir Bürger jetzt von Nachbarnländern teuer Strom beziehen weil kaum Sonne und Wind im Winter Gibt Übernimmst du die Mehrkosten für uns wenns so toll ist Ach ja und Unterlagen kann man so manipulieren das es wieder stimmt,2,3,7460970173848227094,7460970173848227094,negative
7461072070860981014,2025-01-18 02:14:11,leidet Deutschland an einer Demenz Vor 5 Jahren waren Atomkraftbefürworter noch eine winzige Minderheit,2,0,7460970173848227094,7460970173848227094,neutral
7461014487890887446,2025-01-17 22:27:40,,2,0,7460970173848227094,7460970173848227094,negative
7461005869640155926,2025-01-17 21:54:00,"laufzeitverlängerungen für Atomkraftwerke hätten zu keinem Zeitpunkt Sinn ergeben
übrigens waren auch die Laufzeitverlängerungen 2010 ein teurer Irrweg unter schwarzgelb",2,0,7460970173848227094,7460970173848227094,neutral
7461000587289690903,2025-01-17 21:33:48,Kann es nicht mehr hören,2,3,7460970173848227094,7460970173848227094,negative
7460999340262163222,2025-01-17 21:28:31,nie wieder CDU CSU und FDP ,2,0,7460970173848227094,7460970173848227094,negative
7460985177156027158,2025-01-17 20:33:45,Typisch grün mit ihren Halbwahrheiten Das Ergebnis des Untersuchungsausschuss ob Ergebnis offen oder ideologisch ist blieben unbeantwortet,2,0,7460970173848227094,7460970173848227094,neutral
7460984857008947990,2025-01-17 20:32:47,Wie indoktriert kann man sein ,2,1,7460970173848227094,7460970173848227094,negative
7462826066836390678,2025-01-22 19:37:22,selten war so ein Ergebnis an der Untersuchung durch die bestehenden Fakten schon vorher klar Taktik der CDU war wohl Dreck schmeisen und hofft sie das was hängen bleibt,1,0,7460970173848227094,7460970173848227094,negative
7462032982392587030,2025-01-20 16:19:41,Die Union hat doch nur nach einer weiteren Möglichkeit gesucht und auch gefunden Unsummen an Steuergeldern sinnlos zu verbrennen und Robert Habeck von seiner wichtigen Arbeit abzuhalten,1,0,7460970173848227094,7460970173848227094,neutral
7462009476838458134,2025-01-20 14:48:29,wir klären das bei der Wahl,1,0,7460970173848227094,7460970173848227094,neutral
7461769718522610454,2025-01-19 23:19:08,Was ist eine Insolvenz,1,2,7460970173848227094,7460970173848227094,negative
7461763239375323926,2025-01-19 22:53:31,diese Irren müssen raus aus der Politik,1,0,7460970173848227094,7460970173848227094,neutral
7461761942416966422,2025-01-19 22:48:25,Das macht Angst,1,0,7460970173848227094,7460970173848227094,negative
7461697794136113942,2025-01-19 18:39:00,Ist ja auch nicht Eure Kohle,1,0,7460970173848227094,7460970173848227094,negative
7461654090663330582,2025-01-19 15:49:50,Wo war diie Entlastung,1,0,7460970173848227094,7460970173848227094,negative
7461633860452369174,2025-01-19 14:30:59,"Tja Ein weiterer Versuch die Grünen vot der Wahl madig zu machen wie vorhersehbar ist gescheitert
Vielleicht sind die Grünen ja doch so vertrauenswürdig wie viele befürchten ",1,1,7460970173848227094,7460970173848227094,negative
7461621559561126678,2025-01-19 13:43:18,Zusammenfassung von 400 Windstrom Studien Windstrom ist top Ganz neu httpswwwsciencedirectcomsciencearticlepiiS2542435124005130via3Dihub,1,0,7460970173848227094,7460970173848227094,neutral
7461617030513558294,2025-01-19 13:25:35,httpswwwzeitdepolitikausland202303frankreichatomkraftakweuratutm_sourceperplexity Der französische Atomstrom wird mit franz und europäischen Steuergeldern stark subventioniert,1,0,7460970173848227094,7460970173848227094,neutral
7461616242299880214,2025-01-19 13:22:49,Mit einer verfehlten Energiepolitik wird die AfD Deutschland schweren Schaden zufügen Atomstrom ausbauen Wind und PhotovoltaikStrom zurückbauen Siehe weitere Kommentare,1,0,7460970173848227094,7460970173848227094,neutral
7461616147366740738,2025-01-19 13:22:24,In Frankreich wird der Atomstrom 70 Anteil hoch subventioniert Der Energieversorger EDF hat trotzdem hohe Schulden Privatpreis 180224  252 Cent Deutschland zum Vergleich  285 Cent,1,0,7460970173848227094,7460970173848227094,neutral
7461616009152267031,2025-01-19 13:22:02,Der Betreiber der 56 KKWs in Frankreich EDF war eine Aktiengesellschaft und wurde mit hohen Schulden verstaatlicht Der Atomstrom wird jetzt subventioniert,1,0,7460970173848227094,7460970173848227094,neutral
7461615993568609046,2025-01-19 13:21:36,England drei KKW Neubauprojekte zwei davon aus wirtschaftlichen Gründen eingestellt Hinkley Point C Baubeginn 2017 Plankosten 7 Milliarden  Stand heute 56 Milliarden  Fertigstellung 2031,1,0,7460970173848227094,7460970173848227094,neutral
7461615873951302422,2025-01-19 13:21:10,httpsenwikipediaorgwikiHinkley_Point_C_nuclear_power_station,1,0,7460970173848227094,7460970173848227094,negative
7461615858751079190,2025-01-19 13:21:06,httpswwwccomptesfrfrpublicationslafiliereeprunedynamiquenouvelledesrisquespersistants,1,0,7460970173848227094,7460970173848227094,negative
7461615774769054487,2025-01-19 13:20:41,httpsdirkspechtde202501derfranzoesischerechnungshofverlangtnichtsgeringeresalsdieaussetzungallerkernkraftplaene,1,0,7460970173848227094,7460970173848227094,negative
7461604241594893078,2025-01-19 12:36:15,never grün,1,0,7460970173848227094,7460970173848227094,negative
7461406211742335766,2025-01-18 23:48:14,Die CDU sprich Friedrich Merz hat ja noch ein anderes Thema gefunden dass jetzt auf die Spareinlagen der kleinen Leute Krankenkasse etc bezahlt werden soll Also das selbe wie beim GEG,1,0,7460970173848227094,7460970173848227094,neutral
7461373107631162134,2025-01-18 21:38:59,"Na hat man einem Abgeordneten aus Berlin sexuelle Belästigung unterstellt um ihn abzusägen und dem Wahlkampfmanager einen sicheren Listenplatz zu verschaffen
Der HabeckClan ",1,0,7460970173848227094,7460970173848227094,neutral
7461315703648551702,2025-01-18 17:56:14,,1,0,7460970173848227094,7460970173848227094,negative
7461308337205527318,2025-01-18 17:27:52,,1,0,7460970173848227094,7460970173848227094,negative
7461296028354282262,2025-01-18 16:40:26,,1,0,7460970173848227094,7460970173848227094,negative
7461237016773575446,2025-01-18 12:51:07,Blaaaaa blaaaaaa blubber,1,0,7460970173848227094,7460970173848227094,negative
7461205655308829462,2025-01-18 10:49:41,Es würde doch ganz einfach eine kleine Anfrage durch einen Abgeordneten helfen festzustellen wie viel wir noch für den verbrauchten Atomstrom heute noch bezahlen müssen und morgen,1,0,7460970173848227094,7460970173848227094,neutral
7461184469081735958,2025-01-18 09:27:22,was ist mit der Vielzahl von geschwärzten Dokumenten aus dem Ministerium,1,1,7460970173848227094,7460970173848227094,neutral
7461181848199414550,2025-01-18 09:17:00,Ihr hättet niemals mitregieren dürfen  ,1,0,7460970173848227094,7460970173848227094,neutral
7461174336583435030,2025-01-18 08:48:26,,1,0,7460970173848227094,7460970173848227094,negative
7461164271733949206,2025-01-18 08:09:14,,1,0,7460970173848227094,7460970173848227094,negative
7461123280692249377,2025-01-18 05:30:44,Ihr seit dabei eine Diktatur aufzubauen Ich hoffe ihr werden nie wieder mitregieren,1,1,7460970173848227094,7460970173848227094,neutral
7461115135459214102,2025-01-18 05:03:55,Habeck4Kanzler für die Zukunft ,1,0,7460970173848227094,7460970173848227094,neutral
7461099129659589398,2025-01-18 04:04:49,,1,0,7460970173848227094,7460970173848227094,negative
7461099003540357910,2025-01-18 04:01:43,zu welchem Preis,1,0,7460970173848227094,7460970173848227094,negative
7461082156216582934,2025-01-18 02:56:24,Sie können einfach mit dem Lügen nicht aufhören  cringe af,1,0,7460970173848227094,7460970173848227094,negative
7461061485520208662,2025-01-18 01:32:55,,1,0,7460970173848227094,7460970173848227094,negative
7461030587869086486,2025-01-17 23:30:30,klar war diese Entscheidung ideologisch ,1,2,7460970173848227094,7460970173848227094,neutral
7461004842023437078,2025-01-17 21:50:06,dass nichts an dem ohnehin fragwürdigen Vorwurf dran ist hat schon die journalistische und juristische Auseinandersetzung zwischen cicero und volksverpetzer deutlich gemacht,1,0,7460970173848227094,7460970173848227094,neutral
7460993569018020630,2025-01-17 21:06:20,"            
 

     
          
               ",1,0,7460970173848227094,7460970173848227094,negative
7460985366259860246,2025-01-17 20:34:33,war ja klar da da nix rauskommt war ja nix,1,0,7460970173848227094,7460970173848227094,negative
7460973009894916886,2025-01-17 19:46:24,wers glaubt ,1,1,7460970173848227094,7460970173848227094,negative
7479660691013403414,2025-03-09 04:25:08,Wo und wer  Warum  was hat Madam dafür erhalten Wer ist sie ,0,0,7460970173848227094,7460970173848227094,neutral
7473805099615453974,2025-02-21 09:42:04,Diese Ermittlungsverfahren hatte nur den Sinn Populismus zu betreiben  damit die rechten Mal wieder faktenfreie lügen verbreiten konnten,0,0,7460970173848227094,7460970173848227094,neutral
7471651853388235542,2025-02-15 14:26:03,Die Union wollte den Menschen einfach nochmal klar machen dass Robert Habeck die mit Abstand beste Option ist,0,0,7460970173848227094,7460970173848227094,neutral
7470207108790420246,2025-02-11 16:59:35,Ehrenmann ,0,0,7460970173848227094,7460970173848227094,neutral
7468583708849996566,2025-02-07 08:00:22,Nein habt ihr nicht,0,0,7460970173848227094,7460970173848227094,negative
7467500034678899478,2025-02-04 09:54:55,Olaf wurde auch vernommen konnte sich nicht erinnern ,0,0,7460970173848227094,7460970173848227094,neutral
7466834341462246146,2025-02-02 14:51:21,Kurz bevor die Grünen die Union im Bundestag attackiertenweil sie Stimmen der AfD in Kauf nahmmachten sie in ApoldaThüringen mit der AfD gemeinsame Sache HEUCHLER,0,0,7460970173848227094,7460970173848227094,negative
7463496302799389462,2025-01-24 14:58:27, hatte vermutlich auch alle Details vergessen,0,0,7460970173848227094,7460970173848227094,negative
7463479206614336278,2025-01-24 13:51:51,Ich hätte ihn auch gleich eingesperrt diesen ,0,0,7460970173848227094,7460970173848227094,neutral
7463398717049488150,2025-01-24 08:40:43,Eine Riesenblamage ist diese realitätsfremde Migrationspolitik der Grünen aber euren Denkzettel bekommt ihr am 2302 wie sagte Fr GöhringE Deutschland wird sich verändern,0,0,7460970173848227094,7460970173848227094,neutral
7463115487389582102,2025-01-23 14:20:48,,0,0,7460970173848227094,7460970173848227094,negative
7463048513170146070,2025-01-23 10:00:57,Man sieht es Ihnen immer an,0,0,7460970173848227094,7460970173848227094,neutral
7462753897548743446,2025-01-22 14:57:26,Wie kann man nur so Lügen,0,0,7460970173848227094,7460970173848227094,negative
7462742773872984854,2025-01-22 14:14:23,was ist mit Nordvolt und den grünen Projekten in China die nicht vorhanden sind,0,0,7460970173848227094,7460970173848227094,neutral
7462674780824126230,2025-01-22 09:50:52,,0,0,7460970173848227094,7460970173848227094,negative
7462616486994674454,2025-01-22 06:04:58,gut vertuscht,0,0,7460970173848227094,7460970173848227094,positive
7462611678058283798,2025-01-22 05:47:33,Uns gehts in diesem Land so schlecht ,0,0,7460970173848227094,7460970173848227094,negative
7462451362715206422,2025-01-21 19:23:04,Riesen Blamagen hat Robert schon genug gesammelt eine mehr oder weniger macht keinen Unterschied ,0,0,7460970173848227094,7460970173848227094,neutral
7462203619656762134,2025-01-21 03:27:48,Das stellt dich zwar völlig anders dar aber interpretieren lässt sich alles,0,0,7460970173848227094,7460970173848227094,neutral
7462094026055140118,2025-01-20 20:16:44,"Glaube auf euch kommen noch ganz andere Probleme zu
Gelbhaar",0,0,7460970173848227094,7460970173848227094,negative
7462081256781562646,2025-01-20 19:27:06, das ist die Auffassung der linksgrünen Nie wieder grün,0,0,7460970173848227094,7460970173848227094,neutral
7462076628118799126,2025-01-20 19:08:56,Bei Betrachtung der letzten 24 Jahre und entsprechenden Uausschüße fällt mir keiner ein wo etwas Poduktives außer einer guten schow rauskam Parteiübergreifend,0,0,7460970173848227094,7460970173848227094,neutral
7462065630192616214,2025-01-20 18:26:25,Blamage mit dem Skandal Gelhaar,0,0,7460970173848227094,7460970173848227094,negative
