id,create_time,text,like_count,reply_count,parent_comment_id,video_id,sentiment
7467608994161410838,2025-02-04 16:57:18,Kurz vor der Bundestagswahl entbrennt bei den Grünen ein heftiger Streit über die Migrationspolitik Kanzlerkandidat Robert Habeck sieht sich massiver Kritik aus den eigenen Reihen ausgesetzt ,0,0,7466807742892641558,7466807742892641558,neutral
7467590986321412886,2025-02-04 15:47:59,Warum wird die Rassistische Ukrainische Regierung Unterstützt die Jahre lang die Russische Minderheit in der Ukraine unterdrückt hat Wer sind nun die Faschisten die Altpateien und ihre Wähler,0,0,7466807742892641558,7466807742892641558,negative
7467588550260376342,2025-02-04 15:38:17,Hoffentlich 5 am 2302 ,0,0,7466807742892641558,7466807742892641558,negative
7467577358481670934,2025-02-04 14:54:55,ihr brecht jeden Tag eure Versprechen  Aber so seid ihr ja schon immer,0,0,7466807742892641558,7466807742892641558,negative
7467576562114036502,2025-02-04 14:52:02,Die Grünen sollten sehr sehr still sein,0,0,7466807742892641558,7466807742892641558,neutral
7467569206868951830,2025-02-04 14:23:25,Also ich habe die Zeitungen gelesen und Merz sagte es würde ne Brandmauer gegen die AFD geben und danach sagte er er hätte das Wort Brandmauer nie benutzt ,0,0,7466807742892641558,7466807742892641558,neutral
7467563622261392150,2025-02-04 14:01:28,Wer grün wählt muss Deutschland echt hassen,0,0,7466807742892641558,7466807742892641558,negative
7467561229374325527,2025-02-04 13:52:19,Tolle Frage,0,0,7466807742892641558,7466807742892641558,positive
7467561046910239511,2025-02-04 13:51:52,Hoffentlich seid ihr bald Geschichte ,0,0,7466807742892641558,7466807742892641558,neutral
7467547778707063575,2025-02-04 13:00:12,Klassensprecher 10Klasse mehr nicht,0,0,7466807742892641558,7466807742892641558,positive
7467533546224386838,2025-02-04 12:04:55,,0,0,7466807742892641558,7466807742892641558,negative
7467532074292609814,2025-02-04 11:59:19,Die Frage hat er oft genug beantwortet es geht ja auch nur noch um Diffamierung,0,0,7466807742892641558,7466807742892641558,neutral
7467527192617812738,2025-02-04 11:40:18,Wenn man sich die Wahl Umfragen ansieht einfach mal die AFD ausblenden Was soll Dan regieren Ampel 20  Was würdet ihr euch für eine Regierung wünschen ,0,0,7466807742892641558,7466807742892641558,negative
7467525757444047638,2025-02-04 11:34:47,Um fair zu sein Die AfD wird immer beliebter Man muss sie nicht mögen Aber zuhören sollte man mal Je mehr man sie ausschließt desto schlimmer wird es,0,0,7466807742892641558,7466807742892641558,negative
7467524712374846230,2025-02-04 11:30:55,Schließen Sie aus mit der CDU zu arbeiten,0,0,7466807742892641558,7466807742892641558,neutral
7467522478387643158,2025-02-04 11:22:07,Reines TrumpNiveau von Merz  in allen Belangen Dieser Mann ist gefährlich,0,0,7466807742892641558,7466807742892641558,negative
7467518653748937494,2025-02-04 11:07:26,hat er die Antwort auf seine eigene Frage nicht verstanden ,0,0,7466807742892641558,7466807742892641558,neutral
7467517766292390678,2025-02-04 11:03:48,,0,0,7466807742892641558,7466807742892641558,negative
7467517227404935958,2025-02-04 11:02:13,diese Augen sprechen Bände  und das kommt nicht vom Klimawandel ,0,0,7466807742892641558,7466807742892641558,neutral
7467511741578412822,2025-02-04 10:40:57,er hat sich doch mit dieser ekelhAfDen Partei eine Mehrheit verschafft Himmel sei Dank ist es dann doch noch anders gekommen durch eindeutige Bekenntnisse,0,0,7466807742892641558,7466807742892641558,neutral
7467510579936412438,2025-02-04 10:36:21,Wer selbst nichts kannder versucht andere schlecht zu machen War immer soist sowird auch immer so sein,0,0,7466807742892641558,7466807742892641558,positive
7467506009206375190,2025-02-04 10:18:51,Merz weis doch nicht mal was Niveau ist,0,0,7466807742892641558,7466807742892641558,negative
7467493586965250838,2025-02-04 09:30:38,Kindergarten,0,0,7466807742892641558,7466807742892641558,negative
7467493308710519574,2025-02-04 09:29:15,Ich finde er hat klar geantwortet Wenn es in der Sache richtig ist dann macht er es mit der AFD Und in der Sache wäre eine Wahl oder Minderheitsregierung richtig  aus seiner Sicht,0,0,7466807742892641558,7466807742892641558,neutral
7467486400204636950,2025-02-04 09:02:06,Merz wird immer so hemotional ,0,0,7466807742892641558,7466807742892641558,neutral
7467477580431688470,2025-02-04 08:28:28,Wer sich nicht klar und deutlich gegen Rechts stelltstimmt zuEnde,0,0,7466807742892641558,7466807742892641558,neutral
7467477271618945815,2025-02-04 08:27:17,jede Frage MUSS zulässig sein Als Politiker darf man den Leuten nicht auf diese Weise den Mund verbieten VORALLEM um nächstes Jahr zu sehen ob er wieder sein Wort bricht Er will sich nicht festlege,0,0,7466807742892641558,7466807742892641558,neutral
7467473826683667222,2025-02-04 08:13:19,Demokratie schließt das Mittel der Erpressung aus Herr Merz nutzt jedes Mittel um Macht in seinem Diskurs zu etablieren das hat er bewiesen,0,0,7466807742892641558,7466807742892641558,neutral
7467473549562839830,2025-02-04 08:12:46,Die Grünen sind Unwählbar,0,0,7466807742892641558,7466807742892641558,negative
7467471786197058326,2025-02-04 08:05:48,Da verweise ich auf das Interview im ZDF am 4225 mit ihrer Parteikollegin Frühstücksfernsehen Da finde ich diesen Beitrag sehr lächerlich,0,0,7466807742892641558,7466807742892641558,negative
7467470815505253142,2025-02-04 08:01:54,Euch ist das Volk einfach nur noch egalsonnst wäre die Abstimmung anders gelaufen,0,0,7466807742892641558,7466807742892641558,negative
7467461241622496002,2025-02-04 07:25:09,,0,0,7466807742892641558,7466807742892641558,negative
7467459541011038998,2025-02-04 07:18:27, was für ne frage ,0,0,7466807742892641558,7466807742892641558,negative
7467456064251953942,2025-02-04 07:04:59,Er hat die Frage beantwortet mehrfach in den Wochen und Monaten davor und im Plenum aber man muss eben auch zu hören,0,0,7466807742892641558,7466807742892641558,neutral
7467455584208487190,2025-02-04 07:02:30,Alleine die Tatsache dass Merz auf Zeitungen referenziert zeigt wohl welche Generationen er NICHT anspricht,0,0,7466807742892641558,7466807742892641558,neutral
7467452729087132418,2025-02-04 06:51:19,Weil er Demokrat ist,0,0,7466807742892641558,7466807742892641558,neutral
7467450301549675286,2025-02-04 06:41:59,Sorry aber welcher Politiker egal von welcher Partei antwortet denn so wie Sie es erwarten  klingt schon überheblich was Sie hier erzählen,0,0,7466807742892641558,7466807742892641558,negative
7467442010456179478,2025-02-04 06:10:32, die afd ist eine lach Nummer,0,0,7466807742892641558,7466807742892641558,negative
7467439733230502678,2025-02-04 06:02:14,,0,0,7466807742892641558,7466807742892641558,negative
7467438170260833046,2025-02-04 05:56:21,"Keine von diesen Altparteien ist noch wählbar auch die Grünen nicht
Deswegen kann man nur noch AFD wählen",0,0,7466807742892641558,7466807742892641558,negative
7467425309781050134,2025-02-04 05:06:24,Das ist Demokratie jeder Angeordnete unabhängig Ich würde mal Nachhilfeunterricht in Demokratie nehmen Diese Bildungsferne ist alarmierend Sinnfreies grünes Framing und Geplapper,0,0,7466807742892641558,7466807742892641558,neutral
7467416372711719682,2025-02-04 04:34:59,,0,0,7466807742892641558,7466807742892641558,negative
7467381031693107990,2025-02-04 02:18:38,Mit welchem Recht hat MERZ so arroganz zu reagieren Merz ist rechter als der deutsche glaubt,0,0,7466807742892641558,7466807742892641558,neutral
7467352669590848278,2025-02-04 00:24:28,aber warum wollt ihr dann noch mit der CDU koalieren,0,0,7466807742892641558,7466807742892641558,negative
7467343873578566422,2025-02-03 23:50:38,Keine Waffen in Kriegsgebiete jaaa die Grünen haben ihr Wort gehalten ,0,0,7466807742892641558,7466807742892641558,neutral
7467335663941092118,2025-02-03 23:17:51,Warum soll er ne dumme Frage beantworten,0,0,7466807742892641558,7466807742892641558,neutral
7467333475511730966,2025-02-03 23:08:39,Hoffentlich hat sich das sehr bald erledigt,0,0,7466807742892641558,7466807742892641558,neutral
7467322558209344278,2025-02-03 22:26:29,,0,0,7466807742892641558,7466807742892641558,negative
7467320512568296214,2025-02-03 22:18:26,Grünen sind die größten Autokraten neben der AfD Und schwer von Begriff auch noch Merz hat kein einfaches Ja geantwortet sondern vor Augen geführt wie oft er sich dazu schon geäußert hat,0,0,7466807742892641558,7466807742892641558,neutral
7467310945464255254,2025-02-03 21:40:52, grüner Versager,0,0,7466807742892641558,7466807742892641558,negative
7467306960106291970,2025-02-03 21:25:40,Du hast auch ein Antwort bekommen  danach kam nichts mehr von dir ,0,0,7466807742892641558,7466807742892641558,neutral
7467297889347191574,2025-02-03 20:50:15,hören sie endlich mit dem Kindergarten auf und machen sie bitte mal Politik und zur Abwechslung mal für Deutschland es tut permanent weh diesem Typ hier zuzuhören inkompetent ist er auch,0,0,7466807742892641558,7466807742892641558,negative
7467296617142633238,2025-02-03 20:45:04,Baldur Springmann Gründer der Grünen war bei der SA,0,0,7466807742892641558,7466807742892641558,neutral
7467296052699169558,2025-02-03 20:43:03,man nennt das rumlamentieren,0,0,7466807742892641558,7466807742892641558,neutral
7467294853447549718,2025-02-03 20:38:33,"Der Typ ist auch nicht zu gebrauchen
Was gibts neues im Gelbhaar Skandal",0,0,7466807742892641558,7466807742892641558,negative
7467292599327638294,2025-02-03 20:29:41,Hass und Hetze lernt man bevorzugt bei Linken und Grünen Und weil sie glauben dass sie die Guten sind dürfen sie das Das schlimme ist sie merken nicht mehr dass sie Hass und Hetze verbreiten,0,0,7466807742892641558,7466807742892641558,negative
7467291827638092566,2025-02-03 20:26:35,Ich sag euch warum Merz nicht antwortet er sagt Hass ist keine Meinung und redet nicht mehr mit euch,0,0,7466807742892641558,7466807742892641558,negative
7467291422007051030,2025-02-03 20:25:04,Hoffentlich reißt Merz die Brandmauer ein damit wir zurück zur Demokratie kommen Der Wählerwille ist im Moment klar SchwarzBlau Die meisten wollen keine links grüne Ökodiktatur,0,0,7466807742892641558,7466807742892641558,neutral
7467290227017581334,2025-02-03 20:20:32,Dieter Nuhr vom 300125 anschauen treffender kann man es nicht sagen Das ganze Theater nur wg des Machterhalts von RotGrün gegen den erklärten Wählerwillen,0,0,7466807742892641558,7466807742892641558,negative
7467287991561585410,2025-02-03 20:11:41,Die Grünen sind viel gefährlicher als die AFD,0,0,7466807742892641558,7466807742892641558,negative
7467285012867580694,2025-02-03 20:00:16,Witzfigur,0,0,7466807742892641558,7466807742892641558,negative
7467280483258106646,2025-02-03 19:42:37,Lügner,0,0,7466807742892641558,7466807742892641558,negative
7467280457417229078,2025-02-03 19:42:31,Habt ihr nicht genug mit euch selbst zu tun Ich sage nur Gelbhaar Skandal,0,0,7466807742892641558,7466807742892641558,negative
7467274738084856598,2025-02-03 19:20:16,Wie verlogen Was stand denn so alles auf GrünenWahlplakaten Keine Waffen in Kriegsgebiete und ähnliche Unwahrheiten,0,0,7466807742892641558,7466807742892641558,negative
7467271804035646230,2025-02-03 19:09:03,Populist,0,0,7466807742892641558,7466807742892641558,negative
7467269855323177750,2025-02-03 19:01:14,Absolut korrekt und typisch Merz Nebenbei bemerkt Check mal dein Ansteckmikro da funzt nur ein Kanal,0,0,7466807742892641558,7466807742892641558,positive
7467269288879112982,2025-02-03 18:59:16,Und danach konntest Du nichts mit dem Wort Suggestivfrage anfangen ,0,0,7466807742892641558,7466807742892641558,neutral
7467267564415959830,2025-02-03 18:52:31,jammern rettet euch nicht mehr wir wählen alle ,0,0,7466807742892641558,7466807742892641558,negative
7467267539307905814,2025-02-03 18:52:12,Merz hat Recht 23 wollen weniger Migration und was machen die Grünen Was meint ihr wie Eltern der getöteten Kinder sich fühlen Finde ich abstoßend,0,0,7466807742892641558,7466807742892641558,negative
7467266763567563542,2025-02-03 18:49:17,Nur noch ,0,0,7466807742892641558,7466807742892641558,negative
7467266421400994582,2025-02-03 18:48:04,Ich hoffe er lässt sich von Euch nicht intrumetalisieren,0,0,7466807742892641558,7466807742892641558,negative
7467265571898819350,2025-02-03 18:44:41,so viele weich gespülte ,0,0,7466807742892641558,7466807742892641558,negative
7467255812777100054,2025-02-03 18:06:56,Selbst wenn zum Wohle des deutschen Volkes Zählen alle Stimmen,0,0,7466807742892641558,7466807742892641558,neutral
7467255549969728278,2025-02-03 18:05:45,Niemals Öko Terroristen ,0,0,7466807742892641558,7466807742892641558,negative
7467255355413857046,2025-02-03 18:05:13,Na das nenne ich mal Dienst am Menschen ,0,0,7466807742892641558,7466807742892641558,negative
7467251918436860694,2025-02-03 17:51:43,so eine Dumme Frage hätte ich auch nicht beantwortet ,0,0,7466807742892641558,7466807742892641558,negative
7467251866654540566,2025-02-03 17:51:41,Hauptsache die Grünen und die SPD sind weg vom Fenster das ist das einzig entscheidende,0,0,7466807742892641558,7466807742892641558,negative
7467246740183057174,2025-02-03 17:31:45,Es gibt halt keine bessere Lösung als AFD zu wählen weil ihr das DEUTSCHE VOLK nach Strich und Faden belügt,0,0,7466807742892641558,7466807742892641558,negative
7467244373660304150,2025-02-03 17:22:34,Die Grünen sind sowas von lost Bringen die AfD auf 40 und merken es nicht mal,0,0,7466807742892641558,7466807742892641558,negative
7467244158584488726,2025-02-03 17:21:46,keine Grünen Nazis mehr ,0,0,7466807742892641558,7466807742892641558,negative
7467241288862384918,2025-02-03 17:10:29,,0,0,7466807742892641558,7466807742892641558,negative
7467241056745128726,2025-02-03 17:09:27,,0,0,7466807742892641558,7466807742892641558,negative
7467239845379932950,2025-02-03 17:04:50,glaubt keinem der in zwei Minuten über 50 Videoschnitte braucht Alter Satz von mir,0,0,7466807742892641558,7466807742892641558,negative
7467237158034850582,2025-02-03 16:54:21,Merz ist einfach souverän Bald Kanzler ,0,0,7466807742892641558,7466807742892641558,neutral
7467236305245815574,2025-02-03 16:51:25,grüne Bäume sind schön grüne wiesen sind schön Eine grüne Partei nein danke,0,0,7466807742892641558,7466807742892641558,negative
7467236106184016662,2025-02-03 16:50:38,Wer was wählt bleibt in der Entscheidung des Wählers und diese Stimme ist nicht manipulierbar,0,0,7466807742892641558,7466807742892641558,neutral
7467235954933039894,2025-02-03 16:49:45,Die AfD ist tatsächlich die einzige noch wählbare demokratische Partei  Grünes Gesindel ist ab März Geschichte ,0,0,7466807742892641558,7466807742892641558,neutral
7467235515290043158,2025-02-03 16:48:11,Wo Merz Recht hat hat er recht Außerdem seid ihr mittlerweile auch unwählbar,0,0,7466807742892641558,7466807742892641558,negative
7467234992096428822,2025-02-03 16:46:06,es wird Zeit dass ihr Grünen Mal in der Realität ankommt,0,0,7466807742892641558,7466807742892641558,neutral
7467233596726772502,2025-02-03 16:40:36,Sie haben Demokratie auch nicht verstanden,0,0,7466807742892641558,7466807742892641558,neutral
7467232862543594262,2025-02-03 16:37:51,einfache Frage mehr geht ja auch nicht,0,0,7466807742892641558,7466807742892641558,negative
7467232340781073174,2025-02-03 16:36:00,,0,0,7466807742892641558,7466807742892641558,negative
7467230953951052566,2025-02-03 16:30:35,,0,0,7466807742892641558,7466807742892641558,negative
7467229332260258562,2025-02-03 16:24:04,Grün ist das neue Braun ,0,0,7466807742892641558,7466807742892641558,neutral
7467228088306500374,2025-02-03 16:19:34,Weil sie keine Ahnung haben von Demokratie  63  der Bevölkerung hätte dieses Gesetz befürwortet Deshalb  Alice für Deutschland ,0,0,7466807742892641558,7466807742892641558,neutral
7467226936232051478,2025-02-03 16:15:11,Aufklärung Vetternwirtschaft Fall Gelbhaar Beförderungswelle Niemals grün,0,0,7466807742892641558,7466807742892641558,neutral
7467221676592988930,2025-02-03 15:54:44,Mein Herr den Gruenen wurden in den vergangenen Jahren viele Fragen gestellt Nicht nur den Antworten sind sie schuldig geblieben auch haben Sie keine gute Arbeit geleistet Ich glaube ja mal dass war es mit den Gruenen und das ist gut so ,0,0,7466807742892641558,7466807742892641558,negative
7467220902822626070,2025-02-03 15:51:40,ihr habt doch zu Hause beim laschet ausgekugelt wenn er nächste und übernächste Kanzler wird wer soll euch noch ernst nehmen,0,0,7466807742892641558,7466807742892641558,neutral
7467220740715889430,2025-02-03 15:50:57,Die Linke,0,0,7466807742892641558,7466807742892641558,neutral
7467219691426677506,2025-02-03 15:46:47,Warum sollte Herr Merz das ausschließen Gibt es dafür eine logische Begründung,0,0,7466807742892641558,7466807742892641558,neutral
7467219241905685250,2025-02-03 15:44:53,Ich hoffe er schließt eine Koalition mit den Grünen kategorisch aus,0,0,7466807742892641558,7466807742892641558,neutral
7467219168627344150,2025-02-03 15:44:45,Niemals Grün,0,0,7466807742892641558,7466807742892641558,negative
7467217716673135382,2025-02-03 15:39:16,merz ich rede viel um davon abzulenken dass ich das sofort ohne mit der Wimper zu zucken machen werde,0,0,7466807742892641558,7466807742892641558,neutral
7467213710601798422,2025-02-03 15:24:01,Nur AfD mit ü 20000000 Wähler kann Deutschland  retten ,0,0,7466807742892641558,7466807742892641558,negative
7467209122146386690,2025-02-03 15:05:51, schließen sie aus dem Bürgerwillen zu vertreten ,0,0,7466807742892641558,7466807742892641558,neutral
7467208954826621718,2025-02-03 15:05:19,Egal was passiert Wichtig ist nur dass die Grünen aus der Regierung fliegen,0,0,7466807742892641558,7466807742892641558,neutral
7467207964144927510,2025-02-03 15:01:36,Das ist doch vollkommen normal  in der Politik wird ständig gelogen  egal welche Partei,0,0,7466807742892641558,7466807742892641558,negative
7467207650347746070,2025-02-03 15:00:13,Grüne erzählen auch immer nur Märchengeschichten Also was will er,0,0,7466807742892641558,7466807742892641558,neutral
7467207195773354774,2025-02-03 14:58:32,Die Grünen brauchen die Brandmauer zum Überleben Ohne Diese sind alle Ideologien plötzlich obsolet Es geht um die nackte Existenz dieser versiff Partei und deren Anhänger,0,0,7466807742892641558,7466807742892641558,neutral
7467206333059138326,2025-02-03 14:55:05,jede stimme für die grünen ist eine zuviel,0,0,7466807742892641558,7466807742892641558,neutral
7467206360531272470,2025-02-03 14:54:57,Grüne Lügenpartei,0,0,7466807742892641558,7466807742892641558,negative
7467204786916967190,2025-02-03 14:49:00,Nie wieder grüner Kommunismus ist JETZT,0,0,7466807742892641558,7466807742892641558,negative
7467201987144450838,2025-02-03 14:38:25,Man soll in Dialog mit einander treten und nicht Brandmauer ziehen Ihr grünen versteht NICHT was die meisten Menschen in DE Sorge macht,0,0,7466807742892641558,7466807742892641558,neutral
7467200498144969495,2025-02-03 14:32:21,Mit einfach ist der Grüne schon hoffnungslos überfordert ,0,0,7466807742892641558,7466807742892641558,negative
7467197116298642198,2025-02-03 14:19:24,Indem man andere abwertet von denen man sich bedroht fühlt lässt einen nicht kompetenter wirken er ist sehr nervös überspielt diese Nervosität durch übertriebene Selbstaufwertung Blasiertheit,0,1,7466807742892641558,7466807742892641558,negative
7467193730149597974,2025-02-03 14:06:30,ich verstehe die unklarheit nicht cdu stimmt absichtlich mit afd ab da stellt sich doch die frage nicht ob er das künftig ausschließt es fängt ja grade erst an,0,0,7466807742892641558,7466807742892641558,negative
7467193500641411862,2025-02-03 14:05:31,Niemals Grün ,0,0,7466807742892641558,7466807742892641558,negative
7467193376998556439,2025-02-03 14:04:59,Nie wieder ist jetzt  NIE WIEDER GRÜN,0,0,7466807742892641558,7466807742892641558,negative
7467189943178740502,2025-02-03 13:51:32,Schondass er so wütend wirdentlarvt ihn,0,0,7466807742892641558,7466807742892641558,neutral
7467189065022145302,2025-02-03 13:48:15,Das war ja auch keine einfache Frage,0,0,7466807742892641558,7466807742892641558,neutral
7467188915919127318,2025-02-03 13:47:51,Von wegen einfache Frage er hat mittlerweile AfD Niveau ergo kann er so eine lange Frage nicht verstehen ,0,0,7466807742892641558,7466807742892641558,negative
7467188459616650006,2025-02-03 13:46:07,Seit wann kümmert Merz sein Geschwätz von gestern Ich komme gar nicht hinterher bei all den Wendungen und Lügen,0,0,7466807742892641558,7466807742892641558,negative
7467186904674272022,2025-02-03 13:39:53,Grün muß unter 5 Prozent,0,0,7466807742892641558,7466807742892641558,neutral
7467185863261504278,2025-02-03 13:35:31,Mir zeigt das nur eins Demokratie und Opposition wirkt Auch SPD und Grüne müssen akzeptieren das wir eine parlamentarische Demokratie haben,0,0,7466807742892641558,7466807742892641558,negative
7467183346902369046,2025-02-03 13:26:03,,0,0,7466807742892641558,7466807742892641558,negative
7467182107686339350,2025-02-03 13:21:09,"Warum die Frage
Was ist das Problem wenn demokratisch gewählte abgeordnete demokratisch abstimmen
dass ihr die Macht verliert",0,0,7466807742892641558,7466807742892641558,negative
7467178986759881494,2025-02-03 13:09:22,,0,0,7466807742892641558,7466807742892641558,negative
7467176875723784982,2025-02-03 13:00:45,Nur  kann uns noch retten Ihre links grüne Politik ist das Ende für Deutschland  Deshalb wähle ich ,0,0,7466807742892641558,7466807742892641558,negative
7467175868084044566,2025-02-03 12:56:46,Unwählbar,0,0,7466807742892641558,7466807742892641558,negative
7467173611292410646,2025-02-03 12:48:00,Bei den nächsten Toten werde ich ua Ihr Gesicht vor Augen haben,0,0,7466807742892641558,7466807742892641558,neutral
7467169107848954647,2025-02-03 12:30:51,unwählbar,0,0,7466807742892641558,7466807742892641558,negative
7467168905107522326,2025-02-03 12:29:51,Ihr habt fertig Da kannst du so viele Fragen stellen wie du willst,0,0,7466807742892641558,7466807742892641558,neutral
7467165448703214358,2025-02-03 12:16:24,"Und genau ua deswegen werde ich das 1x in meinem Leben 66 J wählen
Vorher habe ich jahrzehntelang die olle SPD gewählt
Jetzt nicht mehr",0,0,7466807742892641558,7466807742892641558,neutral
7467164430611841814,2025-02-03 12:12:40,Frag doch mal den Bruder von Habeck,0,0,7466807742892641558,7466807742892641558,neutral
7467163353732236054,2025-02-03 12:08:19,Drei Jahre nix gemacht und nur die Schuld bei anderen suchen,0,0,7466807742892641558,7466807742892641558,negative
7467162094627472150,2025-02-03 12:03:32,Keine Stimmen mehr wegen komplettversagen aber die Richtung vorgeben wollen Einfach lächerlich,0,0,7466807742892641558,7466807742892641558,negative
7467161439271715607,2025-02-03 12:00:55,wieso lernen grüne und spd nicht anständig politik zu machen ideoligisch verhaftet,0,0,7466807742892641558,7466807742892641558,negative
7467161157016470294,2025-02-03 12:00:07,Ein Rentner bezeichnet Habeck als Schwachkopf  es folgt eine Hausdurchsuchung GrünenChef Banaszak sagt später dies sei nicht der einzige Grund gewesen Eine Falschaussage,0,2,7466807742892641558,7466807742892641558,neutral
7467161085204955926,2025-02-03 11:59:28,wer bist du denn,0,0,7466807742892641558,7466807742892641558,negative
7467160275561956118,2025-02-03 11:56:24,tja viele Bürger wünschen sich auch einige Antworten und endlich mal Taten das schon seit Jahren Genau so läuft das bei euch,0,0,7466807742892641558,7466807742892641558,positive
7467159434432889622,2025-02-03 11:53:33,Minderheitsregierung wäre eine echte Demokratie und kein zuschieben von dingen,0,0,7466807742892641558,7466807742892641558,neutral
7467158953085322006,2025-02-03 11:51:25,,0,0,7466807742892641558,7466807742892641558,negative
7467158657576551190,2025-02-03 11:50:31,"Demokratie ist das egal mit welcher Partei
aber Grüne Antidemokraten kapieren das nicht",0,0,7466807742892641558,7466807742892641558,negative
7467156516580721430,2025-02-03 11:41:54,Klar  aber durch die afd hatten sie eine Mehrheit aber gut,0,0,7466807742892641558,7466807742892641558,neutral
7467154870005973782,2025-02-03 11:35:27,Kurze Info  die Krawatte macht Sie nicht seriöser was meinen Sie wem das wichtig ist was Sie zu erzählen haben Unglaublich,0,0,7466807742892641558,7466807742892641558,neutral
7467152456729281302,2025-02-03 11:26:10,GRÙNE SIND SYSTEM SPRENGER DER DEMOKRATIE ,0,0,7466807742892641558,7466807742892641558,neutral
7467151839428920086,2025-02-03 11:24:03,schwarz blau verhindern und lieber rot rot grün wählen Schwarz Blau und Gelb haben leider nichts mehr mit dem Bürger zu tun,0,0,7466807742892641558,7466807742892641558,neutral
7467151376578036502,2025-02-03 11:21:45,Red hat Herr merz mit seiner Antwort,0,0,7466807742892641558,7466807742892641558,neutral
7467150043431453462,2025-02-03 11:16:49,Alle Parteien müssen abstimmen ihr seit grottenschlechtchlech und Lügner grün eine lachpartei ,0,0,7466807742892641558,7466807742892641558,negative
7467149159815316226,2025-02-03 11:13:41,Verdrahtung der Tatsachen Merz bester Redner grün will nicht Anschläge egal messerattacken nein grün links Extremisten Demos ekelhaft,0,0,7466807742892641558,7466807742892641558,negative
7467145418574725910,2025-02-03 10:59:23,"Die Leute von der AfD  die im Bundestag sitzen  sind doch vom Volk gewählt
Also warum werden sie ausgeschlossen 
Damit schließt man Teile des Volkes aus und das ist dann keine Demokratie mehr 
Ihr seid die wahren Demokratiefeinde ",0,0,7466807742892641558,7466807742892641558,negative
7467143266073871126,2025-02-03 10:50:38,Jetzt habt ihr alle Angst dass ihr nicht wieder gewählt werdet,0,0,7466807742892641558,7466807742892641558,negative
7467141872005481238,2025-02-03 10:45:39,eine Koalition mit CDU CSU ist nicht mehr realistisch jetzt müssen wir für rotrotgrün kämpfen wie letztes Jahr in Frankreich,0,0,7466807742892641558,7466807742892641558,negative
