id,create_time,text,like_count,reply_count,parent_comment_id,video_id,sentiment
7465973270757212950,2025-01-31 07:10:43,Die Firmen haben zwei Weltkriege überlebt aber keine 3 Jahre Habeck ,21,0,7459519882875374870,7459519882875374870,neutral
7463427469607453462,2025-01-24 10:32:04,Was hat er für Qualifikationen für solche Aussagen oder doch nur ideologisches Gequassel ,15,0,7459519882875374870,7459519882875374870,neutral
7459525855669355286,2025-01-13 22:10:29,Das klappt ja super ,12,0,7459519882875374870,7459519882875374870,positive
7459521549084394262,2025-01-13 21:53:52,Natürlich ist es ein langer anstrengender Kraftakt dieses Land restlos auszuplündern und dann von innen zu zerstören,8,1,7459519882875374870,7459519882875374870,neutral
7459521445872829186,2025-01-13 21:53:33,,8,0,7459519882875374870,7459519882875374870,negative
7466990753723826966,2025-02-03 01:01:52,Träumer Subventionen ohne Ende,7,1,7459519882875374870,7459519882875374870,neutral
7459525643211539222,2025-01-13 22:09:49,,6,0,7459519882875374870,7459519882875374870,negative
7467156926696571670,2025-02-03 11:43:55,grün niemals,6,0,7459519882875374870,7459519882875374870,negative
7459878533487559446,2025-01-14 20:59:10,Deutschland muss wieder Vorreiter werden Wenn eines der größten Volkswirtschaften klimaneutral wird sind andere Staaten mehr motiviert die Ziele ebenso zu erreichen,4,1,7459519882875374870,7459519882875374870,neutral
7459531152294937366,2025-01-13 22:31:07,,4,0,7459519882875374870,7459519882875374870,negative
7467432745619489558,2025-02-04 05:34:41,Alles über Windkraft Grüne Politik ,3,1,7459519882875374870,7459519882875374870,neutral
7466024740894638870,2025-01-31 10:30:19,In dem sich die Politik komplett raus hält,3,0,7459519882875374870,7459519882875374870,neutral
7464744867342091030,2025-01-27 23:45:07,Windmühlen sind die Zukunft Weil Atomstrom die Leitungen verstopft ,3,0,7459519882875374870,7459519882875374870,neutral
7467876745109865239,2025-02-05 10:17:14,warum glaube ich ihm nicht ,2,0,7459519882875374870,7459519882875374870,neutral
7466781968606085910,2025-02-02 11:28:02,Man müsste nur wissen was Stahl ist und Habeck weiß noch viel weniger,3,0,7459519882875374870,7459519882875374870,neutral
7466695659589829398,2025-02-02 05:56:02,ich darf jetzt nicht schreiben was ich denke,2,0,7459519882875374870,7459519882875374870,neutral
7465287498378576642,2025-01-29 10:49:10,Ohne grüne ,2,0,7459519882875374870,7459519882875374870,negative
7461122501004215062,2025-01-18 05:29:45,Eine neue Zeit,2,0,7459519882875374870,7459519882875374870,neutral
7459763805573612310,2025-01-14 13:33:55,Wie kann es eigentlich sein dass er redet und nicht weiß was er redet,2,0,7459519882875374870,7459519882875374870,neutral
7469342119817151254,2025-02-09 09:03:09,kotzgrün  Niemals,1,0,7459519882875374870,7459519882875374870,negative
7469315513605948182,2025-02-09 07:20:20,Aber ohne Grüne ,1,0,7459519882875374870,7459519882875374870,negative
7467706670556463894,2025-02-04 23:17:54,"diese Grünen hätten damals
Anne Frank
nicht versteckt
sondern verpfiffen",1,0,7459519882875374870,7459519882875374870,neutral
7466844621252707094,2025-02-02 15:31:23,Unfassbar,1,0,7459519882875374870,7459519882875374870,negative
7466757072023110422,2025-02-02 09:51:50,Das gelingt indem man für einen wettbewerbsfähigen Standort sorgt Ihr macht das Gegenteil,1,0,7459519882875374870,7459519882875374870,neutral
7464083158369026838,2025-01-26 05:00:26,20000 Beschäftigte verlieren ihren Job Wir sind auf dem Weg zur Deindustrialisierung Etwas abzuschaffen ohne Alternative ist einfach dumm,1,0,7459519882875374870,7459519882875374870,negative
7460239265856914199,2025-01-15 20:19:11,Traumtänzer ohne Grüne ging es uns viel besser,1,1,7459519882875374870,7459519882875374870,negative
7459846605984219926,2025-01-14 18:55:16,Mit Grün klappt es mit Sicherheit nicht Deutschland wieder nach vorne bringen,1,0,7459519882875374870,7459519882875374870,negative
7459666944622232322,2025-01-14 07:18:41,Nur ohne die Grünen,1,0,7459519882875374870,7459519882875374870,negative
7459523200362808086,2025-01-13 22:00:21,Stromgestehungskosten von Erneuerbaren sind kein guter Indikator für zukünftige Stromkosten Prof Veronika Grimm,1,2,7459519882875374870,7459519882875374870,neutral
7459523200362332950,2025-01-13 22:00:13,Die Grünen möchten einen Haushalt mit Rekordausgaben durchsetzen mit falschen Prioritäten sozialen Unwuchten mangelndem Sparwillen und eigenen Lieblingsprojekten,1,1,7459519882875374870,7459519882875374870,neutral
7471366957859586838,2025-02-14 20:00:14,schon Mist wenn man Angst vor der AFD hat weil man weiß das sie bestimmt besser mit regieren würde als die eigene Partei und dann diese nie wieder in der Regierung sitzen würde ,0,0,7459519882875374870,7459519882875374870,negative
7471291796104086294,2025-02-14 15:08:48,,0,0,7459519882875374870,7459519882875374870,negative
7470634413354648342,2025-02-12 20:37:34,Banaszak  Lohnt es sich den Namen zu merken,0,0,7459519882875374870,7459519882875374870,positive
7470498036865090326,2025-02-12 11:48:58,Total Grün verstrahalt,0,0,7459519882875374870,7459519882875374870,negative
7470434588654240534,2025-02-12 07:42:32,Ich bete und hoffe das die Grünen Regierung sich Ende Februar erledigt hat und man nichts mehr von ihnen hört,0,0,7459519882875374870,7459519882875374870,positive
7470434378270114562,2025-02-12 07:42:09,Eine Partei welche die Zuwanderung noch erhöhen möchte ist schlicht und ergreifend indiskutabel Die Mehrheit der Deutschen möchte eine Veränderung Die Basis der Grünen schert sich darum überhaupt nicht So etwas nennt man keine Volksvertreter,0,0,7459519882875374870,7459519882875374870,neutral
7470193715942015766,2025-02-11 16:07:49,Ganz einfach Grüne weg,0,0,7459519882875374870,7459519882875374870,negative
7470156723920093974,2025-02-11 13:43:54,,0,0,7459519882875374870,7459519882875374870,negative
7470121273001100054,2025-02-11 11:26:58,,0,0,7459519882875374870,7459519882875374870,negative
7470117531120222998,2025-02-11 11:12:41,Wenn man ideologisch so verblendet ist glaubt eine moralische Überlegenheit zu besitzen und nicht merkt dass man einen großen Teil der Wirtschaftlich auf dem Gewissen hat Schöne Farbe,0,0,7459519882875374870,7459519882875374870,neutral
7470032081608262422,2025-02-11 05:41:29,Die Grüne Märchenstunde ist vorbei,0,0,7459519882875374870,7459519882875374870,neutral
7470025819298251542,2025-02-11 05:17:43,"Das geht nur ohne Euch
Ihr erzählt nur haltlos Grüne Ideologie
Die Quittung bekommt ihr bei der Wahl
Vielen Dank",0,0,7459519882875374870,7459519882875374870,negative
7470023973029593878,2025-02-11 05:11:47,,0,0,7459519882875374870,7459519882875374870,negative
7469754571394843414,2025-02-10 11:44:02,Die neue Zeit ist der Grüne FaschismusDie Grünen grenzen aushaben Wirtschaft keine AhnungDie neue Zeit wird bei den Grünen eine industriefrei Zeit sein mit Millionen Arbeitslose u illeg Migration,0,0,7459519882875374870,7459519882875374870,negative
7469752880451535638,2025-02-10 11:37:02,Herr Banaszak Sie haben nie gearbeitet und von Wirtschaft fehlen Ihnen auch die Kompetenzen,0,0,7459519882875374870,7459519882875374870,neutral
7469731758381040406,2025-02-10 10:15:05,Seine krausen Haare wachsen nach innen,0,0,7459519882875374870,7459519882875374870,neutral
7469319808016417558,2025-02-09 07:36:55,Seit wann hat der Sprachfehler und seine Partei denn Ahnung von Wirtschaft der Habeck hat ja die letzten dreieinhalb Jahren bewiesen das sie null Ahnung haben,0,0,7459519882875374870,7459519882875374870,neutral
7469319808016417558,2025-02-09 07:36:55,Seit wann hat der Sprachfehler und seine Partei denn Ahnung von Wirtschaft der Habeck hat ja die letzten dreieinhalb Jahren bewiesen das sie null Ahnung haben,0,0,7459519882875374870,7459519882875374870,neutral
7469147698846139138,2025-02-08 20:28:34,Robert Habeck fördert alles mit unserem Steuergeld Schlimm dass er damit nicht einmal irgend einen Erfolg hat Dieser grüne Dreck muss weg,0,0,7459519882875374870,7459519882875374870,neutral
7469147532230443798,2025-02-08 20:27:43,Wie kann es gelingen diesen grünen Dreck für immer zu vernichten ,0,0,7459519882875374870,7459519882875374870,neutral
7468333288689566486,2025-02-06 15:48:25,Der lebt in seinem eigenen Kosmos die grüne Sekte ist doch dafür verantwortlich das die Wirtschaft abwandert Das große Firmen Deutschland den Rücken kehren Anwählbar ,0,0,7459519882875374870,7459519882875374870,neutral
7467919085045744406,2025-02-05 13:00:43,Es kann gelingen wenn ihr nicht mehr seid,0,0,7459519882875374870,7459519882875374870,neutral
7467831538803557142,2025-02-05 07:22:16,mh wer ist denn die letzten drei Jahre in der Regierung gewesen und macht alles teuer,0,0,7459519882875374870,7459519882875374870,negative
7467809227949441814,2025-02-05 05:55:50,Mit Qualifizierten Politikern und nicht mit Ihnen,0,0,7459519882875374870,7459519882875374870,neutral
7467736978433409814,2025-02-05 01:18:13,Das kann gelingen wenn grün verschwindet,0,0,7459519882875374870,7459519882875374870,neutral
7467484601280627478,2025-02-04 08:55:20,Das ist möglich wenn mann sich tagelang grünen Wasserstoff ins Gehirn bläst ,0,0,7459519882875374870,7459519882875374870,neutral
7467478691678978838,2025-02-04 08:32:46,Ich glaube dem muss mal jemand sagen das Ihn die Krawatte nicht seriös macht  und diesen Leuten sollen wir die Wirtschaft in die Hände legen  das ist hoffentlich Satire unglaublich,0,0,7459519882875374870,7459519882875374870,negative
7467467564551357206,2025-02-04 07:49:51,Wirtschaftsminister Habeck hat ja die Wirtschaft an die Wand gefahren,0,0,7459519882875374870,7459519882875374870,neutral
7467458366140154646,2025-02-04 07:13:48,Das gelingt wenn die Grünen nicht mehr in der Regierung sind,0,0,7459519882875374870,7459519882875374870,neutral
7467435822321894166,2025-02-04 05:46:22,das wird funktionieren halt nur ohne grüne Sekte ,0,0,7459519882875374870,7459519882875374870,negative
7467403887151678230,2025-02-04 03:46:53,ich mag dieses grüne Gesocks nicht nur Dampfplauderer haben noch nie einen Beitrag für Deutschland geleistet sind wie Parasiten,0,0,7459519882875374870,7459519882875374870,negative
7467205878099477270,2025-02-03 14:53:30,,0,0,7459519882875374870,7459519882875374870,negative
7467124045113950998,2025-02-03 09:36:18,"Den Marathon läuft nur Die Grünen
SONST NIEMAND AUF DER WELT",0,0,7459519882875374870,7459519882875374870,neutral
7467118073913967382,2025-02-03 09:12:55,Eine Sekunde zuhören und jeden muss doch klar sein  dass es nur Schwätzer sind Null Ahnung Null Inhalt Warum fallen so viele Menschen darauf rein ,0,0,7459519882875374870,7459519882875374870,negative
7467116306070225686,2025-02-03 09:06:48,Die Grünen sind bestimmt von Putin eingeschleust um die Wirtschaft von innen zu zerstören,0,0,7459519882875374870,7459519882875374870,neutral
7467107337040528150,2025-02-03 08:31:15,INDEM ES KEINE GR MEHR IN DER REG HABEN,0,0,7459519882875374870,7459519882875374870,neutral
7467006702341538582,2025-02-03 02:04:16,Unser kompetenter Wirtschaftsminister und die sprachbegabte Außenministerin müssen schnellstmöglich aus der Regierung entfernt werden,0,0,7459519882875374870,7459519882875374870,negative
7466967733994668822,2025-02-02 23:29:50,,0,0,7459519882875374870,7459519882875374870,negative
7466913515636409110,2025-02-02 19:58:40,Er hat Sozial und Kulturanthropologie studiert Mit welcher Kompetenz und welchem Recht äußert er sich über die hochkomplexe Wirtschaftspolitik der Bundesrepublik Deutschland,0,1,7459519882875374870,7459519882875374870,neutral
7466868620736873238,2025-02-02 17:04:25,Früher hatten Lügen kurze Beine heute haben Lügen Grüne Beine ,0,0,7459519882875374870,7459519882875374870,negative
7466825379678094102,2025-02-02 14:16:55,Er sollte den Mund halten,0,0,7459519882875374870,7459519882875374870,neutral
7466821863390872342,2025-02-02 14:02:58,Der geht gar nicht,0,0,7459519882875374870,7459519882875374870,negative
7466813747437339414,2025-02-02 13:31:23,ohne Habeck klappt das schon,0,0,7459519882875374870,7459519882875374870,positive
7466760066096530198,2025-02-02 10:03:09,Für welchen Preis wird dann der grüne Wasserstoff eingekauft,0,0,7459519882875374870,7459519882875374870,neutral
7466458240777585430,2025-02-01 14:32:18,,0,0,7459519882875374870,7459519882875374870,negative
7466441463392961302,2025-02-01 13:26:53,Den Grünen war wichtiger möglichst viel grüne Ziele umzusetzen statt ein vernünftiges Training für den Marathon zu absolvieren Das Ergebnis siehen wir jetzt Deutschland am wirtschaftlichen Abgrund,0,0,7459519882875374870,7459519882875374870,neutral
7466440713060975382,2025-02-01 13:23:58,Was ist passiert Der Grüne spricht von einem Marathon Was die Grünen gemacht haben ist einen Marathon ohne Vorbereitung Training zu starten Eine weitsichtige Vorbereitung wäre ideal gewesen,0,0,7459519882875374870,7459519882875374870,neutral
7466224054266348310,2025-01-31 23:23:33,Weg mit grün grün muss weg sofort weg mit grün,0,0,7459519882875374870,7459519882875374870,negative
7466027141463278358,2025-01-31 10:39:54,Wirtschaftsversager,0,0,7459519882875374870,7459519882875374870,negative
7466022373070979862,2025-01-31 10:20:53,Der Mann ist wirtschaftlichpolitisch eine Doppelnull mit permanenter Beratungsresistenz und Wirklichkeitsleugnung,0,0,7459519882875374870,7459519882875374870,neutral
7466008405941945111,2025-01-31 09:26:35,wieso wird mit denen noch diskutiert,0,0,7459519882875374870,7459519882875374870,neutral
7466007151120909078,2025-01-31 09:22:32,Vor 5  6 Jahren hing ging es unserer Industrie und Wirtschaft sehr gut Vor 3 Jahren kam ein Märchenonkel der alles Grün machen wollte und mit seinen Grünen Geisteswahnsinn die komplette Wirtschaft,0,1,7459519882875374870,7459519882875374870,neutral
7466005984601162518,2025-01-31 09:18:00,Ihr habt die Industrie bereits zerstört ,0,0,7459519882875374870,7459519882875374870,neutral
7466002094840431382,2025-01-31 09:02:21,Die habt ihr doch weggetrieben,0,0,7459519882875374870,7459519882875374870,neutral
7465994990691992342,2025-01-31 08:35:00,,0,0,7459519882875374870,7459519882875374870,negative
7465993743612642070,2025-01-31 08:30:28,Ich kann diesen Mann nicht mehr hören ,0,0,7459519882875374870,7459519882875374870,negative
7465990330020053782,2025-01-31 08:17:16,Das Märchen vom CO2 Und die Grünen können wunderbar Ihre Pläne vom Rückbau Deutschlands umsetzen,0,0,7459519882875374870,7459519882875374870,neutral
7465990114351923990,2025-01-31 08:15:53,Er stellt sich eingangs eine Frage zum Wie und beantwortet sie nicht,0,0,7459519882875374870,7459519882875374870,neutral
7465988699760182038,2025-01-31 08:10:32,Man schaltet erst das alte ab wenn das neue das alte zu 100 übernehmen kann Und nicht eine Energiekrise auslöst damit diese Wirtschaft abwandert,0,0,7459519882875374870,7459519882875374870,negative
7465987575204922134,2025-01-31 08:06:31,Sie wollen Geld haben welche euch nicht gehört Sie wollen mehr von Volk Tasche mehr Geld rausholen,0,0,7459519882875374870,7459519882875374870,neutral
7465985605111382806,2025-01-31 07:59:00,Das einfachste wäre die Grünen verbieten zu lassen,0,0,7459519882875374870,7459519882875374870,negative
7465984676487037718,2025-01-31 07:54:43,Also wenn er über Wirtschaft redet und was gemacht werden muss Da denke ich er hat davon null Ahnung oder meint er der Besuch von Kneipen während des Studiums reicht davon aus,0,0,7459519882875374870,7459519882875374870,neutral
7465982281912730390,2025-01-31 07:45:25,,0,0,7459519882875374870,7459519882875374870,negative
7465980134492177174,2025-01-31 07:37:17,Da spricht die Ideologie der Grünen ,0,0,7459519882875374870,7459519882875374870,neutral
7465969122510914326,2025-01-31 06:54:39,Deutschland  Klimaneutral der Rest der Welt nicht Also macht ihr aus ideologischen Wünschen unsere Industrie kaputt,0,0,7459519882875374870,7459519882875374870,negative
7465967294952522518,2025-01-31 06:47:49,Normale Menschen mit Verstand sehen das die Grünen von Wirtschaft oder andere wichtige Themen keine Ahnung haben nur wie man andere Menschen diffamiert,0,0,7459519882875374870,7459519882875374870,neutral
7465967294952522518,2025-01-31 06:47:49,Normale Menschen mit Verstand sehen das die Grünen von Wirtschaft oder andere wichtige Themen keine Ahnung haben nur wie man andere Menschen diffamiert,0,0,7459519882875374870,7459519882875374870,neutral
7465964273303552790,2025-01-31 06:35:30,Einfache Antwort am besten ohne SPD,0,0,7459519882875374870,7459519882875374870,positive
7465962919513752342,2025-01-31 06:30:37,Wenn Laien über unsere Wirtschaft entscheiden  ,0,0,7459519882875374870,7459519882875374870,neutral
7465944166796657430,2025-01-31 05:19:25,Die Grünen sind ein Wunder Es gelingt ihnen in kurzer Zeit Führungspersonen aus dem Hut zu zaubern die niemand kannte,0,0,7459519882875374870,7459519882875374870,neutral
7465943070652842774,2025-01-31 05:14:58,,0,0,7459519882875374870,7459519882875374870,negative
7465941383560577814,2025-01-31 05:08:08,Hat der Habeck zerstört die Wirtschaft hat der was geraucht,0,0,7459519882875374870,7459519882875374870,neutral
7465794266925908758,2025-01-30 19:35:12,Mit Sicherheit nicht mit Bevormundung,0,0,7459519882875374870,7459519882875374870,negative
7465756322656846614,2025-01-30 17:08:22,,0,0,7459519882875374870,7459519882875374870,negative
7465317054285366038,2025-01-29 12:44:06,Ist schon mal jemand die gläsernen Augen und die vergrößerten Pupillen von Herrn Felix Banaszak aufgefallen,0,0,7459519882875374870,7459519882875374870,neutral
7465065475388474134,2025-01-28 20:27:18,geistiges Nachtwandeln,0,0,7459519882875374870,7459519882875374870,negative
7464586863127577366,2025-01-27 13:30:06,Diese Grünen können es nicht,0,0,7459519882875374870,7459519882875374870,negative
7463870513951474454,2025-01-25 15:10:42,Ihr könnt das nicht,0,0,7459519882875374870,7459519882875374870,negative
7462023809261994774,2025-01-20 15:44:27,Ihr wart 3 Jahre dran schaut euer Ergebnis an Im Februar bekommt ihr dafür die Quittung ,0,0,7459519882875374870,7459519882875374870,negative
7460947396601004822,2025-01-17 18:07:08,Ganz einfach finger weg davon,0,0,7459519882875374870,7459519882875374870,negative
7460944495976448790,2025-01-17 17:56:12,3 Jahre Rezession die momentan größte Wirtschaftskrise und das alles unter Vitze und Wirtschaftsminister Habeck  merkt ihr was liebe Grünen,0,0,7459519882875374870,7459519882875374870,neutral
7460934312617362198,2025-01-17 17:16:40,Nur noch afd,0,0,7459519882875374870,7459519882875374870,negative
7460837150738875138,2025-01-17 10:59:58,wenn die grünen den Bundestag verlassen dann geht es,0,0,7459519882875374870,7459519882875374870,negative
7460125694010327830,2025-01-15 12:58:34,na mit einer anderen Regierung ohne Grüne Mensch,0,0,7459519882875374870,7459519882875374870,negative
7460088803732144918,2025-01-15 10:36:36,Niemals Grüne Niemals,0,0,7459519882875374870,7459519882875374870,negative
7459803725454017313,2025-01-14 16:08:39,Motzkotz Motzkotz Ich erkenne bei den Grünen noch nicht einmal einen guten Willen gegenüber dem Deutschen Volk Die Grünen sollten sich schämen  Grüne Nein Danke,0,6,7459519882875374870,7459519882875374870,negative
7459739801026560790,2025-01-14 12:00:54,Wenn wir den Stahl nicht klimaneutral produzieren werden wir wahrscheinlich keinen Anteil am Markt mehr haben weil China inzwischen Stahl in gleicher Qualität herstellen kann und sie sind günstiger,0,1,7459519882875374870,7459519882875374870,neutral
7459637253515510550,2025-01-14 05:24:03,Ist nicht Dein Duisburg,0,1,7459519882875374870,7459519882875374870,negative
7459528611079717654,2025-01-13 22:21:10,Die Begleitung der Industrie durch die Grünen hat Deutschland in die Rezession gebracht Das sind 3 Jahre nicht nur 1 Kilometer,0,0,7459519882875374870,7459519882875374870,neutral
7459523512698897174,2025-01-13 22:01:42,Vollkommen Naiv ist es zu glauben dass Energieintensive Industrie in Deutschland zu halten ist wenn man die Transformation weiter so durchführt,0,1,7459519882875374870,7459519882875374870,neutral
7459523278370734870,2025-01-13 22:00:35,httpswwwimdorgcenterswccworldcompetitivenesscenterrankingsworldcompetitivenessrankingrankingswcrrankings_tab_Rank,0,0,7459519882875374870,7459519882875374870,negative
7459523150603797270,2025-01-13 22:00:06,"Die Schuldenbremse behindert weder Investitionen noch Innovationen
httpsanlegerplusdeschuldenbremseinvestitioneninnovationen
Prof Lars P Feld ist Professor für Wirtschaftspolitik",0,24,7459519882875374870,7459519882875374870,neutral
7459523123102712599,2025-01-13 22:00:00,Der Bundesrechnungshof bewertet die Annahmen im Monitoring zur Versorgungssicherheit als wirklichkeitsfremd Das Ergebnis ist ein unwahrscheinlicher BestCase Vielmehr muss auch der Eintritt der Gr,0,0,7459519882875374870,7459519882875374870,neutral
7467080304642851586,2025-02-03 06:46:27,Pappnase,0,0,7459519882875374870,7459519882875374870,negative
7465032363929518870,2025-01-28 18:18:51,Cannabis ,0,0,7459519882875374870,7459519882875374870,negative
7460630009209471766,2025-01-16 21:35:39,Gab es da vor der Sendung ne Bong oder was ,0,0,7459519882875374870,7459519882875374870,negative
7459065485864518422,2025-01-12 16:24:09,Die Psychiatrie hat mal wieder Ausgang,34,2,7459012080956427542,7459012080956427542,neutral
7459012952890196758,2025-01-12 13:00:11,Niemals grün ,30,7,7459012080956427542,7459012080956427542,negative
7459089494601401121,2025-01-12 17:57:06,Grüne Nein Danke,24,2,7459012080956427542,7459012080956427542,negative
7459037663208293142,2025-01-12 14:36:02,Niemals Grün ,14,5,7459012080956427542,7459012080956427542,negative
7459914712219108118,2025-01-14 23:19:51,Noch können sie lachen Ich lache wenn die 45 erreichen ,11,0,7459012080956427542,7459012080956427542,neutral
7460453360829104918,2025-01-16 10:11:25,Habeck seine Jünger ,7,0,7459012080956427542,7459012080956427542,negative
7459918000118350614,2025-01-14 23:33:14,Die Gehilfen des Insolvenz Minister Habeck,7,0,7459012080956427542,7459012080956427542,neutral
7459390426072793878,2025-01-13 13:24:58,Nett aber Grüne wähle ich aus Überzeugung nicht,7,1,7459012080956427542,7459012080956427542,negative
7459142696863908630,2025-01-12 21:23:32,Niemals grün,6,2,7459012080956427542,7459012080956427542,negative
7459049212770042646,2025-01-12 15:20:59,Niemals Grüne Niemals,6,1,7459012080956427542,7459012080956427542,negative
7459055581878698774,2025-01-12 15:45:32,Yes so eine gute Wahl für Köln ,6,2,7459012080956427542,7459012080956427542,positive
7459015214954218262,2025-01-12 13:09:04,,5,2,7459012080956427542,7459012080956427542,negative
7459187123154420502,2025-01-13 00:16:51,  Berîvan für Köln ,4,1,7459012080956427542,7459012080956427542,neutral
7459024020379206422,2025-01-12 13:43:11,Kinder Geburtstag,4,0,7459012080956427542,7459012080956427542,positive
7464529986227143446,2025-01-27 09:50:16,Hoffentlich hat das bald ein Ende Ich ertrage das nicht mehr ,3,0,7459012080956427542,7459012080956427542,neutral
7462267659025367830,2025-01-21 07:31:59,unwählbar,3,0,7459012080956427542,7459012080956427542,negative
7460055774145020694,2025-01-15 08:27:10,Eine Partei die an meine Ersparnisse für meine Renten Versorgung ran will und das Volk Testet ist unwählbar,3,0,7459012080956427542,7459012080956427542,neutral
7459167230884217622,2025-01-12 22:59:18, TeamHabeck Habeck4Kanzler TeamRobert CSUverhindern Merzverhindern FDPverhindern Söderverhindern AfDverhindern CDUverhindern,3,0,7459012080956427542,7459012080956427542,negative
7459103682354627350,2025-01-12 18:52:13,Grün steht für Zuversicht  es geht voran  TeamRobert,3,0,7459012080956427542,7459012080956427542,neutral
7459098484202898198,2025-01-12 18:32:02,Niemals Grüne und Niemals Habeck ,3,1,7459012080956427542,7459012080956427542,negative
7459014947386180374,2025-01-12 13:07:51,Ich finde es gut wie offen sie mit ihrer Behinderung umgehen,3,1,7459012080956427542,7459012080956427542,positive
7467520964297769750,2025-02-04 11:16:40,Niemals,2,0,7459012080956427542,7459012080956427542,negative
7463409207775396610,2025-01-24 09:20:55,Nein,2,0,7459012080956427542,7459012080956427542,negative
7462606333671260950,2025-01-22 05:26:59,unwählbar,2,0,7459012080956427542,7459012080956427542,negative
7461297097888924439,2025-01-18 16:44:14,Ich das Grün nicht mehr sehen,2,0,7459012080956427542,7459012080956427542,negative
7460394045082731286,2025-01-16 06:21:15,niemals grün,2,0,7459012080956427542,7459012080956427542,negative
7459450214484280086,2025-01-13 17:17:01,niemals grün ,2,0,7459012080956427542,7459012080956427542,negative
7459189695995888406,2025-01-13 00:27:24,Glückwunsch ,2,1,7459012080956427542,7459012080956427542,positive
7459151631076147990,2025-01-12 21:58:26,Gruselkabinett,2,1,7459012080956427542,7459012080956427542,negative
7459106747346092802,2025-01-12 19:04:01,Der Terror hat Deutschland längst erreicht Leute geht Wählen wir brauchen 51Prozent geht Wählen weitersagen und danke ,2,0,7459012080956427542,7459012080956427542,neutral
7459106561131627286,2025-01-12 19:03:20,Die versager der nation,2,1,7459012080956427542,7459012080956427542,neutral
7462664564690617110,2025-01-22 09:11:17,Ihr müsst euch vorstellen das es Menschen gibt die ihn wählen und ihn toll finden ohne zu verstehen was das für ein Typ ist Unglaublich,1,0,7459012080956427542,7459012080956427542,negative
7461191342371210006,2025-01-18 09:53:48,grün niemals,1,0,7459012080956427542,7459012080956427542,negative
7460087993404326678,2025-01-15 10:32:50,GRÜN IST UNSER UNTERGANG UND AM 2302 IST GRÜN VORBEI,1,0,7459012080956427542,7459012080956427542,neutral
7460060559166538518,2025-01-15 08:45:48,Wo ist Ricarda,1,1,7459012080956427542,7459012080956427542,negative
