id,create_time,text,like_count,reply_count,parent_comment_id,video_id,sentiment
7465732714991256342,2025-01-30 15:36:45,merz hat recht er ist der letzte der die afd noch aufhalten kann die durch merkel scholz ubd habeck gross geworden ist,0,0,7465396132076719382,7465396132076719382,negative
7465732307380732694,2025-01-30 15:35:21,,0,0,7465396132076719382,7465396132076719382,negative
7465732192524026646,2025-01-30 15:34:59,was für gesicherte rechts wo ist das gesichter ,0,0,7465396132076719382,7465396132076719382,neutral
7465731538118886166,2025-01-30 15:31:53,,0,0,7465396132076719382,7465396132076719382,negative
7465731006721622806,2025-01-30 15:29:54,gott sei dank verschwinden bald die altparteien von der bildfläche das sind die wirklichen antidemokraten in deutschland,0,0,7465396132076719382,7465396132076719382,neutral
7465730663649608470,2025-01-30 15:28:58,endlich mal wieder eine entscheidung für das voll getroffen worden danke,0,0,7465396132076719382,7465396132076719382,positive
7465728873775710998,2025-01-30 15:21:41,in welchem land lebt sie wo rechtsextreme in der regierung sitzen,0,0,7465396132076719382,7465396132076719382,neutral
7465728370354832150,2025-01-30 15:19:53,danke herr merz,0,0,7465396132076719382,7465396132076719382,positive
7465727581838590742,2025-01-30 15:16:55,die afd ist keine gesichert rechtsextreme partei frau lucia schanbacher sie ist aktuell laut verfassungsschutz ein rechtsextremistischer verdachtsfall immer schön bei der wahrheit bleiben  ,0,0,7465396132076719382,7465396132076719382,neutral
7465726681215992578,2025-01-30 15:13:06,wir müssen uns abgrenzen weil die anderen uns spalten ganz klare sache ,0,0,7465396132076719382,7465396132076719382,neutral
7465726649170936598,2025-01-30 15:12:54,afd ist nicht rechtsextrem,0,0,7465396132076719382,7465396132076719382,negative
7465725231908487958,2025-01-30 15:07:52,unfassbar,0,0,7465396132076719382,7465396132076719382,negative
7465724997312660246,2025-01-30 15:06:56,sehr gut die brandmauer kam nur euch zu gute,0,0,7465396132076719382,7465396132076719382,positive
7465724695859446550,2025-01-30 15:05:41,dann verstehe ich nicht wieso die partei noch existiert,0,0,7465396132076719382,7465396132076719382,neutral
7465723420724642582,2025-01-30 15:00:45,so ist demokratie,0,0,7465396132076719382,7465396132076719382,neutral
7465722099341067030,2025-01-30 14:55:21,es lebe die demokratie ,0,0,7465396132076719382,7465396132076719382,neutral
7465722012556706582,2025-01-30 14:54:57,hilfe keiner hat sie vorher gefragt ob man das darf das ist demokratie das jeder sagen darf was er will übrigens auch sie dürfen dass,0,0,7465396132076719382,7465396132076719382,neutral
7465721749561950998,2025-01-30 14:54:12,ist ihr frisör gestorben,0,0,7465396132076719382,7465396132076719382,negative
7465720507766260502,2025-01-30 14:49:05,ich habe immer gesagt für migration muss man nicht denke wer link oder rechts ist sonder ihr muss an uns die bevölkerung denken,0,0,7465396132076719382,7465396132076719382,neutral
7465720444457861910,2025-01-30 14:49:03,ihr habt deutschland ruiniert nie mehr wieder grüne oder spd,0,0,7465396132076719382,7465396132076719382,negative
7465719342161740566,2025-01-30 14:44:57,bravo,0,0,7465396132076719382,7465396132076719382,positive
7465718516398883606,2025-01-30 14:41:25,wenn demokratie einem nicht schmeckt sollte man sich vielleicht woanders bemühen politik zu machen,0,0,7465396132076719382,7465396132076719382,negative
7465718067235078934,2025-01-30 14:39:44,sollen sie jetzt gegen ihren eigenen antrag stimmen nur weil die afd auch dafür ist das macht absolut keinen sinn,0,0,7465396132076719382,7465396132076719382,negative
7465717799926334231,2025-01-30 14:39:08,,0,0,7465396132076719382,7465396132076719382,negative
7465717049920258838,2025-01-30 14:36:04,nur nzis wählen nzis,0,0,7465396132076719382,7465396132076719382,negative
7465716553133966102,2025-01-30 14:34:06,ja das ist zum feiern ,0,0,7465396132076719382,7465396132076719382,negative
7465715757768246038,2025-01-30 14:31:02,hättest du platz für 3 asylanten aus afghanistan sind noch minderjährig und haben schon einiges auf dem kerbholz du wirst dich bestimmt liebevoll um die 3 kümmernoder,0,0,7465396132076719382,7465396132076719382,neutral
7465713066484138774,2025-01-30 14:20:25,sehr gut,0,0,7465396132076719382,7465396132076719382,positive
7465712261616567042,2025-01-30 14:17:37,niemals spd nie wieder spd,0,0,7465396132076719382,7465396132076719382,negative
7465711153353818902,2025-01-30 14:13:10,afd wählen,0,0,7465396132076719382,7465396132076719382,negative
7465710666667180822,2025-01-30 14:11:13,die afd ist nicht rechts wie oft eig noch ,0,0,7465396132076719382,7465396132076719382,negative
7465707856236331798,2025-01-30 14:00:21,leute wählt aufkeinenfall den merz und afd wenn euch etwas noch an deutschland liegt macht diesen fehler nicht ,0,0,7465396132076719382,7465396132076719382,negative
7465707202541241110,2025-01-30 13:57:43,und was hat die spd in der migrationspolitik bewirkt nichts rein gar nichts aber das ist ja nicht so wichtig ,0,0,7465396132076719382,7465396132076719382,negative
7465706772289880854,2025-01-30 13:56:12,,0,0,7465396132076719382,7465396132076719382,negative
7465706455405282070,2025-01-30 13:54:43,endlich ,0,0,7465396132076719382,7465396132076719382,positive
7465705497837929238,2025-01-30 13:51:14,ihr habt sie doch zum einstürzen gebracht,0,0,7465396132076719382,7465396132076719382,neutral
7465705507698098966,2025-01-30 13:51:04,sehr gut ,0,0,7465396132076719382,7465396132076719382,positive
7465704553985016598,2025-01-30 13:47:23,die cdu merkt langsam was die wähler wollen und nicht was die spd oder die grünen wollen und mich freut es so sehr das endlich mal die afd mitbestimmt hat und erfolg hat  232,0,0,7465396132076719382,7465396132076719382,positive
7465704200690483990,2025-01-30 13:46:11,,0,0,7465396132076719382,7465396132076719382,negative
7465704130859385622,2025-01-30 13:45:49,nun tu man nicht so  als ob die sa schon durch das brandenburger tor marschiert,0,0,7465396132076719382,7465396132076719382,neutral
7465704004841784086,2025-01-30 13:45:26,ich höre nur mimimimimimi,0,0,7465396132076719382,7465396132076719382,negative
7465703973262459671,2025-01-30 13:45:04,endlich,0,3,7465396132076719382,7465396132076719382,positive
7465703259836154646,2025-01-30 13:42:15,ihr hattet euch ja mal drum kümmern können dass eure abgeordneten alle da sind dann hätte man das ganz einfach ablehnen können,0,0,7465396132076719382,7465396132076719382,negative
7465703228622111510,2025-01-30 13:42:04,,0,0,7465396132076719382,7465396132076719382,negative
7465703101165929238,2025-01-30 13:41:45,"die brandmauer ist nicht gefallen die cdu ist halt rechts davon
hätte ja keiner ahnen können",0,0,7465396132076719382,7465396132076719382,negative
7465702768453681942,2025-01-30 13:40:49,afd ist für volksabstimmungen schweizer vorbild wo ist das gegen demokratie,0,0,7465396132076719382,7465396132076719382,neutral
7465702727077020438,2025-01-30 13:40:41,ich bin ja dafür nicht nur wählerstimmen zu sammelnzu wählen sondern das wir mit bestimmen dürfen was das land macht für oder gegen ausgaben ins ausland für oder gegen einwanderung dann würde das wirklich anders aussehen aber wir haben ausser wählen nix zu sagen und ehrlich alle belügen uns um stimmen zu bekommen,0,0,7465396132076719382,7465396132076719382,negative
7465702422390063894,2025-01-30 13:39:24,"welche demokratie 
die wahrheit ist nicht rechts ",0,0,7465396132076719382,7465396132076719382,neutral
7465701571419210518,2025-01-30 13:35:45,sind das springerstiefel ,0,0,7465396132076719382,7465396132076719382,neutral
7465701125166940950,2025-01-30 13:34:20,linker unfall im kleidersack,0,0,7465396132076719382,7465396132076719382,negative
7465700886255338262,2025-01-30 13:33:22,,0,0,7465396132076719382,7465396132076719382,negative
7465700391079396118,2025-01-30 13:31:17,ein guter tag für deutschland,0,0,7465396132076719382,7465396132076719382,positive
7465699087289221910,2025-01-30 13:26:34,deutschland zeigt sein wahres gesicht jeder versucht eine bestimmte zeit der deutschen zu leugnen aber im herzen wie man sieht vermisst ihr diese zeit oder wieso ist man sonst für die afd,0,0,7465396132076719382,7465396132076719382,negative
7465698424937218838,2025-01-30 13:23:57,du meinst antidemokratischer schutzwall,0,0,7465396132076719382,7465396132076719382,neutral
7465698125736280855,2025-01-30 13:22:27,abgrenzen von den rechten die aber komischerweise demokratisch gewählt wurde,0,0,7465396132076719382,7465396132076719382,neutral
7465696771172631318,2025-01-30 13:17:09,was ist mit linksextremist auch nicht demokratisch,0,0,7465396132076719382,7465396132076719382,negative
7465696745004188438,2025-01-30 13:17:01,skandal also kein weiter so,0,0,7465396132076719382,7465396132076719382,negative
7465696588749341462,2025-01-30 13:16:24,was bist du,0,0,7465396132076719382,7465396132076719382,negative
7465695541923758870,2025-01-30 13:12:47,,0,0,7465396132076719382,7465396132076719382,negative
7465695414798484246,2025-01-30 13:12:18,wer hat was geschworen,0,0,7465396132076719382,7465396132076719382,negative
7465693983367496471,2025-01-30 13:06:44,nie wieder blockparteien,0,0,7465396132076719382,7465396132076719382,negative
7465693592615879447,2025-01-30 13:04:45,frechheit rechtsextrem ,0,0,7465396132076719382,7465396132076719382,negative
7465693027945399062,2025-01-30 13:02:52,die spd ist gefallen  seitdem die spd nicht mehr demokratisch ist und es keinen unterschied mehr zwischen rot und grün gibt,0,0,7465396132076719382,7465396132076719382,neutral
7465692666623673120,2025-01-30 13:01:43,politik für die mehrheit es kann nicht sein dass der politische gegner einfach mit dem vorwurf rechtsextrem mundtot gemacht wird,0,0,7465396132076719382,7465396132076719382,neutral
7465691622838141718,2025-01-30 12:57:38,15 frau schanbacher  15,0,0,7465396132076719382,7465396132076719382,positive
7465691583691604758,2025-01-30 12:57:21,sehr gut ,0,0,7465396132076719382,7465396132076719382,positive
7465691176332509974,2025-01-30 12:55:47,war die nsdap nicht eine linksextreme partei,0,0,7465396132076719382,7465396132076719382,neutral
7465688340618576662,2025-01-30 12:45:01,das ist demokratie,0,0,7465396132076719382,7465396132076719382,neutral
7465687362241069847,2025-01-30 12:40:34,frau merkel konnte merz nie leiden und sie wusste schon immer das merz gefährlich ist nomerz und wegen ihm niemals cdu ,0,0,7465396132076719382,7465396132076719382,neutral
7465686030155547414,2025-01-30 12:35:31,deutschland muss aufwachen es gibt keine perfekte partei familien wollen überleben und ihre kinder in wohlstand großziehen schließt die grenze ,0,0,7465396132076719382,7465396132076719382,neutral
7465684183202284310,2025-01-30 12:28:24,warum heult eigentlich die spd am meisten,0,0,7465396132076719382,7465396132076719382,negative
7465684103120306966,2025-01-30 12:28:03,mimimimimimi,0,0,7465396132076719382,7465396132076719382,negative
7465683079010763542,2025-01-30 12:24:38,armselige hetze  gegen eine demokratische opposition ,0,0,7465396132076719382,7465396132076719382,negative
7465681203120423702,2025-01-30 12:17:01,was habt ihr denn alle die afd ist die demokratischste partei im gegen satz zu den ganzen anderen parteien die dir deine freie meinung nehmen,0,0,7465396132076719382,7465396132076719382,negative
7465680898583905046,2025-01-30 12:15:37,was ist eine brandmauer,0,0,7465396132076719382,7465396132076719382,neutral
7465680400179020566,2025-01-30 12:13:36,"was hat ihr kanzel im august 2023 gesagt das ist doch keine
zusammenarbeit niemand sollte sich
davon abhängig machen wie die afd
abstimmt",0,0,7465396132076719382,7465396132076719382,neutral
7465680001817412374,2025-01-30 12:12:29,schaut ihr alle nur zu wie unsere kinder ermordet werden  traurig,0,0,7465396132076719382,7465396132076719382,negative
7465679946436674306,2025-01-30 12:12:09,zecke,0,0,7465396132076719382,7465396132076719382,negative
7465679453923590934,2025-01-30 12:10:16,wir schaffen das ,0,6,7465396132076719382,7465396132076719382,neutral
7465679274072572694,2025-01-30 12:09:59,endlich demokratie im bundestag ,0,0,7465396132076719382,7465396132076719382,positive
7465678982241092375,2025-01-30 12:08:23,,0,0,7465396132076719382,7465396132076719382,negative
7465678425011471126,2025-01-30 12:06:22,welche brandmauer es ist eine demokratische partei von mehreren millionen gewählt ihr seit keine demokraten denn ihr spaltet das volk daher nur noch,0,0,7465396132076719382,7465396132076719382,negative
7465677857458144022,2025-01-30 12:04:00,wurde auch endlich zeit,0,0,7465396132076719382,7465396132076719382,positive
7465677246922949398,2025-01-30 12:01:45,wenn eine sache richtig ist kann es doch egal sein wer es beschließt so funktioniert eine demokratie,0,0,7465396132076719382,7465396132076719382,neutral
7465676279154950934,2025-01-30 11:57:53,die spd ist teil von den rechtsrutsch,0,0,7465396132076719382,7465396132076719382,neutral
7465675625668576022,2025-01-30 11:55:13,und das ist auch gut so daß sie gefallen ist,0,0,7465396132076719382,7465396132076719382,neutral
7465675070728848150,2025-01-30 11:53:06,selbstgerecht überheblich und nichtsnutz ,0,0,7465396132076719382,7465396132076719382,negative
7465675053892764439,2025-01-30 11:52:56,"zum aller ersten mal hat demokratie gesiegt
hoffe ihr weißt was demokratie ist nicht nur wie man ausspricht oder schreibt",0,0,7465396132076719382,7465396132076719382,neutral
7465674676624425750,2025-01-30 11:51:57,peinlich,0,0,7465396132076719382,7465396132076719382,negative
7465674455141483266,2025-01-30 11:51:08,was ist mit dem abgrenzen vom linksextremismus heutzutage empfinde ich das als sehr wichtig,0,0,7465396132076719382,7465396132076719382,neutral
7465673644041143062,2025-01-30 11:47:51,,0,0,7465396132076719382,7465396132076719382,negative
7465673360976085782,2025-01-30 11:46:56,spd ,0,0,7465396132076719382,7465396132076719382,negative
7465673360334144278,2025-01-30 11:46:42,in einer gesellschaft die immer weiter ins linksextreme rückt scheint eine ganz normale rechtsliberale partei natürlich extrem,0,0,7465396132076719382,7465396132076719382,neutral
7465673414515327766,2025-01-30 11:46:36,,0,0,7465396132076719382,7465396132076719382,negative
7465672394423730966,2025-01-30 11:43:02,wenn ihr vernünftige politik für alle machen würdet würde keiner afd wählen,0,0,7465396132076719382,7465396132076719382,negative
7465671810894299926,2025-01-30 11:40:15,66 der deutschen finden es gut,0,0,7465396132076719382,7465396132076719382,positive
7465671570335187734,2025-01-30 11:39:49,endlich demokratie,0,0,7465396132076719382,7465396132076719382,positive
7465671170512732950,2025-01-30 11:38:00,es sollte keine rolle spielen von wem ein guter vorschlag kommt es geht um politik für deutschland das alleine sollte das ziel sein und nicht wie im kindergarten,0,0,7465396132076719382,7465396132076719382,neutral
7465670531464479520,2025-01-30 11:35:27,rechts partei,0,0,7465396132076719382,7465396132076719382,neutral
7465670094751499031,2025-01-30 11:34:18,spd,0,0,7465396132076719382,7465396132076719382,negative
7465669734084739862,2025-01-30 11:32:20,liebe lucia es war die entscheidung von merz  cdu wird euch vllt jetzt klar das cdu mit merz nicht die richtige partei ist  einer der gefährlichsten politiker sieg merkel nie überwunden,0,0,7465396132076719382,7465396132076719382,negative
7465669592032527126,2025-01-30 11:31:57,andersrum hätten die rot grünen mit der afd zusammen gearbeitetwenn sie alle 3 mit nein gestimmt hättenschon mal darüber nachgedacht mehrheiten suchen und findenso funktioniert demokratie ,0,0,7465396132076719382,7465396132076719382,positive
7465669295177204502,2025-01-30 11:31:06,bleibt leider nix anderes übrig wenn es so ausartet ,0,0,7465396132076719382,7465396132076719382,negative
7465669001893544726,2025-01-30 11:29:29,nein,0,0,7465396132076719382,7465396132076719382,negative
7465668484879614742,2025-01-30 11:28:00,,0,0,7465396132076719382,7465396132076719382,negative
7465667652662821654,2025-01-30 11:24:51,das outfit sagt alles,0,0,7465396132076719382,7465396132076719382,positive
7465666858172187414,2025-01-30 11:21:03,"was soll das geheule
sie hätten alle für unsere sicherheit stimmen können
sie wollen aber weiterhin gewalttäter zu uns holen
sie wollen das noch mehr ermordet werden",0,0,7465396132076719382,7465396132076719382,negative
7465665771336221462,2025-01-30 11:17:07,das ist die belohnung eures versagens nach 3 jahren ,0,0,7465396132076719382,7465396132076719382,negative
7465665342078632726,2025-01-30 11:15:40, nur noch afd,0,0,7465396132076719382,7465396132076719382,negative
7465665158167069462,2025-01-30 11:15:00,,0,0,7465396132076719382,7465396132076719382,negative
7465665065501410070,2025-01-30 11:14:13,ich bin auch ganz klar gegen die afd aber es ist schon krass wie jetzt auf der cdu und der fdp rumgehackt wird und heute stimmen spd grüne und afd gemeinsam ab aber kein interessiertes,0,0,7465396132076719382,7465396132076719382,negative
7465664150628500246,2025-01-30 11:11:20,wo seid ihr demokratisch wenn ihr pausenlos eine partei ausschließt das ausgrenzen das erinnert mich mehr an 1933,0,0,7465396132076719382,7465396132076719382,negative
7465663588636869398,2025-01-30 11:08:39,mann habt ihr alle panik um eure selbstbedienung es wird hart wieder richtig arbeiten zu gehen,0,5,7465396132076719382,7465396132076719382,negative
7465662278669337367,2025-01-30 11:03:55,ihr habt fertig  flasche leer,0,0,7465396132076719382,7465396132076719382,negative
7465661287708820246,2025-01-30 10:59:37,schade das die alt partei nicht mal für ihr fehler einsteht auch grün und links ich hoffe das die afd wirklich was fürs volk macht versprechungen gab es genug,0,0,7465396132076719382,7465396132076719382,negative
7465660326978585366,2025-01-30 10:56:05,tja egal was man davon hält die bürger wählen es das kommt nicht von irgendwo,0,0,7465396132076719382,7465396132076719382,negative
7465659547010384662,2025-01-30 10:53:19,der alte mannkann ich die steine der kaputten brandmauer haben brauche die für eine neue garage für meinen suv  ,0,0,7465396132076719382,7465396132076719382,negative
7465658761128444694,2025-01-30 10:50:34,ich liebe euer mimimi,0,0,7465396132076719382,7465396132076719382,positive
7465657674819584790,2025-01-30 10:45:56,es ist das richtige off,0,0,7465396132076719382,7465396132076719382,positive
7465657704489747222,2025-01-30 10:45:48,historisch ist nur das gejammere,0,0,7465396132076719382,7465396132076719382,neutral
7465657356517999383,2025-01-30 10:44:27,afd ist rechtsextrem was ist mit eurer linksextremen jugend,0,0,7465396132076719382,7465396132076719382,negative
7465657218500920086,2025-01-30 10:44:24,afd die heimat der dritte weg cducsu fdp freie wähler  bsw sind einfach unwählbar,0,0,7465396132076719382,7465396132076719382,negative
7465657169221436182,2025-01-30 10:44:01,"margot friedländer esther benjarano  viele weitere holocaustüberlebende
warnen vor der afd",0,0,7465396132076719382,7465396132076719382,neutral
7465657114619659030,2025-01-30 10:43:31,ihr seid gesichert linksextreme checkt bloß keiner ,0,0,7465396132076719382,7465396132076719382,negative
7465656983973200662,2025-01-30 10:43:30, httpswwwshirteecomdebrandmauer02,0,0,7465396132076719382,7465396132076719382,negative
7465654265915638550,2025-01-30 10:32:41,eine schande ist das verbrecher in deutschland bundeskanzler werden können ,0,0,7465396132076719382,7465396132076719382,neutral
7465653250898690838,2025-01-30 10:28:54,sehr gut,0,0,7465396132076719382,7465396132076719382,positive
7465652732617294614,2025-01-30 10:27:06,"demokratie gesichert rechtsextrem wir die demokratinnen und demokraten
",0,0,7465396132076719382,7465396132076719382,neutral
7465651354192855830,2025-01-30 10:21:43,demokratie heißt das volk entscheidet und heute hat seit jahren endlich mal das volk entschieden  wohlgemerkt durch eine demokratisch gewählte mehrheit ,0,0,7465396132076719382,7465396132076719382,neutral
7465650006349038358,2025-01-30 10:16:25,,0,0,7465396132076719382,7465396132076719382,negative
7465649072142254870,2025-01-30 10:12:17,schande,0,0,7465396132076719382,7465396132076719382,negative
7465648993394033430,2025-01-30 10:11:52,die demokraten reden von demokratie sie betonen es sie bezeichnen sich selbst als demokraten verhalten sich aber irgend wie anders,0,0,7465396132076719382,7465396132076719382,neutral
7465647524541317910,2025-01-30 10:06:42,zynisch sind sie sie sie das bvg um zu entscheiden wer hier rechtsextrem ist sie treten mit ihrer auffassung von demokratie den eltern der verfassung voll in die fre,0,0,7465396132076719382,7465396132076719382,neutral
7465647065142592278,2025-01-30 10:04:31,und ich mich von linksradikalen,0,0,7465396132076719382,7465396132076719382,neutral
7465644353928381206,2025-01-30 09:54:23,gesichert rechts extrem so blödsinn mir gehen diese ganzen narrative langsam sehr auf die nerven aber ihr werdet es nicht müde aber die leute nicht so blöd dass das nicht auffällt,0,1,7465396132076719382,7465396132076719382,negative
7465644151657710358,2025-01-30 09:53:26,nicht rechtsextrem,0,0,7465396132076719382,7465396132076719382,negative
7465642352595256086,2025-01-30 09:46:36,was ist denn demokratie das jeder das wählen darf was er möchte und eine gesunde diskussion ist doch wünschenswert,0,0,7465396132076719382,7465396132076719382,neutral
7465639746615968534,2025-01-30 09:36:45,sie sind nur lächerlich,0,0,7465396132076719382,7465396132076719382,negative
7465639249745937174,2025-01-30 09:34:50,naja man kann es auch übertreiben,0,0,7465396132076719382,7465396132076719382,negative
7465639064826544918,2025-01-30 09:33:37,macht mal politik fürs volk und sowas müsste nicht passieren,0,0,7465396132076719382,7465396132076719382,negative
7465634963699680022,2025-01-30 09:18:03,sowas nennt man demokratie,0,0,7465396132076719382,7465396132076719382,negative
7465633287928464150,2025-01-30 09:11:29,afd  rechtsextrem bzw nzi,0,0,7465396132076719382,7465396132076719382,negative
7465629965560578838,2025-01-30 08:58:00,,0,0,7465396132076719382,7465396132076719382,negative
7465629067577459478,2025-01-30 08:54:50,tränen trocknen auch wieder  am besten in der opposition,0,3,7465396132076719382,7465396132076719382,neutral
7465628835062022934,2025-01-30 08:54:07,das hat sich nicht geändert sie wollen gewählt werden und sind nicht objektiv,0,0,7465396132076719382,7465396132076719382,neutral
7465627190131655446,2025-01-30 08:47:49,,0,0,7465396132076719382,7465396132076719382,negative
7465623789684376342,2025-01-30 08:34:59,niemals cducsu niemals fdp niemals afd niemals bsw niemals freie wähler,0,0,7465396132076719382,7465396132076719382,negative
7465619456578339606,2025-01-30 08:18:17,brandmauer ist wenn eine demokratische partei mit nazis zusammen arbeitet bitte nur spd wählen ,0,0,7465396132076719382,7465396132076719382,negative
7465617234133795606,2025-01-30 08:09:32,find das echt so geilman hetztman hat panik wenn man die jugend fragt warum nicht afd können die nicht richtig antwortenopfer des nazionalsocialismus wer denkt an die opfer der letzten 10 jahre,0,0,7465396132076719382,7465396132076719382,negative
7465616144298050326,2025-01-30 08:05:05,"the boss is back und bringt das goldene zeitalter zurück
tschüss bunte regenbogenwelt",0,0,7465396132076719382,7465396132076719382,neutral
7465609993741861634,2025-01-30 07:40:59,habt ihr nicht mit der afd gemeinsam den anderen antrag verhindert wann blau rote koalition,0,0,7465396132076719382,7465396132076719382,negative
7465603798032319254,2025-01-30 07:16:47,der merz hat letzte order von ellen musk bekommen rechts zu stärken dafür wurde ihm ein hübsches sümmchen bei black rock hinterlegt damit es nicht auffällt ,0,0,7465396132076719382,7465396132076719382,neutral
7465601695067276054,2025-01-30 07:08:46,rechtsextrem ,0,0,7465396132076719382,7465396132076719382,negative
7465597514473980694,2025-01-30 06:52:22,heute hat die cdu gelernt was demokratie bedeutet den willen des volkes zu exekutieren und nichts anderesdas ist eine hysterische antdemokratin  sobreden nazis,0,0,7465396132076719382,7465396132076719382,negative
7465590075880375062,2025-01-30 06:23:39,soll nicht die woche oder nâchste für das afd verbotsverfahren gestimmt werden ich hoffe die cdu is da nicht genauso drauf,0,0,7465396132076719382,7465396132076719382,negative
7465582024168276758,2025-01-30 05:53:17,ich weiß gar nicht wie traurig ich gucken soll ,0,0,7465396132076719382,7465396132076719382,negative
7465579645451420438,2025-01-30 05:43:37,hopp hopp schnell eine brandmauer zur cdu aufziehen ansonsten habt ihr seid 2015 die leute verblendet mit der afd,0,0,7465396132076719382,7465396132076719382,negative
7465579523779609366,2025-01-30 05:43:37,und wann eröffnet ihr wieder die kz lager ,0,0,7465396132076719382,7465396132076719382,negative
7465578722303197974,2025-01-30 05:41:03,die ist mies auf beruhigungsmittel,0,0,7465396132076719382,7465396132076719382,negative
7465578518048277270,2025-01-30 05:39:36,die afd is nicht rechts extrem,0,0,7465396132076719382,7465396132076719382,negative
7465577945400230678,2025-01-30 05:37:50,traurig merz hat kein rückgrat wählt links kinder für eine bessere zukunft,0,0,7465396132076719382,7465396132076719382,negative
7465576907624432406,2025-01-30 05:33:48,5vor1933,0,0,7465396132076719382,7465396132076719382,positive
7465576542861558560,2025-01-30 05:30:56,"genau
die sache spielt keine rolle
wichtig ist nur alles zu boykottieren
ihr habt nur angst vor dem unaufhaltsamen machtverlust",0,1,7465396132076719382,7465396132076719382,negative
7465539370705421078,2025-01-30 03:14:11,wird zeit auszuwandern,0,0,7465396132076719382,7465396132076719382,positive
7465539261493281558,2025-01-30 03:11:28,,0,0,7465396132076719382,7465396132076719382,negative
