id,create_time,text,like_count,reply_count,parent_comment_id,video_id,sentiment
7465538906861044502,2025-01-30 03:11:23,,0,0,7465396132076719382,7465396132076719382,negative
7465535094272394006,2025-01-30 02:56:32,afd ist eine demokratische partei  gewählt vom volk in den bundestag,0,0,7465396132076719382,7465396132076719382,neutral
7465532786096784150,2025-01-30 02:47:52,die reichen erlauben sich alles mit uns weil in ihren augen das volk dumm und faul ist das manöver lenkt von den grundproblemen wie dem veralteten schulsystem und krankensystem ab,0,0,7465396132076719382,7465396132076719382,neutral
7465517997219906326,2025-01-30 01:48:52,sind jetzt die linken die nazis oder die rechten frage für einen freund ,0,0,7465396132076719382,7465396132076719382,neutral
7465516081793909526,2025-01-30 01:39:47,die linke gegen faschismus und kapitalismus,0,0,7465396132076719382,7465396132076719382,neutral
7465499729708106518,2025-01-30 00:34:11,nur noch spd  bsw,0,0,7465396132076719382,7465396132076719382,negative
7465489513402827542,2025-01-29 23:53:53,"
𝗞𝗔𝗡𝗭𝗟𝗘𝗥𝗜𝗡ϩ0ϩƽ

𝐀𝐥𝐢𝐜𝐞 𝐖𝐞𝐢𝐝𝐞𝐥",0,0,7465396132076719382,7465396132076719382,neutral
7465488670230479618,2025-01-29 23:50:26,ein großartiger tag für deutschland und die demokratie und ein klares zeichen an die parteiendie denken die demokratie gepachtet zu haben,0,0,7465396132076719382,7465396132076719382,positive
7465486049315603222,2025-01-29 23:40:59,was für eine brandmauer  die deutschen unterstützen eine veränderung der asylpolitik  die mehrheit entscheidet ,0,0,7465396132076719382,7465396132076719382,neutral
7465485468374352662,2025-01-29 23:38:26,die konservativen erpressen reformen verweigern für macht und ideologiehat die linke mit spd 1930 schon mal gemacht ergebnis bekannt wehred den anfängen nannte sich nicht umsonst natlsozialisten,0,0,7465396132076719382,7465396132076719382,neutral
7465484240353035030,2025-01-29 23:33:03,habeck ich wusste mit deutschland noch nie etwas anzufangen und weiß es bis heute nicht,0,0,7465396132076719382,7465396132076719382,negative
7465483639695885078,2025-01-29 23:31:18,,0,0,7465396132076719382,7465396132076719382,negative
7465483539287999254,2025-01-29 23:30:30,,0,0,7465396132076719382,7465396132076719382,negative
7465477959474791190,2025-01-29 23:08:14,endlich ,0,0,7465396132076719382,7465396132076719382,positive
7465476971347542806,2025-01-29 23:04:39,ja das ist eben demokratie und wir werden dafür sorgen dass es dabei bleibt am 23 februar nur ,0,0,7465396132076719382,7465396132076719382,neutral
7465475670031205142,2025-01-29 22:59:35,gelebte demokratie die marxisten haben fertig ,0,0,7465396132076719382,7465396132076719382,neutral
7465475092131644182,2025-01-29 22:57:18,wir feiern,0,0,7465396132076719382,7465396132076719382,neutral
7465474519487922966,2025-01-29 22:55:13,heute hatte ich mal wieder das gefühl das wir zurück zu demokratie gefunden haben und ich habe bewusst auf das wort unsere verzichtet weil eure demokratie eine linksgrüne diktatur ist,0,0,7465396132076719382,7465396132076719382,neutral
7465472303737013014,2025-01-29 22:46:08,ganz einfach er braucht euch eingrauchte nicht,0,0,7465396132076719382,7465396132076719382,negative
7465472145411162902,2025-01-29 22:46:00,wo ist denn die afd gesichert rechtsextrem urteil dazu abgrenzen ich dachte ihr seit gegen spaltung hass und hätze der wahre faschismus kommt von links,0,0,7465396132076719382,7465396132076719382,negative
7465471937034208022,2025-01-29 22:45:12,fragt doch einfach mal das volk ihr sogenannten demokraten ,0,2,7465396132076719382,7465396132076719382,neutral
7465471797991850774,2025-01-29 22:44:11,ist demokratie nicht etwas herrliches ,0,0,7465396132076719382,7465396132076719382,negative
7465470949909070614,2025-01-29 22:41:23,es geht um das wohl des volkes und nicht um die machtintresse einzelner personen,0,0,7465396132076719382,7465396132076719382,neutral
7465470645679227670,2025-01-29 22:40:07,was ist falsch menschen und vor allem kinder vor attentäter zu schützen,0,0,7465396132076719382,7465396132076719382,neutral
7465470427579056918,2025-01-29 22:39:01,wenn sie gemäßigt über menschen sprechen würden die sie remigrieren wollen dann müssten wir heute nicht mit einer gewissen traurigkeit über unser land reden,0,0,7465396132076719382,7465396132076719382,neutral
7465470136888623894,2025-01-29 22:37:59,sie glauben doch nicht an dem was sie dort erzählt oder doch,0,0,7465396132076719382,7465396132076719382,neutral
7465469507718562582,2025-01-29 22:35:42,blablabla,0,0,7465396132076719382,7465396132076719382,positive
7465469179056096022,2025-01-29 22:34:00,alleine das foto der alten  checkt die nicht das scholz das land nicht unter kontrolle hatte  sag mal wo leben diese leute,0,0,7465396132076719382,7465396132076719382,negative
7465468934136529666,2025-01-29 22:33:32,stuss ,0,0,7465396132076719382,7465396132076719382,negative
7465467812979737366,2025-01-29 22:28:46,,0,0,7465396132076719382,7465396132076719382,negative
7465465561557943062,2025-01-29 22:20:15,man hat das gefühl es geht gar nicht darum ob ein antrag richtig und wichtig oder falsch ist  es geht nur darum die afd aus dem spiel zu halten das kann nicht im sinne der bürger sein ,0,0,7465396132076719382,7465396132076719382,negative
7465464624655549206,2025-01-29 22:16:39,was bedeutet das jetzt bitte lass hier keine schlümpfe antworten,0,0,7465396132076719382,7465396132076719382,negative
7465464081831953174,2025-01-29 22:14:14,ein sehr gut nachricht,0,0,7465396132076719382,7465396132076719382,positive
7465463212975784706,2025-01-29 22:11:11,sehen auch alle gleich aus irgendwie klingt komisch ist aber so ,0,2,7465396132076719382,7465396132076719382,negative
7465462676971668246,2025-01-29 22:08:45,ach kleene das ist albern,0,0,7465396132076719382,7465396132076719382,negative
7465461859614163734,2025-01-29 22:05:31,in einer demokratie redet und streitet man miteinander eine brandmauer errichtet man nur in einer diktatur ,0,0,7465396132076719382,7465396132076719382,neutral
7465461572154589974,2025-01-29 22:04:15,endlich kommt wieder ordnung in unser land das wünsche ich mir der anfang ist getan ich hoffe es wird bis zur wahl durchgezogen grüne linke abwählen schaden der demokratie,0,0,7465396132076719382,7465396132076719382,positive
7465461140392657686,2025-01-29 22:03:06,"nur noch lächerlich
erst spalten sie das land und dann rufen sie nach demokratischen werten",0,0,7465396132076719382,7465396132076719382,negative
7465459326293164822,2025-01-29 21:55:57,je mehr brandmauern desto mehr kann uns die afd vor sich her treiben,0,0,7465396132076719382,7465396132076719382,neutral
7465459393765606167,2025-01-29 21:55:47,das macht hoffnung dass das menschenverachtende diktat dieser linksgrünen altparteien in deutschland endlich zu ende geht,0,0,7465396132076719382,7465396132076719382,neutral
7465459251445596951,2025-01-29 21:55:28,das nennt sich demokratie aber davon haben sie ja keine ahnung  sie sind dermaßen linksextrem,0,0,7465396132076719382,7465396132076719382,neutral
7465458786725495574,2025-01-29 21:54:01,,0,0,7465396132076719382,7465396132076719382,negative
7465457539234497302,2025-01-29 21:49:02,cdu hat selbstmord gemacht ,0,0,7465396132076719382,7465396132076719382,negative
7465456509410804502,2025-01-29 21:44:53,"ihr merkt doch selbst 16 jahre sind den deutschen zu viel
seid helmut schmidt hat die spd nichts mehr für die deutschen gemacht",0,0,7465396132076719382,7465396132076719382,negative
7465456438786704150,2025-01-29 21:44:28,afdalternative für dumme,0,0,7465396132076719382,7465396132076719382,negative
7465455445831435030,2025-01-29 21:40:39,linke tränen  das salz der erde mädchen,0,0,7465396132076719382,7465396132076719382,neutral
7465455338547086103,2025-01-29 21:40:24,"ihr grenzt euch nicht nur von der afd ab sondern auch von deren wählern das ist also eure demokratie 
",0,0,7465396132076719382,7465396132076719382,negative
7465454113254572822,2025-01-29 21:35:23,morgen soll es wieder kälter werden zieht euch bitte was warmes an die grippe geht um,0,0,7465396132076719382,7465396132076719382,negative
7465453883381957398,2025-01-29 21:34:36,rechts is cool ,0,0,7465396132076719382,7465396132076719382,positive
7465452960371213078,2025-01-29 21:31:07,und warum ist es soweit gekommen weil die grünen und die spd realitätsfern geworden sind und eine verweigerungspolitik machen jede stimme der cdu ,0,0,7465396132076719382,7465396132076719382,negative
7465452721216291606,2025-01-29 21:30:12,herrlich wie linksgrün die hosen voll hat und zwar gestrichen nix mehr mit agenda durchdrücken weil man sonst ja mit den na regiert das war heute demokratie at it best ,0,0,7465396132076719382,7465396132076719382,negative
7465451061491794710,2025-01-29 21:23:33,,0,0,7465396132076719382,7465396132076719382,negative
7465450000706093856,2025-01-29 21:19:25,sehr schön,0,0,7465396132076719382,7465396132076719382,positive
7465449157736055574,2025-01-29 21:16:28,scu ist auch rechtsextremisten,0,0,7465396132076719382,7465396132076719382,neutral
7465449142586213142,2025-01-29 21:16:25,es hätte gar nicht so weit kommen müssen wenn vorher vernünftig gehandelt worden wäreaus meiner sicht ist migration in dieser form nicht umsetzbar,0,0,7465396132076719382,7465396132076719382,negative
7465447830988194562,2025-01-29 21:10:52,,0,0,7465396132076719382,7465396132076719382,negative
7465447550884905750,2025-01-29 21:10:00,ich will keine nazi zeit mehr haben bin fassungslos nach den 2 weltkrieg das unsere demokratie von den rechtsradikalen zerstört wird,0,0,7465396132076719382,7465396132076719382,negative
7465446506469982998,2025-01-29 21:06:02,die kommen immer mit dem alten dreck wir leben im hier und jetzt,0,0,7465396132076719382,7465396132076719382,negative
7465445228158960406,2025-01-29 21:00:42,ein super tag ein demokratischer tag die mehrheit der bürger wurden endlich erhört,0,0,7465396132076719382,7465396132076719382,neutral
7465444070191465238,2025-01-29 20:56:23,nein es geht nicht darum sich irgendwo von rechtsextremen abzugrenzen es geht vielmehr darum sich endlich mit offensichtlichen problemen zu beschäftigen das sollte auch ihr credo sein ,0,0,7465396132076719382,7465396132076719382,negative
7465441693489742614,2025-01-29 20:47:29,demokratie ist passiert nichts schlimmes ,0,0,7465396132076719382,7465396132076719382,neutral
7465441160703656726,2025-01-29 20:45:13,sehr gutunser volk möchte das denn wir leben in unser deutschland,0,0,7465396132076719382,7465396132076719382,positive
7465425666549482262,2025-01-29 19:44:47,,0,0,7465396132076719382,7465396132076719382,negative
7465410444128731926,2025-01-29 18:45:53,deutschland ,0,0,7465396132076719382,7465396132076719382,positive
7465410021788435222,2025-01-29 18:44:29,das blaue kleidwürde nwn fussballfan nie passierendie farbe des feindvereins zu benutzen,0,0,7465396132076719382,7465396132076719382,neutral
7465567459556082454,2025-01-30 04:58:43,clowns ,0,0,7465396132076719382,7465396132076719382,positive
7465471761405657878,2025-01-29 22:44:21,quassel quassel,0,0,7465396132076719382,7465396132076719382,negative
7465270766575059734,2025-01-29 09:44:44,,1,0,7465257734066343191,7465257734066343191,negative
7465270740612547350,2025-01-29 09:44:41,,1,0,7465257734066343191,7465257734066343191,negative
7465270694450201366,2025-01-29 09:44:35,,1,0,7465257734066343191,7465257734066343191,negative
7465113328910926597,2025-01-28 23:32:54,innerhalb von 12 tagen habe ich 2500 in forex investiert und unglaubliche 45000 gewinn gemacht mehr infos bei samuel erzieher samuel,0,0,7464203560163593494,7464203560163593494,neutral
7465099895772660502,2025-01-28 22:41:42,wer die afd wählt will auch damals wieder deshalb nur noch ,0,0,7464203560163593494,7464203560163593494,negative
7463928356033151766,2025-01-25 18:54:53,herr merz weis gar nicht was er willeinmal sound dann wieder sodeutschland braucht eine führung und kein kasperle,3,0,7463923719371492630,7463923719371492630,negative
7463961411186950934,2025-01-25 21:02:51,ich hab auch ein sehr sehr ungutes gefühl bei seinen worten,3,1,7463923719371492630,7463923719371492630,neutral
7465050497981367062,2025-01-28 19:29:05,gutes video,0,0,7463923719371492630,7463923719371492630,positive
7462738728931853078,2025-01-22 13:58:32,da wähle ich lieber die linken,6,0,7462733864402816278,7462733864402816278,negative
7462738285334807318,2025-01-22 13:57:12,ich wähle bestimmt keine spd mehr ,6,0,7462733864402816278,7462733864402816278,negative
7462736264397079318,2025-01-22 13:49:09,darf ich sie mit meiner erststimme wählen ich wohne in freiberg am neckar,3,3,7462733864402816278,7462733864402816278,neutral
7462772991858197270,2025-01-22 16:11:46,spd ,2,0,7462733864402816278,7462733864402816278,negative
7462770703902393110,2025-01-22 16:02:32,lieber links,1,0,7462733864402816278,7462733864402816278,negative
7462397651570033430,2025-01-21 15:54:59,na ja ich halte ihn auch für einen idioten trotzdem sollte deutschland respekt vor dem amerikanischen wähler zeigen und sich auch mal raushalten können,0,2,7462386474986671362,7462386474986671362,negative
7469642734216725253,2025-02-10 04:29:40,schön schöne arbeit die sie machen grüße aus münchen,0,0,7468767500520508694,7468767500520508694,positive
7468771760304571158,2025-02-07 20:09:43,wer blau wählt will auch damals wiederdeshalb nur noch ,0,0,7468767500520508694,7468767500520508694,neutral
7468440990257496854,2025-02-06 22:46:17,wer blau wählt will damals auch wieder deshalb nur noch ,0,0,7468384480936398102,7468384480936398102,negative
7468406823902905094,2025-02-06 21:26:36,salut comment allez vous,0,0,7468384480936398102,7468384480936398102,negative
7468399500190745366,2025-02-06 20:05:04,die ersten 6 worte waren die absolute wahrheit,0,0,7468036224092065046,7468036224092065046,neutral
7468048166648136470,2025-02-05 21:22:50,alles gute für die wahl ,0,0,7468036224092065046,7468036224092065046,positive
7467648341313323798,2025-02-04 19:30:00,hot for a reason sozialpolitik nicht erst im wahlkampf entdecken und dann wieder ganz schnell vergessen ,5,0,7467646403032927510,7467646403032927510,neutral
7467674150854132502,2025-02-04 21:10:13,hot for a reason die linke wählen ,5,0,7467646403032927510,7467646403032927510,neutral
7467972230149227269,2025-02-05 16:26:43,ich habe gerade meinen kryptogewinn von 35000  erhalten ich liebe dich samuel und gott segne dich so sehr  erzieher samuel,0,0,7467646403032927510,7467646403032927510,neutral
7467695342487290646,2025-02-04 22:32:55,ok komm wenn ihr den trend schon macht dann macht auch den trend,0,0,7467646403032927510,7467646403032927510,positive
7467674897462149910,2025-02-04 21:13:23,hot for a reason kandidatiinnen haben die sich keinen drauf keulen wie hoch die prozente beim abschieben gestiegen sind,0,0,7467646403032927510,7467646403032927510,neutral
7467294361526190870,2025-02-03 20:36:26,also afd wählt man am besten am 25 und ganz wichtig unterschreiben nicht vergessen,3,0,7467273133699927318,7467273133699927318,negative
7467298971561886486,2025-02-03 20:54:30,die linke ,1,0,7467273133699927318,7467273133699927318,neutral
7467279391346295574,2025-02-03 19:38:19,tut mir leid gysi muss rein der ist nicht so vergesslich wie olaf ,1,0,7467273133699927318,7467273133699927318,negative
7467846385003447062,2025-02-05 08:19:21,da die altparteien für uns rentner nichts über habt werde ich euch auch nicht wählen  seit 3040 jahren sagen experten was gemacht werden sollte ihr hattet genug zeit,0,0,7467273133699927318,7467273133699927318,negative
7467411821147243286,2025-02-04 04:16:19,,0,0,7467273133699927318,7467273133699927318,negative
7467302972520989462,2025-02-03 21:10:05,fritze ist ja wohl dermaßen raus,0,0,7467273133699927318,7467273133699927318,negative
7467274128162898710,2025-02-03 19:17:59,bsw,0,0,7467273133699927318,7467273133699927318,negative
7466906267748614934,2025-02-02 19:30:25, go spd go,1,0,7466716277453770006,7466716277453770006,negative
7472845724301984534,2025-02-18 19:38:35,ihr meintet wohl zwei stimmen nach links,2,0,7472840370980752662,7472840370980752662,neutral
7472893465942360854,2025-02-18 22:44:18,deswegen die linke ,0,0,7472840370980752662,7472840370980752662,negative
7472870491080344342,2025-02-18 21:14:50,"
spd
",0,0,7472840370980752662,7472840370980752662,negative
7472857255311409942,2025-02-18 20:23:13,,0,0,7472840370980752662,7472840370980752662,negative
7471525107081413398,2025-02-15 06:14:46,gibt aber gefühlt immer irgendwenn derdie wirklich am handy spielen  im hessischen landtag hab ich tatsächlich eine beim candy crush spielen beobachtet,64,11,7471341833478491414,7471341833478491414,negative
7471985074738430722,2025-02-16 11:58:48,wer hat uns verraten ,9,0,7471341833478491414,7471341833478491414,negative
7471345016804623126,2025-02-14 18:34:58,warum darf man keine laptops öffnen,7,2,7471341833478491414,7471341833478491414,negative
7494596981148222230,2025-04-18 10:24:08,ist das candycrush herr bundeskanzler,0,0,7471341833478491414,7471341833478491414,neutral
7471774584905138966,2025-02-15 22:22:09,yvi,0,0,7471341833478491414,7471341833478491414,positive
7470974209596228374,2025-02-13 18:36:20,handys sollten verboten werden im bundestag,20,8,7470971006224436502,7470971006224436502,neutral
7471250299932476182,2025-02-14 12:27:32,handy verbot alle anderen an müssen auch ohne auskommen ergo gilt das auch für unsere angestellten,8,1,7470971006224436502,7470971006224436502,negative
7470962784618152726,2025-02-13 17:51:55,"
 spd 2025  
",1,0,7470927072605588758,7470927072605588758,positive
7470483269453513494,2025-02-12 10:51:21,mir fehlen abtreibungsrechte und deutschland ticket in dem filter,2,1,7470472033424477463,7470472033424477463,negative
7470600305652024086,2025-02-12 18:25:17,keine grenzkontrollen aha verrät einiges,11,0,7470257717052001558,7470257717052001558,negative
7470416527336276758,2025-02-12 06:33:07,,2,0,7470257717052001558,7470257717052001558,negative
7490604889015780118,2025-04-07 16:12:48,warum macht ihrs dann nicht ,1,0,7470257717052001558,7470257717052001558,negative
7470522006358917911,2025-02-12 13:21:20,welche partei ist die,1,7,7470257717052001558,7470257717052001558,neutral
7470149397582775062,2025-02-11 13:15:37,,9,0,7470124446339271958,7470124446339271958,negative
7470156514005058326,2025-02-11 13:43:39,,6,0,7470124446339271958,7470124446339271958,negative
7470201771424711446,2025-02-11 16:38:43,haha einfach larscameo  stabiles ranking ,5,0,7470124446339271958,7470124446339271958,positive
7471937129188492054,2025-02-16 08:53:09,deshalb die linke ,2,0,7470124446339271958,7470124446339271958,neutral
7470136786628444950,2025-02-11 12:27:01,,1,3,7470124446339271958,7470124446339271958,negative
7474900675546907414,2025-02-24 08:33:22,unglaublich dass das die vorstellung ist das zeigt einfach wie unbelehrbar die spd geworden ist und dass dieses ergebnis recht geschieht,2,0,7473571868771912982,7473571868771912982,negative
7478999748044309270,2025-03-07 09:39:15,ich sehe überhaupt kein problem darin alles noch schneller zu machen streng dich einfach mehr an,1,0,7473571868771912982,7473571868771912982,positive
7476203837893493526,2025-02-27 20:49:25,in der gepanzerten s klasse sitzen die wirklich wichtigen,1,0,7473571868771912982,7473571868771912982,neutral
7474356539667841814,2025-02-22 21:21:10,wählt afd  wählt alice für deutschland  im gleichhschritt mit     2422025 die ukraine kapituliert  ein sieg für die welt  deine zukunft wähle afd ,1,0,7473571868771912982,7473571868771912982,neutral
7474347995427259158,2025-02-22 20:48:08,rennt sie vor den syrern weg,1,1,7473571868771912982,7473571868771912982,neutral
7473894320622895894,2025-02-21 15:27:43,minister müsste man sein,1,0,7473571868771912982,7473571868771912982,negative
7479124618268427030,2025-03-07 17:43:29,okay das ist ziemlich gut gemacht ahahhahaha ,0,0,7473571868771912982,7473571868771912982,positive
7477947341158155031,2025-03-04 13:35:12,was soll einem dieses video sagen ,0,0,7473571868771912982,7473571868771912982,negative
7473595005773873942,2025-02-20 20:06:05,,0,0,7473571868771912982,7473571868771912982,negative
7473472002722202390,2025-02-20 12:09:20,wenn ihr wollt dass diese schönen pläne der spd auch tatsächlich umgesetzt werden und sie nicht einfach merz nach der nase tanzen solltet ihr die linken wählen,0,0,7473402019668036886,7473402019668036886,neutral
