id,create_time,text,like_count,reply_count,parent_comment_id,video_id,sentiment
7471267385510101782,2025-02-14 13:33:57,da wird auch so nichts hübsches draus,0,0,7464563558148246806,7464563558148246806,negative
7470256785989124886,2025-02-11 20:12:21,ricarda was hast du der brücke angetan,0,0,7464563558148246806,7464563558148246806,neutral
7470162382754235158,2025-02-11 14:06:04,starke frau das schlimmste ist dass es hauptsächlich männliche gesichtsbarracken sind die bodyshaming betreiben,0,0,7464563558148246806,7464563558148246806,neutral
7470119646526669570,2025-02-11 11:20:39,way yo speak englisch pommes panzer,0,0,7464563558148246806,7464563558148246806,negative
7469746994622661398,2025-02-10 11:14:17,,0,0,7464563558148246806,7464563558148246806,negative
7469720542866834198,2025-02-10 09:31:42,wer bist du hä,0,1,7464563558148246806,7464563558148246806,negative
7467414348593939222,2025-02-04 04:28:05,wo war der post vor 3 jahren,0,0,7464563558148246806,7464563558148246806,negative
7467390970695336726,2025-02-04 02:55:47,verstehe sowieso nicht warum man andere körper beurteilen muss lebt einfach euer leben und gut ist,0,0,7464563558148246806,7464563558148246806,positive
7466846790798951190,2025-02-02 15:40:01,es ist mehr die politik als der körper ,0,1,7464563558148246806,7464563558148246806,neutral
7466800823609049878,2025-02-02 12:41:26,belächelt und abgelehnt wegen ihrer nicht vorhandenen berufsabschlüsse und ihrer politischen aussagen und noch was welchen schuh man sich anzieht usw,0,0,7464563558148246806,7464563558148246806,negative
7466759028590674710,2025-02-02 09:59:28,wegovy macht auch nicht schlau ,0,0,7464563558148246806,7464563558148246806,negative
7466749519603024662,2025-02-02 09:22:11,ja,0,0,7464563558148246806,7464563558148246806,negative
7466669270954885910,2025-02-02 04:17:26,,0,0,7464563558148246806,7464563558148246806,negative
7466387802272858902,2025-02-01 09:58:41,beste rede ever ich bin so froh dass es dich gibt  arbeite selbst in einem toxischen umfeld sonst würd ich sagen abklatschen respektiere deine entscheidung total danke,0,0,7464563558148246806,7464563558148246806,positive
7466357366104802070,2025-02-01 08:01:01,we do have,0,0,7464563558148246806,7464563558148246806,positive
7466353629140124438,2025-02-01 07:47:00,pa nz er,0,0,7464563558148246806,7464563558148246806,negative
7466185196389253910,2025-01-31 20:52:24,,0,0,7464563558148246806,7464563558148246806,negative
7466184526799078167,2025-01-31 20:49:46,was macht der panzer auf meiner fy,0,0,7464563558148246806,7464563558148246806,negative
7466167776266404630,2025-01-31 19:44:53,vll die bk app mal auf englisch stellen,0,0,7464563558148246806,7464563558148246806,negative
7466132669366453014,2025-01-31 17:28:32,,0,0,7464563558148246806,7464563558148246806,negative
7466119222554510102,2025-01-31 16:36:42,ich bin und bleibe ein großer fan von dir ricarda  deiner authentizität ehrlichkeit und der art wie du zeigst dass wahre schönheit in selbstbewusstsein und charakter liegt ,0,1,7464563558148246806,7464563558148246806,neutral
7466107270114378498,2025-01-31 15:50:13,wer nichtmal die verantwortung für den eigenen körper übernehmen kann kann nicht die verantwortung für ein ganzes land übernehmen,0,0,7464563558148246806,7464563558148246806,neutral
7466090009108792086,2025-01-31 14:43:02,we listen and we judge ,0,0,7464563558148246806,7464563558148246806,positive
7466014801845732118,2025-01-31 09:52:04,"ich kann mich an nichts erinnern
so funktioniert das doch",0,0,7464563558148246806,7464563558148246806,negative
7465988079938339586,2025-01-31 08:07:56,,0,0,7464563558148246806,7464563558148246806,negative
7465974754603795202,2025-01-31 07:16:57,,0,0,7464563558148246806,7464563558148246806,negative
7465913451786224406,2025-01-31 03:22:34,warum schreibt sie auf englisch  kein internationaler mensch kennt sie,0,0,7464563558148246806,7464563558148246806,neutral
7465898900886586134,2025-01-31 02:27:59,musste auf ipad wechseln,0,0,7464563558148246806,7464563558148246806,negative
7465877600973374230,2025-01-31 01:01:55,,0,0,7464563558148246806,7464563558148246806,negative
7465860705851671318,2025-01-30 23:55:00,oh gott das ist ja echt ,0,0,7464563558148246806,7464563558148246806,negative
7465831327151194902,2025-01-30 21:59:33,hass jeder person die dich je beleidigt hat,0,0,7464563558148246806,7464563558148246806,negative
7465818795988157206,2025-01-30 21:10:38,gott ist die,0,0,7464563558148246806,7464563558148246806,neutral
7465808037543232278,2025-01-30 20:28:40,wenn man keine argumente hat wird man persönlich lassen sie sich nicht runterkriegen bei dem gespräch im unternehmen war ich sehr positiv überrascht weiter so ,0,0,7464563558148246806,7464563558148246806,positive
7465800012109366038,2025-01-30 19:57:47,hab mir das video auf dem projektor angeschautach sie ist das,0,0,7464563558148246806,7464563558148246806,negative
7465790292970406678,2025-01-30 19:19:46,auf weitere 30 jahre mögen alle deine wünsche weiter rollen ,0,0,7464563558148246806,7464563558148246806,neutral
7465772130799993622,2025-01-30 18:09:43,der song isses ned,0,0,7464563558148246806,7464563558148246806,negative
7465765717013594903,2025-01-30 17:44:46,in deutschland spricht man deutsch,0,0,7464563558148246806,7464563558148246806,positive
7465755077606343446,2025-01-30 17:03:24,ich tu es immernoch,0,2,7464563558148246806,7464563558148246806,negative
7465750756689494806,2025-01-30 16:46:51,es ist gut das sie etwas für ihre gesundheit tun,0,0,7464563558148246806,7464563558148246806,positive
7465745587728843542,2025-01-30 16:26:24,ich möchte dich gerne wieder in die grüne partei sehen ,0,0,7464563558148246806,7464563558148246806,neutral
7465736241700520726,2025-01-30 15:50:27,and we still do,0,0,7464563558148246806,7464563558148246806,negative
7465734383124497174,2025-01-30 15:43:08,dank der meinungsfreiheit haben wir alle das recht dazu,0,0,7464563558148246806,7464563558148246806,neutral
7465712450794046230,2025-01-30 14:18:05,ich habe es immer gehasst entsprechende kommentare und witze über sie auf social media lesen zu müssen ,0,0,7464563558148246806,7464563558148246806,negative
7465698455069360918,2025-01-30 13:24:09,abgeordneten diät hat wohl nichts gebracht,0,0,7464563558148246806,7464563558148246806,neutral
7465679617300103958,2025-01-30 12:10:52,wenn das das einzige problem der leute ist geht es denen sehr gut,0,0,7464563558148246806,7464563558148246806,positive
7465677526288499478,2025-01-30 12:02:45,the whole of germany ,0,0,7464563558148246806,7464563558148246806,positive
7465670400125698838,2025-01-30 11:35:04,und in 3 jahren hat sich äußerlich auch nichts getan ,0,0,7464563558148246806,7464563558148246806,neutral
7465665775006139158,2025-01-30 11:17:09,who this,0,0,7464563558148246806,7464563558148246806,negative
7465660323304850198,2025-01-30 10:56:23,das ist aber schwer zu verkraften,0,0,7464563558148246806,7464563558148246806,neutral
7465648939862868758,2025-01-30 10:12:03,respect man sieht dir an das du gut abgenommen hast weiter so  ,0,0,7464563558148246806,7464563558148246806,positive
7465648204697142038,2025-01-30 10:08:51,auf drei weiter jahre ,0,0,7464563558148246806,7464563558148246806,negative
7465640442877477654,2025-01-30 09:38:45,schwerwiegende anschuldigungen,0,0,7464563558148246806,7464563558148246806,negative
7465638775973905174,2025-01-30 09:32:55,wer die f ist wirklich zu faul zum wiggsne,0,0,7464563558148246806,7464563558148246806,negative
7465636651038393110,2025-01-30 09:24:19,magen op aus eigener kraft oder disziplin würde dieser charakter es nie schaffen,0,0,7464563558148246806,7464563558148246806,neutral
7465628547400336150,2025-01-30 08:53:09,wenn dass dein einziges problem ist statt der politik ,0,0,7464563558148246806,7464563558148246806,neutral
7465597540185981718,2025-01-30 06:52:55,nichts erwartet und trotzdem enttäuscht,0,0,7464563558148246806,7464563558148246806,negative
7465575186245616386,2025-01-30 05:27:32,da fällt mir grad ein dass ich meine grüne tonne noch rausstellen muss,0,0,7464563558148246806,7464563558148246806,negative
7465557591998317334,2025-01-30 04:20:37,the whole of germany,0,0,7464563558148246806,7464563558148246806,positive
7465504548502635286,2025-01-30 00:54:14,unsere bundeskanzlerin,0,0,7464563558148246806,7464563558148246806,neutral
7465497476281402135,2025-01-30 00:25:34,gute transformation,0,0,7464563558148246806,7464563558148246806,positive
7465490916653237014,2025-01-29 23:59:20,artikel 5 gg gibt seit dem 23549 also wir fühlen nicht ein recht zu haben wir haben es ob es dann ggf beleidigend war darf die judikative klären,0,0,7464563558148246806,7464563558148246806,neutral
7465483882398302998,2025-01-29 23:31:19,man muss sie nicht mögen aber respekt für die gesundheitswende,0,0,7464563558148246806,7464563558148246806,neutral
7465479247251948310,2025-01-29 23:13:15,dont listen to the haters your bigger than that ,0,0,7464563558148246806,7464563558148246806,negative
7465474279699563286,2025-01-29 22:54:13,we call it pommespanzer,0,0,7464563558148246806,7464563558148246806,negative
7465471287646520086,2025-01-29 22:42:30,das ist kein pommespanzer das ist ein ganzes pommesheer,0,0,7464563558148246806,7464563558148246806,negative
7465457865546580758,2025-01-29 21:50:09,mein anwalt sagt ich sollte besser nix hier kommentieren,0,0,7464563558148246806,7464563558148246806,negative
7465453455169307414,2025-01-29 21:33:06,we still do,0,0,7464563558148246806,7464563558148246806,negative
7465449706149004054,2025-01-29 21:18:24,kommt noch ein danach bild konnte nicht scrallen,0,0,7464563558148246806,7464563558148246806,negative
7465448672215581462,2025-01-29 21:14:29,,0,0,7464563558148246806,7464563558148246806,negative
7465441988832985858,2025-01-29 20:48:31,du siehst aus wie ricarda lang haha,0,0,7464563558148246806,7464563558148246806,negative
7465436562914870018,2025-01-29 20:27:04,meinungsfreiheit lol,0,0,7464563558148246806,7464563558148246806,positive
7465435628713886486,2025-01-29 20:23:40,ozempic oder mounjaro scheint auf jeden fall durchschlagenden erfolg gebracht zu haben,0,1,7464563558148246806,7464563558148246806,neutral
7465433134205633302,2025-01-29 20:13:49,ki ,0,0,7464563558148246806,7464563558148246806,negative
7465429496067195670,2025-01-29 19:59:52,ozempic ,0,0,7464563558148246806,7464563558148246806,positive
7465416839608140566,2025-01-29 19:10:48,maybe it was because of your position,0,0,7464563558148246806,7464563558148246806,negative
7465405841962844950,2025-01-29 18:28:12,respekt ,0,0,7464563558148246806,7464563558148246806,positive
7465400875759977238,2025-01-29 18:08:54,wie hoch ist nochmal das rentengehalt in deutschland sollte man schon wissen wenn mans kürzen will,0,0,7464563558148246806,7464563558148246806,negative
7465390522770424598,2025-01-29 17:28:42,der charakter bleibt halt,0,0,7464563558148246806,7464563558148246806,neutral
7465385299514950422,2025-01-29 17:08:13,kluger schachzug jetzt alles auf das bodyshaming zu schiebennatürlich gab es halbstarke anonyme im internetdie sich drüber lustig gemacht habenaber ihre politik ihr verständnis in manchen bereiche,0,0,7464563558148246806,7464563558148246806,negative
7465381530722976534,2025-01-29 16:53:37,auf einmal mein speicher ist voll,0,0,7464563558148246806,7464563558148246806,negative
7465376432606282518,2025-01-29 16:34:14,bei männlichen politikern wird das irgendwie deutlich weniger gemacht ,0,0,7464563558148246806,7464563558148246806,neutral
7465375300806902550,2025-01-29 16:29:50,die kommentarspalten hier lassen mich asexuell werden hex the patriarchy ,0,0,7464563558148246806,7464563558148246806,negative
7465373532990685974,2025-01-29 16:22:39,kurz alle rippen gebrochen beim lesen,0,0,7464563558148246806,7464563558148246806,negative
7465372486109610774,2025-01-29 16:18:40,sie können stolz sein auf ihre veränderung mögen tue ich sie trotzdem nicht,0,0,7464563558148246806,7464563558148246806,neutral
7465370372222059286,2025-01-29 16:10:27,schwere angelegenheit,0,0,7464563558148246806,7464563558148246806,neutral
7465369219170222870,2025-01-29 16:05:58,für ricarda gabs leider nur einen warnschal,0,0,7464563558148246806,7464563558148246806,negative
7465366543782740758,2025-01-29 15:55:29,beruf verfehlt und das um längen,0,0,7464563558148246806,7464563558148246806,neutral
7465365685728871190,2025-01-29 15:52:08,so schwer zu verkraften das sie ihren job nie richtig gemacht hat,0,0,7464563558148246806,7464563558148246806,neutral
7465364450221720342,2025-01-29 15:47:34,ich dachte diesmal sind die kommentare mal nett,0,0,7464563558148246806,7464563558148246806,negative
7465361481732621078,2025-01-29 15:36:11,bitteschön,0,0,7464563558148246806,7464563558148246806,negative
7465357837582484246,2025-01-29 15:21:51,mcdonalds hat kooperation mit ihr beendet,0,0,7464563558148246806,7464563558148246806,neutral
7465356529299686166,2025-01-29 15:16:56,natürlich hab ich das recht,0,0,7464563558148246806,7464563558148246806,neutral
7465355467570545431,2025-01-29 15:12:42,der körper ist mir schnuppe aber wo eine politik macht hat einfach nichts im bundestag verloren,0,0,7464563558148246806,7464563558148246806,negative
7465346448030073622,2025-01-29 14:37:51,ich würde ja sagen war ne schwere zeit aber die ist immer noch nicht vorbei,0,0,7464563558148246806,7464563558148246806,neutral
7465344296540898050,2025-01-29 14:29:19,immernoch ,0,0,7464563558148246806,7464563558148246806,positive
7465342919978533654,2025-01-29 14:24:07,das stimmt nicht es ging immer um die politische arbeit,0,0,7464563558148246806,7464563558148246806,neutral
7465339263459377942,2025-01-29 14:09:47,u where always good looking being a plus nothing bad ,0,0,7464563558148246806,7464563558148246806,negative
7465336090519225110,2025-01-29 13:57:40,aha and she thought that she had the to tell me what to eat the door swings in both ways,0,0,7464563558148246806,7464563558148246806,negative
7465334606032782102,2025-01-29 13:51:44,schweigen ist gold gold ist schwer,0,0,7464563558148246806,7464563558148246806,neutral
7465333126054150914,2025-01-29 13:46:22,wenn der körper nur das einzige problem wär,0,0,7464563558148246806,7464563558148246806,neutral
7465327876070998806,2025-01-29 13:25:39,,0,0,7464563558148246806,7464563558148246806,negative
7465326363902280470,2025-01-29 13:19:36,its giving ozempic  das schönste daran ist das wir hier in deutschland nicht genug für menschen mit diabetis haben aber für politikerinnen offensichtlich schon,0,0,7464563558148246806,7464563558148246806,positive
7465322408526873366,2025-01-29 13:04:16,und zum frühstück dann nen mettigel,0,0,7464563558148246806,7464563558148246806,negative
7465319801994806049,2025-01-29 12:54:36,der körper warist das kleinste problem,0,0,7464563558148246806,7464563558148246806,neutral
7465317170067833622,2025-01-29 12:44:31,musste handy drehen,0,0,7464563558148246806,7464563558148246806,negative
7465316920033592086,2025-01-29 12:43:23,man hat das recht heißt satire liebe ricarda,0,0,7464563558148246806,7464563558148246806,neutral
7465313223451230998,2025-01-29 12:29:13,ozempic,0,0,7464563558148246806,7464563558148246806,positive
7465298012224324374,2025-01-29 11:30:03,ricardalang die figur war nie ein thema aber die aussagen und statements   konfuzius  lernen und nicht denken ist unnütz denken und nicht lernen ist gefährlich  alles gute für sie,0,0,7464563558148246806,7464563558148246806,neutral
7465297607440302870,2025-01-29 11:28:31,mir ist unwohlwem noch,0,0,7464563558148246806,7464563558148246806,negative
7465295209212265238,2025-01-29 11:19:01,ich find dich super,0,0,7464563558148246806,7464563558148246806,positive
7465293906474255126,2025-01-29 11:14:07,wahrscheinlich schwer verletzend,0,0,7464563558148246806,7464563558148246806,negative
7465288579040772886,2025-01-29 10:53:19,joa wenn mich sich so zur schau stellt muss mann damit rechnen,0,0,7464563558148246806,7464563558148246806,positive
7465283697132798722,2025-01-29 10:34:49,,0,0,7464563558148246806,7464563558148246806,negative
7465276404839596822,2025-01-29 10:06:44,dont be surprised people here are divided in two groups the dum ones who complain about everything and hate on everyone and the ones who try to enjoy life and make the best out of it,0,0,7464563558148246806,7464563558148246806,negative
7465273608899855127,2025-01-29 09:55:31,sieht so toll aus  weiter so ,0,0,7464563558148246806,7464563558148246806,positive
7465269113590776578,2025-01-29 09:37:56,verdammt meine mcdonalds aktien ,0,0,7464563558148246806,7464563558148246806,negative
7465268612837409558,2025-01-29 09:36:16,ich kann sie dafür anzeigen ist rufmord nh ,0,0,7464563558148246806,7464563558148246806,neutral
7465266134888203030,2025-01-29 09:26:21,wow  was eine veränderung mein respekt aber ihre politik ist grauenhaft ,0,0,7464563558148246806,7464563558148246806,negative
7465265891665609494,2025-01-29 09:25:51,hat ja scheinbar funktioniert,0,0,7464563558148246806,7464563558148246806,negative
7465265034102096662,2025-01-29 09:22:35,dieser falsche blick,0,0,7464563558148246806,7464563558148246806,negative
7465259969886814998,2025-01-29 09:02:46,ozempic ,0,0,7464563558148246806,7464563558148246806,positive
7465247111837319958,2025-01-29 08:13:17,und ganz deutschland muss eure politik ertragen,0,0,7464563558148246806,7464563558148246806,negative
7465244642483028758,2025-01-29 08:03:46,das ist exakt was ich meiner familie sagte ich will doch nur gute politikerinnen wie dich  einziges kriterium  kein kleiner schnauzi unter der nase,0,0,7464563558148246806,7464563558148246806,neutral
7465244748391990038,2025-01-29 08:03:19,hairline könnte man auch noch drüber reden,0,0,7464563558148246806,7464563558148246806,positive
7465243298434843414,2025-01-29 07:58:24,haben wir immernoch lol,0,0,7464563558148246806,7464563558148246806,positive
7465237968106767126,2025-01-29 07:37:12,kleiner tipp für alle um speicher zu sparen einfach lange auf das bild drücken und dann auf  nicht interessiert klicken dankt mir später,0,0,7464563558148246806,7464563558148246806,positive
7465229740581831446,2025-01-29 07:05:35,omni logic  nehme das seit 21 tagen keine lust mehr auf süßigkeiten und kein hunger mehr esse einmal am tag und habe 3kg weniger,0,0,7464563558148246806,7464563558148246806,negative
7465219177252651798,2025-01-29 06:24:47,fbfdhkp ,0,0,7464563558148246806,7464563558148246806,negative
7465210747934098198,2025-01-29 05:52:05,keine sorge wir machen weiter,0,0,7464563558148246806,7464563558148246806,neutral
7465210551635952406,2025-01-29 05:50:58,tolljz wird mcs pleite,0,0,7464563558148246806,7464563558148246806,positive
7465202047077139222,2025-01-29 05:19:10,und auch hierso viele übergriffige respektlose kommentarees geht hier um einen menschenund selbst wenn man mit der politik nicht zufrieden istheißt das nicht dass man beleidigen darf,0,0,7464563558148246806,7464563558148246806,negative
7465200632128570134,2025-01-29 05:14:10,ricarda lang so eine wunderschöne frau nj,0,0,7464563558148246806,7464563558148246806,neutral
7465192005720474390,2025-01-29 04:41:32,gemacht hatt die auch so nichts außer den mc s geplündert,0,0,7464563558148246806,7464563558148246806,negative
7465178435246129942,2025-01-29 03:49:14,völlerei galt als sünde wegen maßlosigkeit verschwendung  selbstschädigung heute heißt es gesundheitsprobleme  charakterstärke interessiert nicht mehr auch nicht bei unseren volksvertretern,0,0,7464563558148246806,7464563558148246806,neutral
7465150683626210070,2025-01-29 02:02:55,hab 35kg abgenommen und weiß wie sie sich fühlen lassen sie sich nicht entmutigen wegen all den hasskommentaren  sie sind super so wie sie sind  politik ist repräsentation aller ,0,0,7464563558148246806,7464563558148246806,positive
7465131683336913686,2025-01-29 00:46:57,warte ich hol mein ipad oh ne quatsch mein fernseher,0,0,7464563558148246806,7464563558148246806,negative
7465131491123823382,2025-01-29 00:45:27,schlimm ist und war ausschließlich die politik jetzt noch trotz maßloser überforderung alle familien rüber holen und auf ein weiter so ist schlimm wie der hintern aussieht interessiert mich nicht,0,0,7464563558148246806,7464563558148246806,negative
7465129444618060566,2025-01-29 00:37:19,aber wer bist du,0,0,7464563558148246806,7464563558148246806,neutral
7465128208297263894,2025-01-29 00:33:24,mir ist übel,0,0,7464563558148246806,7464563558148246806,negative
7465119444592083734,2025-01-28 23:57:54,awwwww unser kampfpanzer,0,0,7464563558148246806,7464563558148246806,negative
7465119103017042710,2025-01-28 23:57:07,auch wenn ich die nicht mag hat sie meinen respekt weil sie viel abgenommen hat,0,0,7464563558148246806,7464563558148246806,neutral
7465118086849528599,2025-01-28 23:52:13,ricarda lang auf ozempic vor gta 6 ,0,0,7464563558148246806,7464563558148246806,neutral
7465111404514689814,2025-01-28 23:26:37,für ozempic und für deutschland,0,0,7464563558148246806,7464563558148246806,positive
7465110400238879510,2025-01-28 23:22:35,jetzt rollen nur noch die autoreifen zu mcdonalds ,0,0,7464563558148246806,7464563558148246806,neutral
7465109954375680790,2025-01-28 23:20:44,freedom of speech,0,0,7464563558148246806,7464563558148246806,negative
7465108165038834454,2025-01-28 23:13:22,hab auf ipad gewechselt glaube brauche fehrseher,0,0,7464563558148246806,7464563558148246806,negative
7465108098211349270,2025-01-28 23:13:15,was soll man bei ihr denn sonst kommentieren den hohen akademischen grad die massiven bemühungen um frieden die vor intelligenz sprühenden aussagen,0,0,7464563558148246806,7464563558148246806,negative
7465104524841501462,2025-01-28 22:59:47,im so sorry love hab dich immer verteidigt und diese menschen zutiefst verurteilt wärst du ein mann müsstest du dir sowas gar nicht anhören ,0,0,7464563558148246806,7464563558148246806,negative
7465100311674536726,2025-01-28 22:42:39,leute haten das aussehen aber wählen dann leute wie fritz oder bernd,0,0,7464563558148246806,7464563558148246806,neutral
7465098494397154081,2025-01-28 22:35:29,was war da mit der einen brücke ,0,0,7464563558148246806,7464563558148246806,negative
7465087406737130262,2025-01-28 21:52:37,wird auch die nächsten 3 jahre,0,0,7464563558148246806,7464563558148246806,neutral
7465085840622519063,2025-01-28 21:46:28,"
grüne2025
",0,0,7464563558148246806,7464563558148246806,neutral
7465084969318548246,2025-01-28 21:43:16,der war ja auch überall,0,0,7464563558148246806,7464563558148246806,neutral
7465083494768952086,2025-01-28 21:37:31,machen wir immernoch ,0,0,7464563558148246806,7464563558148246806,positive
7465082984640594710,2025-01-28 21:35:25,das ist bei meinungs freiheit leider so ,0,1,7464563558148246806,7464563558148246806,negative
7465082336053740310,2025-01-28 21:32:41,und jetzt noch arbeitausbildungstudiumfsjwehrdienst nachholen,0,0,7464563558148246806,7464563558148246806,neutral
7465081617255564054,2025-01-28 21:30:08,na gut kg sind runter aber oben ist ja sowieso nix dazu gekommen ,0,0,7464563558148246806,7464563558148246806,negative
7465080931504079638,2025-01-28 21:27:33,,0,0,7464563558148246806,7464563558148246806,negative
7465079833740788502,2025-01-28 21:23:03,ich stimme politisch überhaupt nicht mit dir überein aber sowas wünsche ich keinem es tut mir wirklich leid dass du das durchmachen musstest stay strong,0,0,7464563558148246806,7464563558148246806,negative
7465077357029360406,2025-01-28 21:13:24,ozempic,0,0,7464563558148246806,7464563558148246806,positive
7465077286514033430,2025-01-28 21:12:57,shes becoming aware,0,0,7464563558148246806,7464563558148246806,negative
7465077074609668886,2025-01-28 21:12:13,we still do it,0,0,7464563558148246806,7464563558148246806,negative
7465076194733327137,2025-01-28 21:08:48,okay,0,0,7464563558148246806,7464563558148246806,positive
7465074100306969366,2025-01-28 21:00:38,was sind das hier für schlechte menschen die auf jemandem herumtrampeln das hervorragendes geleistet hat ob mit oder ohne medikament sie hat abgenommen,0,1,7464563558148246806,7464563558148246806,negative
7465073292064981782,2025-01-28 20:57:35,ich kann die grünen nicht leiden aber hier muss ich meinen respekt aussprechen wirklich sehr stark das ist halt wirklich der beweis dass es jeder schaffen kann,0,0,7464563558148246806,7464563558148246806,positive
7465073019976663830,2025-01-28 20:56:40,wann gym arc,0,0,7464563558148246806,7464563558148246806,negative
7465072420950803222,2025-01-28 20:54:25,free ,0,0,7464563558148246806,7464563558148246806,positive
7465071913053979414,2025-01-28 20:52:26,du bist großartig ricarda niemand hat das recht andere aufgrund ihrer figur so fertig zu machen sei stolz auf dich,0,0,7464563558148246806,7464563558148246806,neutral
7465071520483869463,2025-01-28 20:50:41,ich hasse es dass ich nur vom lesen des textes wusste um wen es geht,0,0,7464563558148246806,7464563558148246806,negative
7465070328942396183,2025-01-28 20:46:17,bin erstaunt das du das auf englisch schreiben kannst mit deinem bildungsgang,0,0,7464563558148246806,7464563558148246806,positive
7465069460971176726,2025-01-28 20:42:45,was war da noch mal mit dieser brücke ,0,0,7464563558148246806,7464563558148246806,negative
7465068946619024150,2025-01-28 20:40:37,das recht haben wir,0,0,7464563558148246806,7464563558148246806,neutral
7465067958621225750,2025-01-28 20:36:44,ist so übel wie mit frauen umgegangen wird,0,0,7464563558148246806,7464563558148246806,negative
7465067289621775126,2025-01-28 20:34:15,exactly what ive been saying emotional intelligence and knowledge facts instead of attacking smt what has nothing to do w it,0,0,7464563558148246806,7464563558148246806,negative
7465063412247200534,2025-01-28 20:19:05,meine hochachtung für soviel disziplin  man sieht schon sehr wieviel sie abgenommen haben weiter so ,0,0,7464563558148246806,7464563558148246806,positive
