id,create_time,text,like_count,reply_count,parent_comment_id,video_id,sentiment
7474504141525287702,2025-02-23 06:55:06,die grünen können nur noch hetzen ihr seid so abartig,0,0,7468720847168097558,7468720847168097558,negative
7474320196763124502,2025-02-22 19:00:27,die grüne was habe die erreicht ,0,0,7468720847168097558,7468720847168097558,neutral
7474241818273448726,2025-02-22 13:56:17,die grünen müssen weg  bitte nicht wählen,0,0,7468720847168097558,7468720847168097558,negative
7474231352318444310,2025-02-22 13:15:32,bitte nur merz,0,0,7468720847168097558,7468720847168097558,negative
7474194207100781334,2025-02-22 10:51:24,das der stuhl das aushält alle achtung,0,0,7468720847168097558,7468720847168097558,negative
7473858204155233046,2025-02-21 13:07:43,euch kann man aber auch nicht vertrauen ,0,0,7468720847168097558,7468720847168097558,negative
7473787422142530326,2025-02-21 08:33:36,,0,0,7468720847168097558,7468720847168097558,negative
7473520103306625814,2025-02-20 15:15:33,ich wünschte eine rotrotgrüne regierung würde endlich eine chance bekommen oder noch besser grünrotrot wäre dringend nötig,0,0,7468720847168097558,7468720847168097558,negative
7473507580813329174,2025-02-20 14:27:05,einen unglaubwürdigen merz braucht das land nicht,0,1,7468720847168097558,7468720847168097558,neutral
7472468837642142486,2025-02-17 19:15:58,die grünen schaffen deutschland ab,0,0,7468720847168097558,7468720847168097558,neutral
7472433260708070166,2025-02-17 16:58:07,merz wird es richten was die bersserwissenden grünen ideologen in diesem land kaputt gemacht haben der aufstieg der afd ist euer verdienst,0,0,7468720847168097558,7468720847168097558,negative
7471381623163683606,2025-02-14 20:57:09,,0,0,7468720847168097558,7468720847168097558,negative
7470962621174465302,2025-02-13 17:51:15,in einer demokratie eine mehrheit sowas darf es nicht geben aber vllt hätte ricarda wer den inhalt des gesetzes erklärt und wie notwendig es ist,0,0,7468720847168097558,7468720847168097558,neutral
7470920556726108950,2025-02-13 15:08:08,die ersten karnevalsumzüge wurden auch bereits abgesagt deutschland ist mittlerweile ein gefährliches pflaster wie lange soll das noch so weitergehen ,0,0,7468720847168097558,7468720847168097558,neutral
7470639300373431062,2025-02-12 20:56:37,und weiter  ist doch ok  das ist demokratie,0,0,7468720847168097558,7468720847168097558,negative
7470456775814005526,2025-02-12 09:08:50,alle stimmen für grün ,0,0,7468720847168097558,7468720847168097558,positive
7470398781705782038,2025-02-12 05:25:37,deswegen ,0,0,7468720847168097558,7468720847168097558,negative
7470380878604485398,2025-02-12 04:19:30,ricarda hat wie immer recht mir gruselts ich kann f merz nicht mehr trauen aber im falle des falles würden die grünen mit ihm koalieren,0,0,7468720847168097558,7468720847168097558,negative
7470322644664255254,2025-02-12 00:29:20,wegen sie ist ja auch schuld daran dass es in deutschland zu gründe gegangen ist genauso wie annalena baerbock,0,0,7468720847168097558,7468720847168097558,neutral
7470266737784537878,2025-02-11 20:50:53,frau lang  echt jetzt fällt ihnen nichts  neues mehr ein,0,0,7468720847168097558,7468720847168097558,neutral
7470236980045021954,2025-02-11 18:55:19,mir macht eher sorge was die grünen aus unserem land gemacht haben,0,0,7468720847168097558,7468720847168097558,negative
7469719528718893846,2025-02-10 09:28:22,beide stimmen für die grünen ,0,0,7468720847168097558,7468720847168097558,neutral
7469597750818423574,2025-02-10 01:39:54,habe die fernseh runde zwischen scholz und merz gesehen er hatte richtige nazi sprache,0,0,7468720847168097558,7468720847168097558,neutral
7469560297354396439,2025-02-09 23:10:25,abitur,0,0,7468720847168097558,7468720847168097558,negative
7469551351254319894,2025-02-09 22:35:09,merz,0,0,7468720847168097558,7468720847168097558,positive
7469528522164945670,2025-02-09 21:05:58,kryptoinvestitionen verändern das leben ich habe in 6 tagen 2000  in 18000  verwandelt suchen sie auf tiktok nach erzieher samuel um auch geld zu verdienen,0,0,7468720847168097558,7468720847168097558,neutral
7469452028646376214,2025-02-09 16:09:27,besser als mit euch ideologisten,0,0,7468720847168097558,7468720847168097558,positive
7469378655061558038,2025-02-09 11:24:51,wortbruch habe es gehört schade dadurch hat er vertrauen verloren ,0,0,7468720847168097558,7468720847168097558,negative
7469366495761335062,2025-02-09 10:37:42,"upps was macht die da
dachte die is weg
dass die noch was zum sagen hat",0,0,7468720847168097558,7468720847168097558,negative
7469365253576393494,2025-02-09 10:32:33,nach der wahl kommt die afd,0,0,7468720847168097558,7468720847168097558,neutral
7469325968587506454,2025-02-09 08:00:26,"kanzlerwahl am 23februar 2025 wird ein kampf zwischen zwei lagern
spd grüne linkegegen cducsu fdp afd
hauptthemenmigration klima wirtschaft",0,0,7468720847168097558,7468720847168097558,neutral
7469321546729882390,2025-02-09 07:43:14,er hat wenn ich mich erinnere auch seinen parteivorsitz daran geknüpft und er ist immer noch nicht zurück getreten,0,0,7468720847168097558,7468720847168097558,neutral
7469209316853334806,2025-02-09 00:28:55,absolut richtig meine stimme geht an die grünen,0,0,7468720847168097558,7468720847168097558,positive
7469202895805367062,2025-02-09 00:03:21,wenn minderheiten versuchen mehrheiten ihre meinung aufzudrücken wenn wahlsendungen mit linken zuschauern besetzt werden  in 2 wochen ist der linke radikale spuk vorbei ,0,0,7468720847168097558,7468720847168097558,neutral
7469201790144512790,2025-02-08 23:58:53,"


",0,0,7468720847168097558,7468720847168097558,negative
7469196076466651926,2025-02-08 23:36:38,die cdu ist rechts und nicht rechtsradikal ,0,0,7468720847168097558,7468720847168097558,neutral
7469175517293003542,2025-02-08 22:16:27,teamhabeck habeck4kanzler teamrobert merzverhindern söderverhindern afdverhindern zuversicht,0,0,7468720847168097558,7468720847168097558,negative
7469172163657696022,2025-02-08 22:03:31,sorry  welchen abschluss haben sie erreicht und welches studium um das beurteilen zu können,0,1,7468720847168097558,7468720847168097558,neutral
7469166597509546774,2025-02-08 21:41:40,dachte sie wäre endlich weg,0,0,7468720847168097558,7468720847168097558,neutral
7469162835081708310,2025-02-08 21:27:29,ist halt ne meinung aber 15 werden es höchstens,0,0,7468720847168097558,7468720847168097558,negative
7469162417667998486,2025-02-08 21:25:34,gute frau nur weil man sich in einem thema sich parteien einig sind so bricht keine brandmauer  die grüne hetze ist nicht mehr auszuhalten ich hoffe die grünen werden mal vom islamisten bedroht,0,0,7468720847168097558,7468720847168097558,negative
7469140695683400470,2025-02-08 20:01:21,die cducsu hat am 2301 den kreis der demokratischen parteien verlassen  dies am 2501 bekräftigt dank friedrich merz haben wir jetzt die wahl zwischen grün rot rot und 1933,0,0,7468720847168097558,7468720847168097558,neutral
7469133649368728342,2025-02-08 19:33:53,nur ,0,0,7468720847168097558,7468720847168097558,negative
7468993487749726998,2025-02-08 10:30:02,nur weil sie 5 kg abgenommen hat wird sie nicht kompetenter das war nie das problem,0,0,7468720847168097558,7468720847168097558,neutral
7468985970991268631,2025-02-08 10:01:00,wow echt besorgniserregend find ich eure einstellung wenn die afd den antrag bringen würde sich selbst zu verbieten müsstet ihr dagegen sein und ihr entscheidet über das wohl von millionen,0,0,7468720847168097558,7468720847168097558,negative
7468979117325697814,2025-02-08 09:34:20,cdu und afd dann wird aufgeräumt,0,0,7468720847168097558,7468720847168097558,negative
7468964811343823648,2025-02-08 08:38:30,diesel soll bald 250 euro kosten,0,0,7468720847168097558,7468720847168097558,neutral
7468959072412517142,2025-02-08 08:16:56,friedrich hat euch vorgeführt ,0,0,7468720847168097558,7468720847168097558,neutral
7468955851979080470,2025-02-08 08:04:16,"noch 15 tage dann hat das diktatorische
und bevormundende regieren des
kinderbuchautors gegen das deutsche volk
ein ende
nur die afd kann uns noch retten",0,0,7468720847168097558,7468720847168097558,negative
7468887150702920450,2025-02-08 03:43:23,auwei wer im glashaus sitzt,0,0,7468720847168097558,7468720847168097558,neutral
7468835195517993750,2025-02-08 00:16:56,wer ist das,0,0,7468720847168097558,7468720847168097558,negative
7468804578336949014,2025-02-07 22:17:20,"da du ja nun keine vorsitzende
mehr bist und auch den fachkräfte mangel beklagst was für eine berufsausbildung machst du denn nun",0,0,7468720847168097558,7468720847168097558,neutral
7468801088667452182,2025-02-07 22:03:37,ich denke die hat abgenommen sieht er so aus als wenn ein panzer das nummernschild verliert,0,0,7468720847168097558,7468720847168097558,neutral
7468781738404561686,2025-02-07 20:48:13,er wollte ein gesetz machen  dass es keine messer attacken gibt auf menschen die in unserem land leben,0,0,7468720847168097558,7468720847168097558,neutral
7468748503494624022,2025-02-07 18:39:20,ricarda hat mein respekt danke  ich denke es wird dann cdu mit afd und dann wird irgendwann die nationale notlage ausgerufen wegen migration oder irgendetwas ich mache mich sorgen ,0,0,7468720847168097558,7468720847168097558,negative
7486006678342845206,2025-03-26 06:49:33,grüne sind noch schöimmer,0,0,7468720847168097558,7468720847168097558,negative
7467841125015372566,2025-02-05 07:59:27,absolut richtig ich kann eigentlich immer unterschreiben was diese frau sagt,202,1,7467839680671730966,7467839680671730966,positive
7468031521258226465,2025-02-05 20:18:49,höchsten respekt für dein rückrat und willen die gesamten letzen jahre trotz der vielen anfeindungen 3,136,2,7467839680671730966,7467839680671730966,neutral
7467860558425080598,2025-02-05 09:14:24,geht wählen gerade für die menschen welche selbst nicht bzw noch nicht wählen gehen dürfen wählen ist ein privileg nehmt es war dielinke,105,0,7467839680671730966,7467839680671730966,negative
7467844321518863126,2025-02-05 08:11:13,gesprochen wie eine löwin respekt,87,0,7467839680671730966,7467839680671730966,neutral
7467944962626716438,2025-02-05 14:41:07,"ricarda du bist super du machst uns hoffnung weiter so 
frauen an die macht ",42,0,7467839680671730966,7467839680671730966,positive
7468339684276519702,2025-02-06 16:12:51,auch wenn es sich um rhetorische fragen handelt würde ich dennoch gern die antwort der cduabgeordneten hören wie kann man das mit seinem gewissen vereinbaren danke für diese wichtige rede ,39,1,7467839680671730966,7467839680671730966,neutral
7468101172391445270,2025-02-06 00:50:42,so eine starke rede ,33,0,7467839680671730966,7467839680671730966,neutral
7468056788316193538,2025-02-05 21:55:09,wowstarkrichtig stark,32,0,7467839680671730966,7467839680671730966,positive
7467992593806328598,2025-02-05 17:46:02,danke für die klaren worte  darum wähle ich mit beiden stimmen aus überzeugung ,32,0,7467839680671730966,7467839680671730966,neutral
7467851809932673814,2025-02-05 08:40:12,sehr geile rede ,31,0,7467839680671730966,7467839680671730966,positive
7467896620237341462,2025-02-05 11:34:12,kein fan aber hier stimme ich ihr zu 100 zu,29,0,7467839680671730966,7467839680671730966,positive
7467843766347367190,2025-02-05 08:08:41,tolle rede leider wird es am ende doch wieder kein verbotsverfahren geben ,28,0,7467839680671730966,7467839680671730966,positive
7467841435938571030,2025-02-05 08:00:22,ricarda beste,28,0,7467839680671730966,7467839680671730966,positive
7468269791431066390,2025-02-06 11:42:00,präsidentin oder bäsidentin,24,2,7467839680671730966,7467839680671730966,neutral
7468226494540595990,2025-02-06 08:54:08,nie wieder grüne ,22,6,7467839680671730966,7467839680671730966,negative
7467846464065192726,2025-02-05 08:19:12,ricarda lang auf die 1 ,22,0,7467839680671730966,7467839680671730966,neutral
7468001992649933590,2025-02-05 18:22:26,danke frau lang ,17,1,7467839680671730966,7467839680671730966,negative
7468007105997751062,2025-02-05 18:42:22,mega rede,16,0,7467839680671730966,7467839680671730966,positive
7468238508558172950,2025-02-06 09:40:32,dem hab ich nichts hinzuzufügen wuff das war doch mal eine ansage,15,0,7467839680671730966,7467839680671730966,neutral
7478464609780204310,2025-03-05 23:02:29,tolle rede schade dass wir merz nicht verhindern konnten nichtmeinkanzler,15,0,7467839680671730966,7467839680671730966,positive
7467935909436146454,2025-02-05 14:06:19,du bist toll ricarda ,14,0,7467839680671730966,7467839680671730966,positive
7468233842337792790,2025-02-06 09:23:20,danke für die klaren worte frau lang danke fürs gegenhalten danke,12,0,7467839680671730966,7467839680671730966,neutral
7467916311265510166,2025-02-05 12:50:24,tolle emotionale rede,12,0,7467839680671730966,7467839680671730966,positive
7467907278792934166,2025-02-05 12:14:56,danke  das ist wirklich wichtig danke fürs teilen,12,0,7467839680671730966,7467839680671730966,positive
7479701624350229270,2025-03-09 07:02:59,herausragende rede danke frau lang weiter so,11,0,7467839680671730966,7467839680671730966,positive
7471115738456376086,2025-02-14 03:48:40,protect this superstar at all costs,11,0,7467839680671730966,7467839680671730966,positive
7468308138022716182,2025-02-06 14:10:27,sehr starke rede danke ricarda,11,0,7467839680671730966,7467839680671730966,positive
7467845963895440150,2025-02-05 08:17:46,mega gute rede,11,0,7467839680671730966,7467839680671730966,positive
7469802416281715478,2025-02-10 14:49:21,haben bisher hier auf tiktok leider viel zu wenige gesehendu brauchst mehr reichweite mit diesen worten leider wird das hier unterdrücktes soll nicht jeder sehenweil sie recht hat,9,0,7467839680671730966,7467839680671730966,negative
7467859186773787414,2025-02-05 09:08:50,genau so,9,0,7467839680671730966,7467839680671730966,positive
7469442012987786006,2025-02-09 15:30:24,"wahnsinnsrede

danke danke danke ",8,2,7467839680671730966,7467839680671730966,positive
7468228952901993238,2025-02-06 09:03:40,starke rede  wir müssen das stoppen es ist absolut wichtig das wir alle wählen gehen und das richtige tun,8,0,7467839680671730966,7467839680671730966,neutral
7468161588093092610,2025-02-06 04:43:56,gut gesprochen,7,0,7467839680671730966,7467839680671730966,positive
7468030141463560962,2025-02-05 20:12:19,danke ricarda lang,7,0,7467839680671730966,7467839680671730966,positive
7467995229288547094,2025-02-05 17:56:13,freu mich schon auf morgeb wo du zu uns kommst,7,0,7467839680671730966,7467839680671730966,positive
7467893696463094550,2025-02-05 11:22:42,endlich sagt sie das was sie denkt,7,0,7467839680671730966,7467839680671730966,neutral
7467881414223053590,2025-02-05 10:34:46,,7,0,7467839680671730966,7467839680671730966,negative
7471115068379628310,2025-02-14 03:47:56,brandmauer ,6,0,7467839680671730966,7467839680671730966,negative
7468344045027345174,2025-02-06 16:29:46,ich will einfach einmal ehrliche antworten von cdu und co zu solchen fragen hören,6,0,7467839680671730966,7467839680671730966,neutral
7467840068452877058,2025-02-05 07:54:50,,6,0,7467839680671730966,7467839680671730966,negative
7471115737990857474,2025-02-14 03:48:22,mein herz ich breche an deinen wunderschönen worten,5,0,7467839680671730966,7467839680671730966,neutral
7471115591349453590,2025-02-14 03:47:50,long live the matriarchy,5,0,7467839680671730966,7467839680671730966,positive
7471115597439517462,2025-02-14 03:47:40,morher icon  i am in tears ich werde dich ab jetzt für imer vor jedem beschützen für immer ricarda egal was kommt wer kommt frauen werden immer die wüste erblühen lassen,5,0,7467839680671730966,7467839680671730966,neutral
7468052721892459286,2025-02-05 21:39:25,,5,0,7467839680671730966,7467839680671730966,negative
7468051106092008214,2025-02-05 21:33:12,punkt ,5,0,7467839680671730966,7467839680671730966,positive
7471115181369770774,2025-02-14 03:48:05,,4,0,7467839680671730966,7467839680671730966,negative
7471115079205159702,2025-02-14 03:48:02,,4,0,7467839680671730966,7467839680671730966,negative
7471115111122699030,2025-02-14 03:46:13,meine göttin,4,0,7467839680671730966,7467839680671730966,neutral
7468335971002778390,2025-02-06 15:58:38,das waren beeindruckende wahre wortedanke dafür ,4,0,7467839680671730966,7467839680671730966,neutral
7468271620374528790,2025-02-06 11:49:15,was ist eigentlich aus achim laschet geworden,4,0,7467839680671730966,7467839680671730966,negative
7468182900838007574,2025-02-06 06:05:55,lasst die wahl 2025 nicht zur wahl 1933 werden wir wissen heute was passiert wenn hetze regiert wer am 232  oderwählt will dass sich die geschichte wiederholtniewiederistjetzt,4,0,7467839680671730966,7467839680671730966,negative
7468182829424673558,2025-02-06 06:04:57,deshalb am 232 beide stimmen starke grüne können den unterschied machen egal ob in regierungsfunktion koalition oder opposition gemeinsam gegen antidemokraten wirsindmehr,4,0,7467839680671730966,7467839680671730966,neutral
7467987621702255382,2025-02-05 17:26:47,,4,0,7467839680671730966,7467839680671730966,negative
7467909464990401302,2025-02-05 12:23:33,,4,0,7467839680671730966,7467839680671730966,negative
7467840939417338646,2025-02-05 07:58:40,nur die linke ,4,0,7467839680671730966,7467839680671730966,negative
7487891493916918550,2025-03-31 08:43:38,"wann wenn nicht jetzt

d i e s e partei gehört endlich demokratisch verboten",3,0,7467839680671730966,7467839680671730966,negative
7477941115044676374,2025-03-04 13:11:00,alle klatschen keiner macht was alle hören zu keiner versteht was willkommen in deutschland,3,0,7467839680671730966,7467839680671730966,negative
7469802717217719062,2025-02-10 14:50:11,teamgrün,3,0,7467839680671730966,7467839680671730966,negative
7469801604509008662,2025-02-10 14:45:52,so rüttelt man menschen auf bin mir sicherwir haben dir viel zu verdankendaß das gesetz nicht durch gegangen ist danke das du deine rede so perfekt genutzt haststolz auf dich ,3,0,7467839680671730966,7467839680671730966,positive
7469799761538679574,2025-02-10 14:38:56, legende ,3,0,7467839680671730966,7467839680671730966,neutral
7469485370725434135,2025-02-09 18:18:41,tut es ,3,0,7467839680671730966,7467839680671730966,positive
7469441407654134550,2025-02-09 15:28:24,,3,0,7467839680671730966,7467839680671730966,negative
7469169392368255766,2025-02-08 21:52:52,,3,0,7467839680671730966,7467839680671730966,negative
7468229650030166817,2025-02-06 09:06:37,bravo absolut großartig ,3,0,7467839680671730966,7467839680671730966,positive
7468213775285584642,2025-02-06 08:04:57,,3,0,7467839680671730966,7467839680671730966,negative
7468099406886667010,2025-02-06 00:42:28,,3,0,7467839680671730966,7467839680671730966,negative
7479354705363600150,2025-03-08 08:36:36,,2,0,7467839680671730966,7467839680671730966,negative
7479001840338043670,2025-03-07 09:47:25,mich nervt es so das sind alles gewählte vertreter der bürger der bürgerwille ist ganz klar zb auf jeder demo zu sehen wie können die sich erdreisten und angst um ihre beliebtheit zu haben,2,0,7467839680671730966,7467839680671730966,negative
7471680330543334166,2025-02-15 16:16:25,starke rede ,2,0,7467839680671730966,7467839680671730966,negative
7471428181091517206,2025-02-14 23:58:36,liebe ricarda das ist eine großartige rede die cduler hören demonstrativ nicht zu und schauen betreten auf ihre handys  süd sind getroffen,2,0,7467839680671730966,7467839680671730966,neutral
7469798286099612438,2025-02-10 14:33:17,ja ricarda packt sie mal wieder an den eiern richtige worte komisch das sie alle still bei ihr sind sie hat die richtige stärke und kraft in der stimme on  bravo ricarda ,2,1,7467839680671730966,7467839680671730966,neutral
7468702290413962006,2025-02-07 15:39:58,großartig punkt ,2,0,7467839680671730966,7467839680671730966,positive
7468563435941593878,2025-02-07 06:41:41,,2,0,7467839680671730966,7467839680671730966,negative
7468439995867464470,2025-02-06 22:42:20,so und nicht anders ,2,0,7467839680671730966,7467839680671730966,negative
7468271547532264214,2025-02-06 11:49:08,,2,0,7467839680671730966,7467839680671730966,negative
7468264805431018262,2025-02-06 11:22:35,ja das fragt man sich in letzter zeit oft ,2,0,7467839680671730966,7467839680671730966,negative
7468249474701132566,2025-02-06 10:23:41,on point ,2,0,7467839680671730966,7467839680671730966,negative
7467863871858115350,2025-02-05 09:27:15,sehr gute rede von einer echten löwin,2,0,7467839680671730966,7467839680671730966,positive
7478066447530738454,2025-03-04 21:17:21,beste rede 2025 jetzt schon gekürt,1,0,7467839680671730966,7467839680671730966,positive
7470298014864835350,2025-02-11 22:52:57,stark ,1,0,7467839680671730966,7467839680671730966,positive
7468730082988524310,2025-02-07 17:27:57,heldin ,1,0,7467839680671730966,7467839680671730966,positive
7468271055846195990,2025-02-06 11:47:03,fehler eingestehen ist nicht die cdu unter merz ist keine stimme wert nein zur cducsu fdp bsw und afd,1,0,7467839680671730966,7467839680671730966,negative
7468252955312653058,2025-02-06 10:37:22,ich denk irgendwie immer kurz dass ricarda lang bei den grünen ist bis ich checke dass sie ricarda lang ist warum sieht sie so grün aus ,1,0,7467839680671730966,7467839680671730966,neutral
7468251811066823446,2025-02-06 10:32:35,1047,1,1,7467839680671730966,7467839680671730966,positive
7467922658752594710,2025-02-05 13:14:46,gut gebrüllt löwe,1,0,7467839680671730966,7467839680671730966,positive
7467855357206774550,2025-02-05 08:54:09,eine politikerin mit sehr guten inhalten aber leider in der falschen partei ,1,0,7467839680671730966,7467839680671730966,neutral
7487609604101636886,2025-03-30 14:29:30,bitte afdverbot jetzt,0,0,7467839680671730966,7467839680671730966,negative
7486532706482799382,2025-03-27 16:50:34,,0,0,7467839680671730966,7467839680671730966,negative
7483021812268270358,2025-03-18 05:46:43,,0,0,7467839680671730966,7467839680671730966,negative
7480921453527122710,2025-03-12 13:56:18,facts,0,0,7467839680671730966,7467839680671730966,positive
7480266687750750998,2025-03-10 19:35:20,,0,0,7467839680671730966,7467839680671730966,negative
7480070915918168855,2025-03-10 06:55:47,großartige rede,0,0,7467839680671730966,7467839680671730966,positive
7479418257562092310,2025-03-08 12:43:03,,0,0,7467839680671730966,7467839680671730966,negative
7479269899397186326,2025-03-08 03:08:54,ate and left no crumbs,0,0,7467839680671730966,7467839680671730966,negative
7478997521155605270,2025-03-07 09:30:27,richtig gute rede ,0,0,7467839680671730966,7467839680671730966,positive
7478950301128786710,2025-03-07 06:27:27,so wichtige und klare worte du bist eine heldin ,0,0,7467839680671730966,7467839680671730966,neutral
7478939015905051414,2025-03-07 05:43:49,ricardalang ich habe deine rede schon zum zeitpunkt gesehen aber du machst das einfach so ohne notizen ich bin so beeindruckt du bist fantastisch und so wichtig für unsere demokratie danke ,0,0,7467839680671730966,7467839680671730966,positive
7478383552644842262,2025-03-05 17:47:46,so eine großarzige rede vielen dank,0,0,7467839680671730966,7467839680671730966,neutral
7476188083169198870,2025-02-27 19:48:16,,0,0,7467839680671730966,7467839680671730966,negative
7476176351319606038,2025-02-27 19:02:46,,0,0,7467839680671730966,7467839680671730966,negative
7475104663533404950,2025-02-24 21:44:16,ricaaber wogreenländnutz die chanceich esse schon keine grünländer würstchen mehrhab zum glück argentinischees rindfieh,0,0,7467839680671730966,7467839680671730966,negative
7473809504124240663,2025-02-21 09:58:39,für ein bessere zukunft für uns unsere kinder und enkelkinder beide stimmen teamhabeck habeck4kanzler teamrobert merzverhindern söderverhindern afdverhindern zuversicht,0,0,7467839680671730966,7467839680671730966,neutral
7473390892176917270,2025-02-20 06:55:10,,0,0,7467839680671730966,7467839680671730966,negative
7473248217786778370,2025-02-19 21:40:19,so so gut gesprochen  danke schön,0,0,7467839680671730966,7467839680671730966,positive
7472089916454978326,2025-02-16 18:45:44,heftige rede ,0,0,7467839680671730966,7467839680671730966,negative
7471752390996230934,2025-02-15 20:55:43,,0,0,7467839680671730966,7467839680671730966,negative
7471299833279431446,2025-02-14 15:39:51,fakten ,0,0,7467839680671730966,7467839680671730966,negative
7471266554123289366,2025-02-14 13:30:33,,0,0,7467839680671730966,7467839680671730966,negative
7470955865144951574,2025-02-13 17:25:08,ich dachte die ist weg vom fenster,0,0,7467839680671730966,7467839680671730966,negative
7470182700198183702,2025-02-11 15:25:08,wieso lispelt sie,0,0,7467839680671730966,7467839680671730966,negative
7469328035541484343,2025-02-09 08:08:28,afd,0,0,7467839680671730966,7467839680671730966,negative
7469322591665898262,2025-02-09 07:47:34,kein fan der grünen aber ricarda ist einfach ne maus  nachderampellinks,0,0,7467839680671730966,7467839680671730966,negative
7469311704590222103,2025-02-09 07:05:17,merz hat die cducsu für jede weitere demokratische regierungsperiode disqualifiziert ein völlig unglaubwürdiger politiker ohne anstand und werte,0,0,7467839680671730966,7467839680671730966,neutral
7468559503798371094,2025-02-07 06:26:21,,0,0,7467839680671730966,7467839680671730966,negative
7468553288041186056,2025-02-07 06:01:29,ja da müssen wie die grünen verbieten,0,0,7467839680671730966,7467839680671730966,negative
7468350117033526038,2025-02-06 16:53:26,,0,0,7467839680671730966,7467839680671730966,negative
7468334280200979222,2025-02-06 15:51:53,dieses wehret den anfängen höre ich schon seit 40jahren aber spätestens seit rostock lichtenhagen ist klar dass es für viele nur eine leere worthülse ist und heute ist es vielleicht zu spät,0,0,7467839680671730966,7467839680671730966,neutral
7468306301488399126,2025-02-06 14:03:30,frau lang sie haben gekocht,0,0,7467839680671730966,7467839680671730966,negative
