id,create_time,text,like_count,reply_count,parent_comment_id,video_id,sentiment
7472184956547416854,2025-02-17 00:55:46,"merz wird kanzler und dass ist gut so 
es gibt keine alternative zur cdu",0,0,7471573902104218902,7471573902104218902,negative
7472179777153860354,2025-02-17 00:35:58,beide stimmen an die linke gegeben via briefwahl traut euch das richtige zu machen ,0,0,7471573902104218902,7471573902104218902,neutral
7472165369761776406,2025-02-16 23:39:23,facts ,0,0,7471573902104218902,7471573902104218902,positive
7472153199235875606,2025-02-16 22:51:16,seit wann kann man an der kleidung kompetenz herauslesen herr merz sie werden im unterhemd auch nicht kompetenter,0,0,7471573902104218902,7471573902104218902,negative
7472150240704873238,2025-02-16 22:39:47,"liebe ricarda ich fand dich schon als meine vorsitzende gut aber jetzt wächst du ja geradezu täglich
ein grüner aus köln",0,0,7471573902104218902,7471573902104218902,neutral
7472147072406323990,2025-02-16 22:27:24,hä vorallem hat doch habeck viel mehr ahnung von makroökonomie als merz,0,0,7471573902104218902,7471573902104218902,neutral
7472144988673098518,2025-02-16 22:19:36,ich glaube ihm nichts gar nichts fähnchen im winde punkt,0,0,7471573902104218902,7471573902104218902,neutral
7472143631827206934,2025-02-16 22:14:00,men ,0,0,7471573902104218902,7471573902104218902,positive
7472141874367742742,2025-02-16 22:07:14,"bodenlos
 diese auftritte von merz",0,0,7471573902104218902,7471573902104218902,neutral
7472139489989870358,2025-02-16 21:57:56,als frau kann man nicht guten gewissens cdu wählen,0,0,7471573902104218902,7471573902104218902,negative
7472137306846561046,2025-02-16 21:49:32,gruengehtgarnicht cdugehtgarnichtmehr stoppt die brandmauer zeitfuerdeutschland ,0,0,7471573902104218902,7471573902104218902,neutral
7472132610589049622,2025-02-16 21:31:14,so wie ihr,0,0,7471573902104218902,7471573902104218902,negative
7472129549733004054,2025-02-16 21:19:24,vielleicht sollte herr m sich in unterhemd bekleidet in die küche stellen macht ihn sicher sympathisch ,0,0,7471573902104218902,7471573902104218902,neutral
7472118049358463766,2025-02-16 20:34:47,,0,0,7471573902104218902,7471573902104218902,negative
7472113394201182998,2025-02-16 20:16:45,den herrn kann ich politisch nicht ernst nehmen ,0,0,7471573902104218902,7471573902104218902,neutral
7472109001527460630,2025-02-16 19:59:38,,0,0,7471573902104218902,7471573902104218902,negative
7472102914867004182,2025-02-16 19:36:07,frau lang ich bitte sie setzen sie sich dafür ein das ihre partei noch vor der wahl eine zusammenarbeit mit der cducsu kategorisch ausschließt,0,0,7471573902104218902,7471573902104218902,neutral
7472096875112596226,2025-02-16 19:12:42,bitte nie wieder grüne in der regierung,0,0,7471573902104218902,7471573902104218902,negative
7472091341645497110,2025-02-16 18:51:08,smashsmash  hulk ist grün,0,0,7471573902104218902,7471573902104218902,positive
7472086196069581590,2025-02-16 18:31:17,,0,0,7471573902104218902,7471573902104218902,negative
7472075352174117654,2025-02-16 17:49:05,danke ricarda,0,0,7471573902104218902,7471573902104218902,positive
7472069564893856514,2025-02-16 17:26:29,wurden wir nicht sogar von der eu gerügt dass die schere zwischen arm und reich immer größer wird wie sehr will merz gerügt werden,0,0,7471573902104218902,7471573902104218902,neutral
7472063219571606294,2025-02-16 17:02:11,"wenn robert wenigstens im unterhemd sitzen würde yummi
",0,0,7471573902104218902,7471573902104218902,neutral
7472056787928974102,2025-02-16 16:37:09,merz bitte weg,0,0,7471573902104218902,7471573902104218902,negative
7472053335521805078,2025-02-16 16:23:45,genau wie der merz auch und diese bildungslose lang die nur das volk über den tisch gezogen hat,0,0,7471573902104218902,7471573902104218902,neutral
7472052705033978646,2025-02-16 16:21:16,frauen in führungspositionen ja wenn diese führungsqualität besitzt,0,0,7471573902104218902,7471573902104218902,neutral
7472046970372244246,2025-02-16 15:59:10,geht bitte alle wählen aber keine populisten oder lobbyisten in den bundestag keine stimme für afd cducsu fdp und bsw in der anstehenden wahl habeck4kanzler,0,0,7471573902104218902,7471573902104218902,negative
7472046014922392342,2025-02-16 15:55:27,"  
   merz verhindern   
 habeck 2025 
  diesmal grün  
  ",0,0,7471573902104218902,7471573902104218902,neutral
7472045436938601238,2025-02-16 15:53:05,es sind nicht die frauen die sabbern und nicht mehr denken können sobald sie ein bisschen haut sehen man sollte nicht von sich auf andere schließen,0,0,7471573902104218902,7471573902104218902,neutral
7472045184055591702,2025-02-16 15:51:55,,0,0,7471573902104218902,7471573902104218902,negative
7472038891605738262,2025-02-16 15:27:42,,0,0,7471573902104218902,7471573902104218902,negative
7472025225073623830,2025-02-16 14:34:32,,0,0,7471573902104218902,7471573902104218902,negative
7472023761550869270,2025-02-16 14:28:51,niemals wählbar,0,0,7471573902104218902,7471573902104218902,negative
7472018713508987680,2025-02-16 14:10:36,frau lang es hat sich nichts geändertich kann ihr geschwätz immer noch nicht ertragen,0,0,7471573902104218902,7471573902104218902,negative
7472014993665458966,2025-02-16 13:55:03,,0,0,7471573902104218902,7471573902104218902,negative
7472002571645780758,2025-02-16 13:06:31,kriegstreiber er setzt das leben des volkes aufs spiel für taurus lieferung wacht bitte endlich auf,0,0,7471573902104218902,7471573902104218902,neutral
7471998841769034518,2025-02-16 12:52:10,doch doch merz hat wirtschaftskompetenz  er weiß genau wie er möglichst viel geld in die eigene tasche wirtschaftet,0,0,7471573902104218902,7471573902104218902,neutral
7471998663061979926,2025-02-16 12:51:23,dieser mann darf auf gar keinen fall kanzler werden wie menschenverachtend kann man reden haltet fest zusammen gegen rechts ,0,0,7471573902104218902,7471573902104218902,neutral
7471993897024275222,2025-02-16 12:32:58,finde es lustig wie männer von sich auf uns schließen nur weil männer sich leicht durch für sie leicht begleitet frauen ablenken lassen und teilweise zu tieren werden ist das bei uns frauen nicht s,0,0,7471573902104218902,7471573902104218902,positive
7471993235473875734,2025-02-16 12:30:30,liebe frau lang ich bin so beeindruckt von ihnen und würde mir wünschen dass sie wieder in die aktive politische arbeit zurückkehren und bitte mit der entschlossenheit die sie nach dem austritt,0,1,7471573902104218902,7471573902104218902,neutral
7471992702348100374,2025-02-16 12:28:19,der ist so schlimm,0,0,7471573902104218902,7471573902104218902,negative
7471987136725304086,2025-02-16 12:06:56,ich mag deinen stil ricarda du bist unfassbar toll,0,0,7471573902104218902,7471573902104218902,positive
7471983237791875863,2025-02-16 11:51:32,frau lang ich begrüßte zwar das sie ein lebenslauf haben aber bei ihrer vita fehlen mir kompetenz in wirtschaft bildung oder allgemeiner politischer themen,0,0,7471573902104218902,7471573902104218902,neutral
7471982567475151638,2025-02-16 11:48:57,nach fnfritzens selbstbild ist er ein kompetenzmonster im bereich frauenthemen frauen sollten sich da aber besser raushalten meint er,0,0,7471573902104218902,7471573902104218902,neutral
7471977911617667862,2025-02-16 11:31:01,,0,0,7471573902104218902,7471573902104218902,negative
7471974937956369174,2025-02-16 11:19:22,aber was ist jetzt der sinn hinter gleicher verteilung nach geschlecht im parlament es geht um qualifikation und nicht um geschlechter,0,0,7471573902104218902,7471573902104218902,neutral
7471968576522617622,2025-02-16 10:54:41,selbst wenn er keine ahnung hat habeck sucht wissenschaftler und experten auf und holt sich infos und ideen für eine bessere wirtschaftregierung ein guter könig weiß nicht alles aber er weiß wen er fragen muss um ein guter könig zu sein,0,0,7471573902104218902,7471573902104218902,neutral
7471962630086427425,2025-02-16 10:33:48,also beim robert würde ich schon schwach werden er sieht immer aus wie ein kleiner knuddelbär,0,0,7471573902104218902,7471573902104218902,neutral
7471962825805431574,2025-02-16 10:32:35,alle gegen merz kassandra projekt frauenrat,0,0,7471573902104218902,7471573902104218902,neutral
7471962835900580630,2025-02-16 10:32:30,und trotzdem werden viele frauen diesen mann also die partei wählen  was ich ehrlicherweise nicht verstehe aber mal was anderes  wie kann ein mensch bei einer öffentlichen rede mit,0,1,7471573902104218902,7471573902104218902,neutral
7471960144857858838,2025-02-16 10:22:17,der bräsige brillenbär aus brilon ist ein inverser robin hood nimmt den armen und gibt den reichen,0,0,7471573902104218902,7471573902104218902,neutral
7471956194815443734,2025-02-16 10:06:39,nein zu merz,0,0,7471573902104218902,7471573902104218902,negative
7471955314460443414,2025-02-16 10:03:16,merz ist sooo unsympathisch,0,0,7471573902104218902,7471573902104218902,negative
7471954464989004566,2025-02-16 10:00:14,merz zerlegt ,0,0,7471573902104218902,7471573902104218902,negative
7471952558942044950,2025-02-16 09:52:34,sein kopf hat zwar die form einer glühbirne aber licht ist trotzdem aus,0,0,7471573902104218902,7471573902104218902,neutral
7471949052143092502,2025-02-16 09:39:09,seine körpersprache sagt alles da braucht es keine worte,0,0,7471573902104218902,7471573902104218902,neutral
7471948988246655766,2025-02-16 09:38:50,"um es verständlich für merzsöder auszudrücken das angebliche unterhemd wirkt anpackender als ein anzug mit verschränkten armen
briefwahl ist raus ",0,0,7471573902104218902,7471573902104218902,neutral
7471944958214537986,2025-02-16 09:23:24,slaaaaay queeeen ,0,0,7471573902104218902,7471573902104218902,negative
7471939904600294166,2025-02-16 09:03:32,dieser mann ist soooo sorry mir fällt nichts ein außer ,0,0,7471573902104218902,7471573902104218902,negative
7471936197739512599,2025-02-16 08:49:31,,0,0,7471573902104218902,7471573902104218902,negative
7471932953029133078,2025-02-16 08:37:03,ich hoffe auf rotrotgrün das wäre unsere rettung,0,0,7471573902104218902,7471573902104218902,neutral
7471932181561099030,2025-02-16 08:33:35,stimmt eigentlich aber dass habeck ein frauentyp ist kann niemand abstreiten frau lang bitte sprechen sie über sein schönreden und die fehler in der wirtschaftspolitik der letzten 3 jahre,0,0,7471573902104218902,7471573902104218902,neutral
7471926195887244054,2025-02-16 08:10:39,der kocht halt mit brauner soße schon immer unwählbar der mann,0,0,7471573902104218902,7471573902104218902,negative
7471925606793610006,2025-02-16 08:08:35,der redet wohl von sich selbst und ist mathematik keine ahnung,0,0,7471573902104218902,7471573902104218902,neutral
7471923260042838806,2025-02-16 07:59:38,nach der ampel links ,0,0,7471573902104218902,7471573902104218902,neutral
7471907244138906390,2025-02-16 06:58:03,merz ist so fürchterlich,0,0,7471573902104218902,7471573902104218902,negative
7471906496217973526,2025-02-16 06:54:24,das problem hr merz ist dass sie auch keine ahnung haben vor allem keine ahnung von der realität von frauen sie machen weder gute wirtschaftspolitik noch sozialpolitik und was ist mit 218 sie eckel,0,0,7471573902104218902,7471573902104218902,neutral
7471903156595720982,2025-02-16 06:41:36,ich halte ih für genauso gefährlich wie die afdler und kann 0 verstehen das die cdu sich hinter sojemanden stellt bin sicher der stürzt uns in die rechtsradikalität und macht gemeinsamme sache,0,0,7471573902104218902,7471573902104218902,negative
7471900884017857302,2025-02-16 06:33:38,,0,0,7471573902104218902,7471573902104218902,negative
7471898187861082902,2025-02-16 06:23:47,,0,0,7471573902104218902,7471573902104218902,negative
7471894315226596118,2025-02-16 06:09:06,hätte nicht gedacht das merz im unterhemd in der küche sitzt einmal richtig hat keine ahnung von wirtschaft einmal falsch ist nicht sympathisch,0,0,7471573902104218902,7471573902104218902,negative
7471863441898078998,2025-02-16 04:11:10,es ist so deprimierend in dieser zeit zu leben mit all diesen rechten nebelkerzen und krampfhaften attacken der oberen 10,0,0,7471573902104218902,7471573902104218902,negative
7471845892951114518,2025-02-16 03:02:17,,0,0,7471573902104218902,7471573902104218902,negative
7471836448997622550,2025-02-16 02:24:59,"diese ansprache zeigt nicht nur wie merz über frauen hormongesteuert statt rational denkt sondern zudem auch gleich noch dass er bei dem anblick von unbedeckter haut sofort an sex denkt
wenn ich jemanden in einem unterhemd sehe den ich bisher eher mit anzug und krawatte gesehen habe dann stutze ich vielleicht kurz wegen des ungewohnten kleidungsstils aber dann verschwindet das als größtenteils irrelevant in diesem ganz speziellen fall denke ich noch über prstrategien nach zwecks dem generieren von nahbarkeit aber ich habe definitiv keine daddy issues und auch bei gleichaltrigen männern tanzen meine eierstöcke nicht los nur weil ich mehr als 3cm² haut unterhalb des halses sehe",0,0,7471573902104218902,7471573902104218902,neutral
7471836127394333462,2025-02-16 02:22:39,punkt punkt komma strich fertig ist das mondgesicht,0,0,7471573902104218902,7471573902104218902,neutral
7471823215724774166,2025-02-16 01:32:08,wenn ein unterhemd ausreicht um frauen von unfähigkeit abzulenken sollte herr merz nur noch im unterhemd rumlaufen,0,0,7471573902104218902,7471573902104218902,neutral
7471820430211318550,2025-02-16 01:20:49,jedes mal wieder unangenehm unwählbar diese kombi aus mr burns und stromberg ,0,0,7471573902104218902,7471573902104218902,negative
7471810082671067926,2025-02-16 00:40:26,also tante lotte hat mit ihrem dackel da kurzen prozess gemacht der gute ist seitdem viel ruhiger und dieses schreckliche dominanzverhalten ist auch verschwunden ,0,0,7471573902104218902,7471573902104218902,neutral
7471808633447170838,2025-02-16 00:35:09,entgelttransparenzrichtlinie  so was heilt linke auf von bürokratie kann es nicht genug geben und so ein tolles wort deindustrialisierungsbeschleunigungsmaßnahmenpaket  noch geiler,0,0,7471573902104218902,7471573902104218902,neutral
7471808251563934486,2025-02-16 00:32:54,,0,0,7471573902104218902,7471573902104218902,negative
7471806392816370454,2025-02-16 00:26:20,nicht gleicher lohn für gleiche arbeit sondern gleicher lohn für gleiche leistung so wird ein schuh draus ,0,0,7471573902104218902,7471573902104218902,neutral
7471799829255373590,2025-02-16 00:00:52,lest mal kommentare ich bis geschockt wieviele frauen schreiben der sieht gut aus lächelt so süß  den wähle ich bitte wählt kompetenz in für den rest gebt zu tinder,0,0,7471573902104218902,7471573902104218902,negative
7471790858842227478,2025-02-15 23:25:29,no kink shaming aber wie kann man das was merz sagt geil finden ,0,0,7471573902104218902,7471573902104218902,positive
7471786461711598358,2025-02-15 23:08:37,wer sitzt bitte im unterhemd am küchentisch  hab ich eine küchentisch sendung von robert habeck versäumt  kann mir robert im unterhemd garnicht vorstellen,0,0,7471573902104218902,7471573902104218902,negative
7471784457801253654,2025-02-15 23:00:21,deswegen beide stimmen teamhabeck habeck4kanzler teamrobert merzverhindern söderverhindern afdverhindern zuversicht,0,0,7471573902104218902,7471573902104218902,neutral
7471782902464987926,2025-02-15 22:54:16,ich kann diese aroganz nicht ertragen der wird nie für seine bürger arbeiten der ist zu überheblich,0,0,7471573902104218902,7471573902104218902,negative
7471767403841749782,2025-02-15 21:54:18,,0,0,7471573902104218902,7471573902104218902,negative
7471767134251827990,2025-02-15 21:52:59,niemals merz untragbar,0,0,7471573902104218902,7471573902104218902,negative
7471766874288571158,2025-02-15 21:51:56,,0,0,7471573902104218902,7471573902104218902,negative
7471763843268133654,2025-02-15 21:40:24,,0,0,7471573902104218902,7471573902104218902,negative
7471763407558837014,2025-02-15 21:38:41,,0,0,7471573902104218902,7471573902104218902,negative
7471762878972609302,2025-02-15 21:36:39, h4k ,0,0,7471573902104218902,7471573902104218902,positive
7471760515443098390,2025-02-15 21:27:21,danke ricarda lang,0,0,7471573902104218902,7471573902104218902,positive
7471756205359137558,2025-02-15 21:10:28,merz hat clownschule durchgespielt im turbomodus das letzte halbe jahr ,0,0,7471573902104218902,7471573902104218902,neutral
7471755645575283478,2025-02-15 21:08:28,ricarda ,0,0,7471573902104218902,7471573902104218902,positive
7471755583792988950,2025-02-15 21:08:10,,0,0,7471573902104218902,7471573902104218902,negative
7471755454802445078,2025-02-15 21:07:58,wastarasagt ricardalang neues format mich euch beiden ,0,0,7471573902104218902,7471573902104218902,negative
7471754162805785366,2025-02-15 21:02:56,der mann der bei mir in der küche sitzt hat wirtschaft studiert und unterrichtet und er gräbt den garten um legt kartoffeln sie bekommen meine stimme nicht,0,0,7471573902104218902,7471573902104218902,negative
7471753874824954646,2025-02-15 21:01:48, habeckforkanzler,0,0,7471573902104218902,7471573902104218902,negative
7471752142345585430,2025-02-15 20:54:47,wir brauchen habeck thirst traps ,0,0,7471573902104218902,7471573902104218902,neutral
7471751659355800342,2025-02-15 20:53:11,wir wollen habeck,0,0,7471573902104218902,7471573902104218902,negative
7471747100528083734,2025-02-15 20:35:17,einfach untragbar der typ,0,0,7471573902104218902,7471573902104218902,negative
7471742156290900758,2025-02-15 20:16:04,wer nichts in seinem leben geleistet hat und weder imstande war eine ausbildung oder ein studium abzuschließen sollte niemandes kompetenz infrage stellen ,0,0,7471573902104218902,7471573902104218902,neutral
7471735658815521558,2025-02-15 19:51:01,oh was ist da passiert,0,0,7471573902104218902,7471573902104218902,negative
7471734243245916950,2025-02-15 19:45:25,ich denke dass bei merz der neid spricht keiner will ihn im unterhemd in ner küche oder überhaupt irgendwo sitzen sehen,0,0,7471573902104218902,7471573902104218902,neutral
7471733327110210326,2025-02-15 19:41:41,,0,0,7471573902104218902,7471573902104218902,negative
7471732411899101974,2025-02-15 19:38:13,selbstwertprobleme hat er auch noch  danke liebe ricarda lang ,0,0,7471573902104218902,7471573902104218902,neutral
7471732226139521814,2025-02-15 19:37:46,ich vermisse dich ricarda ,0,0,7471573902104218902,7471573902104218902,neutral
7471730723180823318,2025-02-15 19:31:40,wer hat den wirtschaftskompetenz und wie definieren sie wk,0,0,7471573902104218902,7471573902104218902,neutral
7471730533714969366,2025-02-15 19:30:59,,0,0,7471573902104218902,7471573902104218902,negative
7471726815954928406,2025-02-15 19:16:26,,0,0,7471573902104218902,7471573902104218902,negative
7471723363036644118,2025-02-15 19:03:11,danke für den post merz der arrogante frauenverächter,0,0,7471573902104218902,7471573902104218902,negative
7471720625779327766,2025-02-15 18:52:35,das sagt alles über merz frauenbild,0,0,7471573902104218902,7471573902104218902,neutral
7471717267479724822,2025-02-15 18:39:31,deshalb am 2302 links wählen  denn die grünen haben auch einen rechtsruck,0,0,7471573902104218902,7471573902104218902,neutral
7471713262770357015,2025-02-15 18:23:50,die frauen die cdu wählen wählen cdu weil sie cdu wählen aber bitte sagt mir es wählt keine frau cdu wegen merz,0,0,7471573902104218902,7471573902104218902,negative
7471709581062062870,2025-02-15 18:09:53,,0,0,7471573902104218902,7471573902104218902,negative
7471709439960826646,2025-02-15 18:09:15,,0,0,7471573902104218902,7471573902104218902,negative
7471708642322940674,2025-02-15 18:06:16,,0,0,7471573902104218902,7471573902104218902,negative
7471702623927075606,2025-02-15 17:42:39,die müssen vielleicht mal wieder pingpong spielen kommt im wahlkampf evtl bissel kurz,0,0,7471573902104218902,7471573902104218902,neutral
7471702184640381718,2025-02-15 17:40:53,der katapultiert sich doch tatsächlich selbst ins aus  wie peinlich ,0,0,7471573902104218902,7471573902104218902,neutral
7471690991389786902,2025-02-15 16:57:37,das versteht ein manz doch nicht eine frau im unterhemd in der küche da kann nicht mehr über politik nachgedacht werden also muss es uns frauen doch erst recht so gehen als minderintelligentes,0,0,7471573902104218902,7471573902104218902,negative
7471687769347523350,2025-02-15 16:45:09,fred4dixi,0,0,7471573902104218902,7471573902104218902,positive
7471684219801207554,2025-02-15 16:31:31,die armen habeck hat die ja richtig verletzt wenn die ununterbrochen ihm hinterher heulen,0,0,7471573902104218902,7471573902104218902,neutral
7471679848881160982,2025-02-15 16:14:14,,0,0,7471573902104218902,7471573902104218902,negative
7471679626113205014,2025-02-15 16:13:25,word,0,0,7471573902104218902,7471573902104218902,negative
7471670606619099926,2025-02-15 15:38:28,,0,0,7471573902104218902,7471573902104218902,negative
7471670222228931350,2025-02-15 15:37:16,sie ist wieder da,0,0,7471573902104218902,7471573902104218902,neutral
7471668909910934294,2025-02-15 15:32:08,,0,0,7471573902104218902,7471573902104218902,negative
7471667550239310614,2025-02-15 15:26:55,wenn es nur um schönheit ginge müsste ja eh konstantin kuhle bundeskanzler werden,0,0,7471573902104218902,7471573902104218902,neutral
7471661970523390742,2025-02-15 15:05:18,,0,0,7471573902104218902,7471573902104218902,negative
7471652962197111574,2025-02-15 14:29:58,rotrotgrün ,0,0,7471573902104218902,7471573902104218902,negative
7471650542708900630,2025-02-15 14:20:38,die selbstkomplexe der männer und die furcht der unterlegenheit  das kommt dabei raus,0,0,7471573902104218902,7471573902104218902,neutral
7471650388127941398,2025-02-15 14:20:03,"also beim thema  keine ahnung kann ich ihm die kompetenz nicht wirklich absprechen schließlich ist das ja quasi sein 2 vorname 
btw teenies hier so abzuwerten find ich unfair ",0,0,7471573902104218902,7471573902104218902,negative
7471641568337117974,2025-02-15 13:45:51,,0,0,7471573902104218902,7471573902104218902,negative
7471640040373027606,2025-02-15 13:39:53,,0,0,7471573902104218902,7471573902104218902,negative
7471639300003955478,2025-02-15 13:37:15,das sagt der richtige ,0,0,7471573902104218902,7471573902104218902,neutral
7471638377478374166,2025-02-15 13:33:29,"schweiz 
deutsche firmen in der schweiz produzieren für euländerwobei jährlich über 300 milliarden franken gewinn in der schweiz verbleiben
politik politiker haben keine intresse daran",0,0,7471573902104218902,7471573902104218902,neutral
7471637230504968982,2025-02-15 13:29:15,mutti hatte ihn einfach nicht lieb der schmerz sitzt tief,0,0,7471573902104218902,7471573902104218902,neutral
7471633011570983702,2025-02-15 13:12:37,typene das wort gibt es nicht,0,0,7471573902104218902,7471573902104218902,neutral
7471632068586832662,2025-02-15 13:08:59,respekt zu ihrer veränderung ,0,0,7471573902104218902,7471573902104218902,neutral
7471630466753430274,2025-02-15 13:02:47,merz ist der beste ,0,0,7471573902104218902,7471573902104218902,positive
7471628337774297878,2025-02-15 12:54:29,,0,0,7471573902104218902,7471573902104218902,negative
7471625241425429270,2025-02-15 12:42:23,vielen dank vor allem für den letzten satz ,0,0,7471573902104218902,7471573902104218902,neutral
7471624713400484630,2025-02-15 12:40:22,schmerz,0,0,7471573902104218902,7471573902104218902,negative
7471624634930184982,2025-02-15 12:40:20,,0,0,7471573902104218902,7471573902104218902,negative
7471623854357365526,2025-02-15 12:37:16,ja genau wacht auf ihr frauen so viele vor uns haben dafür gekämpft ,0,0,7471573902104218902,7471573902104218902,negative
7471621538544026390,2025-02-15 12:28:21,wie unverschämt und erniedrigend uns gegenüber dieser mann das geht überhaupt garnicht,0,0,7471573902104218902,7471573902104218902,negative
7471620597719008022,2025-02-15 12:24:29,wer sagt denn dass der kerl im unterhemd keine ahnung hat,0,0,7471573902104218902,7471573902104218902,neutral
7471620225311884054,2025-02-15 12:23:18,nike digga ich kann das nicht mehr,0,0,7471573902104218902,7471573902104218902,negative
7471619297489290006,2025-02-15 12:19:29,zweitstimmelinkewir brauchen eine starke opposition um gegen den rechtsruck anzukommen wir brauchen eine opposition mit rückrad die für uns arbeitet es ist zeit für wohlstand für alle,0,0,7471573902104218902,7471573902104218902,neutral
7471618921659695894,2025-02-15 12:18:07,wie steht er denn überhaupt da wie so ein überforderter lateinlehrer der auf dem sommerfest was sagen soll bevor das buffet eröffnet wird lenkt mich irgendwie mehr ab als ein unterhemd ,0,0,7471573902104218902,7471573902104218902,negative
7471617320927986454,2025-02-15 12:11:55,sie müssen mal objektiv sein,0,0,7471573902104218902,7471573902104218902,neutral
7471617202887394070,2025-02-15 12:11:24,dieser kerl ist indiskutabel,0,0,7471573902104218902,7471573902104218902,neutral
7471616132140204822,2025-02-15 12:07:13,wie bodenlos sxistisch er sich äußert ohne scham bin echt schockiert,0,0,7471573902104218902,7471573902104218902,negative
7471614163253986070,2025-02-15 11:59:29,,0,0,7471573902104218902,7471573902104218902,negative
7471613966151025430,2025-02-15 11:58:44,was ist das für eine körperhaltung,0,0,7471573902104218902,7471573902104218902,negative
7471613053567795990,2025-02-15 11:55:24,hä stimmt wir sind auch zu blöd irgendwelche inhalte zu checken,0,0,7471573902104218902,7471573902104218902,negative
7471607214864761622,2025-02-15 11:32:28,als frau mit bwl studium an die liebe ricarda das was die grünen fabriziert haben ist ne ganz große wirtschaftliche katastrophe fakten sind fakten,0,0,7471573902104218902,7471573902104218902,neutral
7471606888615822102,2025-02-15 11:31:24,louder,0,0,7471573902104218902,7471573902104218902,positive
7471605516414878486,2025-02-15 11:25:52,,0,0,7471573902104218902,7471573902104218902,negative
7471603093374075670,2025-02-15 11:16:28,wo findet man das video von merz in original,0,0,7471573902104218902,7471573902104218902,negative
