topic,top_words
1,"linke, dielinke, wahlkreis, gerechtigkeit, afd, nachderampellinks, mehr, zukunft, starke, seite"
2,"wahl, wahlkampf, linke, milliardäre, deshalb, einkommen, menschen, versprechen, land, arbeit"
3,"linke, dielinke, deshalbdielinke, ramelow, 23, bundestag, wählen, bodo ramelow, bodo, nachderampellinks"
4,"linke, fyp, heidi, merz, heidi reichinnek, reichinnek, bundestag, foryourpage, fyp foryourpage, afd"
5,"hamburg, linke, klima, gut, linke hamburg, buergerschaftswahl, vieles, hamburger, dielinkehamburg, mieten"
6,"linke, jan, menschen, van, jan van, politik, mehr, aken, van aken, leben"
