id,video_description,create_time,region_code,share_count,view_count,like_count,comment_count,music_id,hashtag_names,username,effect_ids,playlist_id,voice_to_text
7458298897539091745,"🛑 Der Digitale Euro – Gefahr für unsere Freiheit Die Einführung des digitalen Euro ist ein massiver Eingriff in die Freiheit und Selbstbestimmung der Bürger. Mit der vollständigen Digitalisierung unseres Geldes droht eine totale Überwachung unserer finanziellen Aktivitäten. Jeder Einkauf, jede Spende und jede Überweisung könnten zentral nachverfolgt und kontrolliert werden. Das Bargeld hingegen bietet Anonymität und schützt unsere Privatsphäre. Es ist ein Symbol für Freiheit und Unabhängigkeit. Nur durch den Erhalt und die Stärkung des Bargeldes können wir verhindern, dass der Staat oder Banken eine allumfassende Kontrolle über unser Leben erhalten. Die AfD steht entschieden gegen den digitalen Euro in seiner geplanten Form. Wir fordern: Keine Abschaffung des Bargelds! Wir kämpfen für den Erhalt unserer finanziellen Souveränität und persönlichen Freiheit. 💪🇩🇪",1736520538,DE,5,1677,168,20,7458298947904211745,[],steffenkotre,,,
7462091707992001824,SO WAR UNSER AfD-AUTOKORSO! Seid das nächste Mal auch dabei! 🚗🏎️,1737403622,DE,9,2603,187,15,7462091792825994017,[],steffenkotre,,,"wir wissen alle, nur die AfD kann dieses Land noch retten. wenn man sich also mit der Politik beschäftigt, wenn wir uns äh, mit Deutschland beschäftigen, dann haben nur wir die Lösung, dass Deutschland also auch in 100 oder 200 Jahren noch existiert. wir sitzen gerade in einem Oldtimer, nämlich äh, einer alten Feuerwehr. die haben wir entsprechend auch äh, rapiert und äh, mit Werbung Versehen. und dadurch ist die AfD also nicht zu übersehen, wenn wir jetzt hier überall durchfahren. das ist ja nicht nur eine Werbeaktion für unsere Partei, eben für den 23.februar, für die Wahl, sondern das macht eben auch äh, Spaß hier, dass wir zusammenkommen und gemeinsam fahren. wir werden immer mehr. wir waren vor glaub ich anderthalb Jahren grade mal 35.000 Mitglieder in Deutschland, jetzt haben wir 50.000 und mehr. wir wachsen rasant, alles steigt, die Umfrage gewerte, die Mandate, die wir erringen, um dann in den Parlamenten zu wirken und auch der Zuspruch dann bei den Wählern, trotz der Nazikeule, die immer über uns geschwungen wird und trotz dieser ganzen Diffamierung und trotz der Steine, die man uns immer wieder in den Weg legt. heute haben wir wieder gezeigt, wir können, wenn wir wollen. wir sind kraftvoll und das werden wir eben weitermachen, solange, bis wir dann auch die politische macht erringen, in diesem Land dann das zu gestalten, was wir wollen. wir sind die friedenspartei, wir wollen Friedensdiplomatie und keine waffenlieferung. wir wollen, dass man Deutschland ebend auch in 100 Jahren noch erkennt. deswegen remigration, wir wollen unsere innere Sicherheit wiederherstellen, wir wollen den Sozialstaat retten, deutsches Geld für deutsche Interessen und wir wollen unsere deutsche Identität behalten. noch mal vielen Dank euch!
"
7460899229960047905,"🚙🚒🇩🇪 Morgen! AfD-Autokorso: Rangsdorf, Zossen, Baruth, Lübben Wenn ihr morgen Gleichgesinnte und Freunde treffen möchtet und dabei eine schöne Fahrt durch unser Brandenburg genießen wollt, dann macht mit bei unserem AfD-Autokorso! Treffpunkt: Südring-Center, Rangsdorf, auf dem Parkplatz Zeit: 10:00 Uhr Wir freuen uns auf euch!",1737125981,DE,6,1220,120,11,7460899303713278753,[],steffenkotre,,,
7460206420877741345,"Ich besuche eine linksgrün orientierte Veranstaltung Ein linksgrünes Bündnis lud gestern alle Interessierten zu einem Neujahrsempfang ein. Ich habe teilgenommen, um mit den Menschen ins Gespräch zu kommen. Insbesondere Interessiert mich, warum die Linksgrünen die Umwelt und Landschaft mit Windrädern zerstören wollen.",1736964669,DE,47,11793,1084,67,7460206854329600801,[],steffenkotre,,,"so, wir fahren jetzt zu einer Veranstaltung von gemeinsam für halbe, das ist so, 1 durchaus politisch links und grünstehendes äh, Bündnis, aber sie haben eingeladen zum offenen Gespräch für alle Bürger und gerade hier in halbe, an dem Ort, wo das stattfindet, haben wir ja viele Probleme, vor Allen Dingen mit einem geplanten windindustriegebiet. also halbe soll wieder so viel Windräder bekommen, dass man den Ort dann nicht wiedererkennt und äh, die Umweltzerstörung äh, also extrem groß sein wird und äh, Vertreter dieses Bündnisses haben eben dafür auch äh, gestimmt im gemeinrat und da wollen wir einfach ins Gespräch kommen aufgrund dessen, dass sie eben eingeladen haben und äh, das wollen wir eben äh, wahrnehmen und an uns solls eben äh, nich liegen, dass die Brandmauer eingerissen wird. augenscheinlich haben sich hier n paar Leute zusammengetan und stehen da irgendwie am Eingang und äh äh, wollen irgendwie nich, dass man hier ganz normal der Veranstaltung, politische Veranstaltung besucht. so, ich guck mal hier durch. so Abend Abend. na ja, hallo Abend, hallo, ja, wir waren hier bei dieser Veranstaltung und ich hatte durchaus gute Gespräche, wenn aber natürlich auch hier Antifa gewalttypen äh, dort vor Ort sind, immer noch da sind und die Meinungsfreiheit unterdrücken wollen. sie waren auch vermummt jetzt hier bei der Veranstaltung drinnen, aber hier der Besitzer äh, des veranstaltungslokals, 1 Neuseeländer, er hat mich dort äh, also auch eingeladen in 1 Gespräch und gut, dass es äh, Leute gibt, die sich also um die Historie. äh, kümmern, denn das ist der alte kaiserbahnhof, in dem diese Veranstaltung stattfand und äh, insofern hat das hier also auch Flair, ja, das 1 oder andere gute Gespräch, aber eben auch viel äh, Ideologie dabei. ich hab hier auch äh, meine SPD direkt ähm, Konkurrentin im Wahlkampf kennengelernt, auch da hatten wir 1 gutes Gespräch. aber wie ihr gerade hier hinter Mir hört, diese Gespräche wollen einige torpedieren und Aus eben schade, dass äh, also sich äh, die linksgrünen nicht von diesen Gewalttätern distanzieren. und selbst bei dieser Veranstaltung hat man gemerkt, die AfD ist angekommen. man kommt nicht umhin, mit Vertretern der AfD zu reden. wir machen Wahlkampf jetzt weiter und werden immer das Gespräch auch mit den politischen Gegner suchen.
"
7460099605628308768,"In meinem heutigen Interview mit dem ZDF-Morgenmagazin habe ich erklärt, warum es falsch ist, den Reinhardswald – bekannt als Märchenwald der Gebrüder Grimm und ein bedeutendes Natur- und Kulturerbe – zu roden, um ineffiziente, teure und umweltschädliche Windkraftanlagen zu errichten. Die Märchen der Brüder Grimm, die im Zusammenhang mit diesem Wald stehen, gehören zum UNESCO-Weltkulturerbe und sind ein wichtiger Teil unserer kulturellen Identität. Stattdessen sollten wir auf kostengünstige und ressourcenschonende Technologien wie die Kernenergie setzen. So bewahren wir nicht nur unsere Umwelt, sondern auch diesen wertvollen Teil unserer Geschichte.",1736939804,DE,3,1293,88,20,7460099755943791393,[],steffenkotre,,,"fast 30.000 Windräder produzieren in Deutschland Energie, klimafreundlich und in großem Umfang. die jüngsten offiziellen Zahlen zeigen, für die Stromerzeugung in Deutschland war 2.023 die Windkraft mit 31 Prozent Anteil der wichtigste Energieträger. danach folgten Kohle mit 26 Komma 1 Prozent sowie Erdgas und Solar. der AfD aber ist die Windkraft 1 Dorn im Auge, wenn wir am Ruder sind. wir reißen alle Windkraftwerke nieder. nieder mit diesen windmölen der Schande. auf Nachfrage ruderte Weidel zurück und Schloss Windkraft als Energiequelle nicht Aus, es dürfe dafür aber keine Subventionen mehr geben. allerdings heißt es auch im jüngsten Entwurf des AfD Wahlprogramms, die großflächigen naturzerstörungen durch Windkraftanlagen würden sofort beendet zugunsten von Kohle, Gas und Atomkraft. weides Äußerung in der parteitagsrede sorgte für viel Kritik, auch von Wirtschaftsexperten. sie ist äh, unverantwortlich mit Blick auf den deutschen energiemix. denn die Entscheidungen, die vor längerer Zeit, spätestens 2.011 getroffen wurden, lauten, ja, die grundlast der deutschen Energieproduktion soll nicht das System der erneuerbaren bereitgestellt werden. das Energiesystem einer großen Volkswirtschaft könnte man nicht alle Nase lang umbauen, so Hüter. und ja, die AfD Ernst nehmen muss man sich schon angesichts äh, der zustimmungsraten, die sie hat äh, aber das, was sie androht zu tun im Bereich der Wirtschaftspolitik oder der Energiepolitik ist in jeder Hinsicht katastrophal. Windräder abbauen, unter anderem Atomkraft ausbauen. die Energiepolitik der AfD. ja, und in der AfD Bundestagsfraktion ist Steffen kotre zuständig für Energiepolitik. jetzt ist er bei Anke pletner in Berlin. guten Morgen, schönen, guten Morgen, schönen. guten Morgen, Herr kotri, ja, schönen guten Morgen. ja, Windräder Decken 30 Prozent des strombedarfs. wie soll der gedeckt werden, wenn jetzt die Anlagen niedergerissen werden, wie ihre Vorsitzende gesagt hat, Kernenergie. wir wollen sichere preiswerte und umweltverträgliche Stromversorgung und Energieversorgung insgesamt. und genau dieses äh, zildreieck, dieses gibt es ja nicht mehr. wir haben jetzt äh, eine der teuersten energieversorgungen. wir sehen, dass die Versorgungssicherheit immer mehr nachlässt ebend aufgrund des zubaus von sogenannten instabilen erneuerbaren Energien, unter anderem ebend auch diese Windmühlen. das heißt, die Antwort ist, sie sind dafür, Windräder wegzureißen. das wäre das bei der Kernenergie. ne, ne, ne, tschuldigung, nich wegreißen, sie werden sich selber erledigen. wenn sie nicht mehr subfensioniert werden, dann erledigen sie sich von selbst, weil gesagt hat, sie will die Windräder niederreißend stimmt das? was die Kanzlerkandidatin da gesagt hat, bezog sich das auf die Windräder, die im Märchenwald stehen. und das ist ja wirklich n Unding, also Märchenwald äh, die Gebrüder Grimm äh, die Gebrüder Grimm haben unsere Märchen hier, das steht im Weltkulturerbe der UNESCO und da kann man solche Dinger nicht aufstellen und den Wald zerstören. das geht nicht. das klang aber sehr allgemein. vielleicht hören wir da kurz noch mal rein in den Auto und so, wie sie es gesagt hat, in Hessen holzt die CDU Regierung den Märchenwald der Brüder Grimm für Windräder AB. wir Kennen sie, liebe CDU, und ich kann euch sagen, wenn wir am Ruder sind, wir reißen alle Windkraftwerke nieder, nieder mit. diesen Windmühlen der Schande, da sagt sie alle Windräder und so steht es ja so steht's auch in ihrem Programm. sie wollen Windkraft zu vorwenden. wenn wir keinen einzigen Euro mehr an Subventionen ausgeben dann hat sich das sowieso erledigt. die Kernenergie ist unschlagbar billig, die Kohle verstrom ist unschlagbar billig. wer sollte preiswert des russisches Gas und Öl ist unschlagbar billig und das brauchen wir unbedingt für unsere Volkswirtschaft. okay damit was mal sortieren. sie wollen also die zum einen die Atomkraftwerke die jetzt stillgelegt sind wieder ans Netz nehmen. da sagt zum Beispiel selbst der Ehren BW kernkraftchefjork Michels das ist ähm unrealistisch das darauf lassen wir uns nicht mehr erinnern und der Politik ist es unrealistisch aber wir machen ne ganz andere Politik. okay und dann ist es wieder realistisch 1 Neubau würde mehr als 10 Jahre dauern. das ist auch wieder ne politische Sache. wenn wir das Deutschland Tempo ansetzen auch hier dann geht das viel viel schneller und Experten haben ja errechnet ist viel viel preiswerter. dann weiß ich nicht 23 Cent pro Kilowattstunde das is unschlagbar. wenn wir jetzt die Kernenergie wieder hochfahren würden also das wär ist ihr allprogramm was sie gerne machen würden wo? wobei wie gesagt die Betreiber selber das für unrealistisch halten aufgrund der Politik. dann sagen sie sie wollen wieder Gas importer Aus Russland damit finanzieren sie ja auch den Krieg in der Ukraine. wie stehen sie denn dazu, dass sie damit einem Aggressor der 1 anderes Land überfallen? hat, dass sie das jetzt finanzieren. wenn wir uns russischen preiswerten Lieferungen verweigern, dann schädigen wir nur uns, aber nicht die Russen. das haben wir doch schon gesehen. also die ganze sanktionspolitik zielt im Endeffekt darauf AB, dass Deutschland und Europa wirtschaftlich Schaden nimmt. und genau das wollen wir ja verhindern. und dieser Krieg in der Ukraine, das ist nicht unser krieg. also wir haben mit der Historie nichts zu tun und die Historie muss man betrachten. okay, also wir sollten uns da raushalten, ganz klar. und das hat eben nichts äh, mit unserer äh, Politik zu tun in Sachen Energie. die Energieversorgung müssen wir für die Unternehmen und die Haushalte preiswert halten und das wird jetzt gerade nicht gemacht. aber wie schaffen sie Planungssicherheit für die Wirtschaft? wir haben's ja eben gehört von Michael jüter, der hat gesagt, wenn man jetzt das auf einmal alles umbauen will und sagt, wir setzen jetzt wieder um, das ist gar keine Planungssicherheit für die Wirtschaft. wir haben jetzt äh, deindustrialisierung. wir haben in den letzten 6 Jahren gesehen, dass die industrieproduktion um 13 Prozent eingegangen ist, auch in der Automobilindustrie und der chemischen Industrie, das sind im Prinzip die Pfeiler unseres Wohlstandes, is n Rückgang um 15 oder 17 Prozent. das heißt, aufgrund der hohen Energiepreise, aufgrund des katastrophalen Ausstiegs Aus sowohl der Kernenergie und der Kohle haben wir diese Situation. also da reicht auch Planungssicherheit nicht mehr Aus, was hier gerade passiert. wir verlieren unseren Wohlstand, ja, und die. AfD, wenn sie Regierungsverantwortung übernehmen würden, die Energieversorgung, die wir jetzt haben, und den Stromversorgung, die wir haben, haben wir aufgrund dessen, dass wir die CO 2 äh, ausflüsse äh, niedrig halten wollen, weil wir Teil des Pariser Klimaschutzabkommen sind. wenn sie regierungsverantworten hätten, würden Deutschland dann aussteigen Aus dem Pariser Klimaschutzabkommen? na ja, was heißt aussteigen? wir würden das einfach nicht mehr machen. das ist ja nur ne Übereinkunft. und wir sagen dann, wir machen das nicht mehr, weil wir diesen Zusammenhang, diesen immer propagierten ganz engen Zusammenhang zwischen CO 2 ausstoßen und Temperatur irgendwie nich sehen. ja, es gibt ne Klimaerwärmung, aber da gibt's noch ganz andere Faktoren, die bisher kaum in rede stehen. und da müssen wir, da müsst die, da muss die Wissenschaft äh, ansetzen, aber nich alles auf CO 2 schieben. okay. also das heißt, sie würden, mit ihnen würde es sein, Klimaneutralität ist für sie kein Ziel äh, ich weiß nicht, was das ist. also wir können das Klima ja kaum beeinflussen. wir wissen, wir Kennen die Stellschrauben auch gar nicht, aber die CO 2 bepreisung, die tötet unsere Industrie und unseren Wohlstand, das muss allem klar sein. und CO 2 wird trotzdem dann in die Luft geblasen, dann nicht bei uns, aber eben in China. weil. okay, aber dann noch einmal ganz kurz zum Schluss, damit wir es klar haben, sie wären schon dafür, dass man jetzt bestehende Windkraftanlagen dann auch abreißt, oder nicht? das wird. das ist äh, ne Sache, das wird. sich. das wird sich überhaupt in anderen Dingen äh, dann zeigen, keinen einzigen Euro mehr. und dann stehen die Dinger auch still, weil Kernenergie unschlagbar preiswert ist. dann werden wir ganz genau sehen, Windräder, sind die wettbewerbsfähig oder nicht. und wir werden sehen, sie sind nicht wettbewerbsfähig, sagt Steffen kotre, energiepolitischer Sprecher der AfD. vielen Dank für das Gespräch. MH, bitte schön damit weiter mit euch in Köln.
"
