id,create_time,text,like_count,reply_count,parent_comment_id,video_id
7465506956230542102,2025-01-30 01:04:13,Tabubrucj sind die Linksgrünen,0,0,7465438656052972822,7465438656052972822
7465507275869340438,2025-01-30 01:04:49,Tschüß ihr Grünen,0,0,7465438656052972822,7465438656052972822
7465508950105539350,2025-01-30 01:11:20,Wieso rechtsextrem Was soll der Mist immer Abgesehen davon  ein gute Gesetz für Deutschland ,0,0,7465438656052972822,7465438656052972822
7465509238442836758,2025-01-30 01:12:09,"ihr hättet schon längst kämpfen sollen
Dass Mandat habt ihr gehabt Mein Vertrauen in euch ist damit beendet
Ich entscheide mich jetzt für eine Alternative ",0,0,7465438656052972822,7465438656052972822
7465509840954819330,2025-01-30 01:14:22,Gott sei Dank das schlimmste in einer Demokratie sind Menschen wie euch ,0,0,7465438656052972822,7465438656052972822
7465516847279244055,2025-01-30 01:41:50,Ich kann diesen Schwachsinn nicht mehr lesen nie wieder Drecks altparteien Wählt das richtige ,0,0,7465438656052972822,7465438656052972822
7465517286766887702,2025-01-30 01:44:24,Nur noch AFD ,0,0,7465438656052972822,7465438656052972822
7465520240157016865,2025-01-30 01:56:54,Die könnten nicht mal Kämpfen wen es um ihr Leben gehen würde,0,0,7465438656052972822,7465438656052972822
7465520606420681494,2025-01-30 01:58:36,Es ist ein Tabubruch für die Sicherheit der Bürger und Bürgerinnen zu stimmen Sehr interessant,0,0,7465438656052972822,7465438656052972822
7465521594019234582,2025-01-30 02:01:02,Richtig Wir werden gegen Euch Zecken Realitätsverweigerer und Mörderer noch härter kämpfen ,0,0,7465438656052972822,7465438656052972822
7465521855177261846,2025-01-30 02:01:39,Wie kann man sowas von sich geben nach alldem was hier gerade passiert Ich habe Enkelkinder und möchte das die sich sicher fühlen,0,0,7465438656052972822,7465438656052972822
7465523480927617814,2025-01-30 02:08:43,Hat rotgrün nicht im Anschluss einen Antrag der CDU mit Hilfe der AFD Stimmen abgelehnt War das keine Brandmauer,0,0,7465438656052972822,7465438656052972822
7465526302574134038,2025-01-30 02:19:29,,0,0,7465438656052972822,7465438656052972822
7465527029006402326,2025-01-30 02:21:30,Euer Gejammer bewirkt nur eins mehr Stimmen gegen Links,0,0,7465438656052972822,7465438656052972822
7465526363711292182,2025-01-30 02:22:03,,0,0,7465438656052972822,7465438656052972822
7465505731136783126,2025-01-30 00:58:49,Historischer Tabubruch Den mehrheitlich bürgerlichen Wählerwillen nicht mehr antidemokratisch auszuhebeln,0,0,7465438656052972822,7465438656052972822
7465532715790664470,2025-01-30 02:44:20,Alle die Merz hier verteidigen seine Vorschläge hätten nicht ein Attentat verhindert nicht ein einzigeser verstößt nur gegen das Grundgesetz und EU Recht umsetzen wird er es nie können ,0,0,7465438656052972822,7465438656052972822
7465534296981488406,2025-01-30 02:54:10,"Die linken sind links weil sie link sind
link auf englisch heißt sinister und bedeutet hinterhältig",0,0,7465438656052972822,7465438656052972822
7465535301990630166,2025-01-30 02:56:13,Sowas nennt man Demokratie Bürgerwille Du verstehen,0,0,7465438656052972822,7465438656052972822
7465538496603734806,2025-01-30 03:09:41,Sie interessieren sich nicht für Antisemitismus Denn wenn dieser von Menschen kommt welche nicht Deutsch sind ist es Ihnen egal Sie hassen sich und das eigene Land ,0,0,7465438656052972822,7465438656052972822
7465541572131668758,2025-01-30 03:21:39,Nach 1945 waren allen Deutschen Nazis und sind die und ihren Nachkommen immer noch Nazis,0,0,7465438656052972822,7465438656052972822
7465541879699555094,2025-01-30 03:21:49,Die arme Frau hat noch nicht verstanden was ihr Job ist und wenn doch dann ist sie nicht gut darin ,0,0,7465438656052972822,7465438656052972822
7465542829692437270,2025-01-30 03:24:49,die angeblichen Demokraten Vertragen Demokratie nicht,0,0,7465438656052972822,7465438656052972822
7465542360061264662,2025-01-30 03:25:46,meine Großeltern hatten recht,0,0,7465438656052972822,7465438656052972822
7465544835475374870,2025-01-30 03:31:47,Was hat das eine mit dem anderen zu tun,0,0,7465438656052972822,7465438656052972822
7465545095212172054,2025-01-30 03:34:12,Für UNS ist die CDU nicht mehr wählbar  ,0,0,7465438656052972822,7465438656052972822
7465543996111930145,2025-01-30 03:37:21,Alles richtig gemacht,0,0,7465438656052972822,7465438656052972822
7465545826846638870,2025-01-30 03:39:23,Immer wieder lustig wie Antidemokraten Demokratie predigen ,0,0,7465438656052972822,7465438656052972822
7465549054928290582,2025-01-30 03:47:22,Alles ist besser als ein weiterso,0,0,7465438656052972822,7465438656052972822
7465551127430988566,2025-01-30 03:57:01,Genau Jetzt heißt es kämpfen für die AFD Merz darf nicht Kanzler werden sondern Weidel,0,0,7465438656052972822,7465438656052972822
7465473966950712086,2025-01-29 22:52:46,was soll das Gejammer scholz war nur noch von Ideologie getrieben alle linken die Sache interessiert euch gar nicht mehr und dabei seid ihr schuld am entstehen dieser rechten Kraft,0,0,7465438656052972822,7465438656052972822
7465443240310866710,2025-01-29 20:53:18,Und ihres gleichen irgendwann Demokratie lernen ,0,0,7465438656052972822,7465438656052972822
7465447332516283158,2025-01-29 21:08:56,CDU und Tochter Partei hat die doch im Februar 2013 selber gegründet ,0,0,7465438656052972822,7465438656052972822
7465448325949948694,2025-01-29 21:12:53,Demo gegen Rechts in Aschaffenburg hat euch nicht gestört   Moral Anstand und so  Wie ekelhaft diese Doppelmoral ist ,0,0,7465438656052972822,7465438656052972822
7465448310339207958,2025-01-29 21:13:00,,0,5,7465438656052972822,7465438656052972822
7465448702095262486,2025-01-29 21:14:25,mimimimi,0,0,7465438656052972822,7465438656052972822
7465449155697328918,2025-01-29 21:16:23,Erbärmliche linksextremistische ,0,0,7465438656052972822,7465438656052972822
7465449274042532630,2025-01-29 21:16:29,Ich gebe Metz rechtund es war eine Wahlhättet ihr euch auch aufgeregt wenn es nix geworden wäre,0,0,7465438656052972822,7465438656052972822
7465449568693093142,2025-01-29 21:17:47,,0,0,7465438656052972822,7465438656052972822
7465449647033795350,2025-01-29 21:17:59,,0,0,7465438656052972822,7465438656052972822
7465451237153686294,2025-01-29 21:24:19,Ich freu mich  Dann wird Fr Weidel sicher Kanzlerin,0,0,7465438656052972822,7465438656052972822
7465451838512644886,2025-01-29 21:26:50,Der roten Pest wird ein Ende gesetztihr habt lange genug gehetzt,0,0,7465438656052972822,7465438656052972822
7465461517694321430,2025-01-29 22:04:10,Die SPD in ihrer selbstherrlichen Art hat die Pfade der Demokratie schon lange verlassen Das Volk ist denen egal Demokratie ist nur die SPD Meinung  alle Anderen liegen falsch einfach furchtbar,0,0,7465438656052972822,7465438656052972822
7465461527543743254,2025-01-29 22:04:42,Wenn es soll nicht Merz werden dann wer Scholz Niemals RotBlut,0,0,7465438656052972822,7465438656052972822
7465462065210065686,2025-01-29 22:06:15,wird angewählt,0,0,7465438656052972822,7465438656052972822
7465467949853213462,2025-01-29 22:29:35,Geilomat Na endlich,0,0,7465438656052972822,7465438656052972822
7465550985718465302,2025-01-30 03:57:07,Weil es mal nicht um die interessen der Grünen geht spielen alle verrückt,0,0,7465438656052972822,7465438656052972822
7465476887273538326,2025-01-29 23:04:50,habeck Ich wusste mit Deutschland noch nie etwas anzufangen und weiß es bis heute nicht,0,0,7465438656052972822,7465438656052972822
7465479385215910678,2025-01-29 23:14:11,Die SPD braucht keiner mehr mit ihrem schlechtesten Kanzler aller Zeiten ,0,0,7465438656052972822,7465438656052972822
7465482946045641494,2025-01-29 23:28:11,Stimmt nicht durch ihre Ablehnung haben GrüneSPD der AfD zugearbeitet,0,0,7465438656052972822,7465438656052972822
7465487237334287126,2025-01-29 23:44:57,"Merz hat Deutschland einen historischen Dienst erwiesen
Der CDU ist es zu verdanken das die AFD unter 50 bleibt Was Rot Grün betreibt ist Wahlkampfhilfe für die AFD",0,0,7465438656052972822,7465438656052972822
7465488251806024470,2025-01-29 23:48:37,,0,0,7465438656052972822,7465438656052972822
7465489820216558358,2025-01-29 23:55:31,Was ist das jetzt wieder für Eine,0,0,7465438656052972822,7465438656052972822
7465491233612399382,2025-01-30 00:00:24,Deutschland hat einen neuen Feiertag,0,1,7465438656052972822,7465438656052972822
7465498450507989782,2025-01-30 00:28:55,Hauptsache Feindbilder und eigene Ideologie als reine Wahrheit verkaufen Schade SPD ,0,0,7465438656052972822,7465438656052972822
7465501634144289558,2025-01-30 00:41:41,Stimmt Weidel muss Kanzler werden,0,0,7465438656052972822,7465438656052972822
7465502149072339734,2025-01-30 00:44:55,Ja Jetzt heißt es kämpfen gegen das linke Geschwurbel der SPD Gib dem Olaf keine Chance Der vergessliche Olaf gehört in die Versenkung der Geschichte,0,0,7465438656052972822,7465438656052972822
7465503418284966678,2025-01-30 00:50:17, wovor habt ihr solche Angst was habt ihr erwartet das ihr das Spiel weiter treiben könnt das Volk wird es bei der Wahl zeigen das jetzt Schluss ist und sie vor allen gehen,0,0,7465438656052972822,7465438656052972822
7465503964945220374,2025-01-30 00:52:06,Ich denke die meisten Wähler sehen das alles viel gelassener als diese Politprofis Wir wollen dass die Zuwanderungsprobleme endlich gelöst werden Und auf diesem Ohr sind SPDFunktionäre taub,0,0,7465438656052972822,7465438656052972822
7465504840530248470,2025-01-30 00:53:55,Kämpfen der war gut ,0,0,7465438656052972822,7465438656052972822
7465505128864809730,2025-01-30 00:55:54,Ihr hättet doch auch dafür stimmen können aber neinihr habt die Interessen des Volkes nicht nicht im KopfIhr seid einfach Verräter,0,0,7465438656052972822,7465438656052972822
7465573040660366102,2025-01-30 05:19:00,Und wie hieß es davor,0,0,7465438656052972822,7465438656052972822
7465566651167507222,2025-01-30 04:56:15,,0,0,7465438656052972822,7465438656052972822
7465567394296644374,2025-01-30 04:57:39,Ist es wirklich so schlimm für euch illegale Schwerverbrecher aus dem Land zu schmeißen ,0,0,7465438656052972822,7465438656052972822
7465567293676028694,2025-01-30 04:58:32,Ihr habt bereits verloren,0,0,7465438656052972822,7465438656052972822
7465567856126706454,2025-01-30 04:58:44,Genau so reden rotgrüne Verbrecher Ein Tibu ist es dem Wählerwillen folge zu leisten,0,0,7465438656052972822,7465438656052972822
7465567961601311510,2025-01-30 04:59:46,Niemand wird dir verbieten dass du privat und von deinem Geld Flüchtlinge bei dir zu Hause aufnimmst Dann hätten wir auch eine Brandmauer bei der Finanzierung der Flüchtlingskosten Das wäre gerecht,0,0,7465438656052972822,7465438656052972822
7465567954639323926,2025-01-30 05:00:36,Kämpfen für was Noch mehr Tote  Den Bürgern reicht es langsam mit der Kriminalität,0,0,7465438656052972822,7465438656052972822
7465568141210370838,2025-01-30 05:01:20,Sie sollten an der Stelle des kleinen Jungen aus Aschaffenburg stehenSie ,0,0,7465438656052972822,7465438656052972822
7465569338339951362,2025-01-30 05:04:48,Woran liegt es dass ich die Leute von der AFD sympathischer finde als die vin der SPD,0,0,7465438656052972822,7465438656052972822
7465569617042719510,2025-01-30 05:06:00,Wie krank ist das,0,0,7465438656052972822,7465438656052972822
7465569843300582166,2025-01-30 05:07:21,Wieder eine linke terrorzelle,0,0,7465438656052972822,7465438656052972822
7465570298591953686,2025-01-30 05:08:24,schaut in das gesicht sagt schon alles,0,0,7465438656052972822,7465438656052972822
7465570775690068758,2025-01-30 05:10:20,Ihr braucht nicht mehr kämpfen Akzeptiert das ihr verloren habt,0,0,7465438656052972822,7465438656052972822
7465570683038302998,2025-01-30 05:10:21,,0,0,7465438656052972822,7465438656052972822
7465570633555182359,2025-01-30 05:10:31,Alice wird Kanzlerin ,0,0,7465438656052972822,7465438656052972822
7465572399460811542,2025-01-30 05:17:07,,0,0,7465438656052972822,7465438656052972822
7465567179786748694,2025-01-30 04:56:12,Diese Frau hat von demokratie keine Ahnung,0,0,7465438656052972822,7465438656052972822
7465573031575683862,2025-01-30 05:19:08,Die Verweigerungshaltung von SPD und Grünen haben zu diesem Ergebnis geführt Ich frage mich mittlerweile manchmal wirklich wer hier das falsche Demokratieverständnis hat und NEIN kein AfDler,0,0,7465438656052972822,7465438656052972822
7465573239521559318,2025-01-30 05:20:30,Die schwarze grüne und rote  muss weg Es bleibt nur  ONLY AFD  als Rettung und alternative für Deutschland und die deutschen,0,0,7465438656052972822,7465438656052972822
7465573503027806998,2025-01-30 05:20:34,es tut mir leidweil ich bin nicht zufrieden Ampelich selber blöd teuer geworden und Ausland muss abschiebenweil viel schlimm Ausland stimmt Beweis,0,1,7465438656052972822,7465438656052972822
7465573720610833174,2025-01-30 05:20:42,,0,0,7465438656052972822,7465438656052972822
7465573643041915670,2025-01-30 05:21:13,ist das das wichtigste dass man nicht mit rechtsextremen zusammenarbeitet Frau Heubach es geht um die Menschen in diesem Land und nicht um Machtspiele,0,0,7465438656052972822,7465438656052972822
7465574081211958018,2025-01-30 05:22:07,Niemals mehr SPD Zu weit nach links abgerückt Grüne Machtpolitik abgeschrieben,0,0,7465438656052972822,7465438656052972822
7465574701978469142,2025-01-30 05:25:34,Korrekt er darf nicht Kanzlerin werden Sondern Weidel ,0,0,7465438656052972822,7465438656052972822
7465575612070560534,2025-01-30 05:28:23,Verblendet,0,0,7465438656052972822,7465438656052972822
7465575772516172566,2025-01-30 05:29:54,Habt ihr auch den opfern der letzten Monate gedacht Deren Blut SPD linke und Grüne an den Händen habt,0,0,7465438656052972822,7465438656052972822
7465576437731607318,2025-01-30 05:31:24,Ich finde richtig und Schutz für Menschen  SPD sind immer schlechter geworden,0,0,7465438656052972822,7465438656052972822
7465576540995568406,2025-01-30 05:31:47,Ach jetzt heißt es kämpfen Und die Jahre davor Game over SPD ,0,0,7465438656052972822,7465438656052972822
7465576717324878614,2025-01-30 05:33:10,Dann wird es die Weidel Definitive jemand der Änderung will und diese durchsetzt,0,0,7465438656052972822,7465438656052972822
7465576995091907351,2025-01-30 05:33:29,Nennt man Demokratie Babe Demokratie,0,0,7465438656052972822,7465438656052972822
7465577084163031830,2025-01-30 05:34:47,Was für ideologischen Geschwätz  Es ist Aufgabe der Politik verschiedene Meinungen zum Wohl des Volkes unter einen Hut zu bringen und nicht Spaltung durch Brandmauern zu betreiben ,0,0,7465438656052972822,7465438656052972822
7465561217072038678,2025-01-30 04:33:58,Demokratie lebt wieder,0,0,7465438656052972822,7465438656052972822
7465552786521899798,2025-01-30 04:03:55,Ich finde es sehr gut endlich ist die Macht der SPDGRÜNEN weg und schon geht das Geheule los ,0,0,7465438656052972822,7465438656052972822
7465555217170481942,2025-01-30 04:11:08,,0,0,7465438656052972822,7465438656052972822
7465554567295402775,2025-01-30 04:11:57,Na dann überlege mal warum euch die Wähler weglaufen und bald auch die Mitglieder ,0,0,7465438656052972822,7465438656052972822
7465555652318151446,2025-01-30 04:15:17,Tabubruch ihr habt versprochen und das Volk belogen sowie nichts gemacht Es musste ja irgendwann so kommen,0,0,7465438656052972822,7465438656052972822
7465556942799487766,2025-01-30 04:17:47,Was ist mit euch los in der Politik gibt es kein Tabu Schon gar nicht wenn es um Entscheidungen geht Das Parlament wurde demokratisch gewählt ihr habt kein Recht auf Ausgrenzung,0,0,7465438656052972822,7465438656052972822
7465557036435145495,2025-01-30 04:20:22,Merz hat absolut richtig gehandelt,0,0,7465438656052972822,7465438656052972822
7465557251194962710,2025-01-30 04:20:46,Demokratie sagt man dazu nicht Tabubruch,0,0,7465438656052972822,7465438656052972822
7465557861973099286,2025-01-30 04:21:54,Nur die eigene Meinung und Politik zählt Klingt ja fast wie Rot Grüne Diktatur,0,0,7465438656052972822,7465438656052972822
7465558170237944598,2025-01-30 04:23:32,Wo ist die Demokratie für die sie immer so gerne Kämpfen,0,0,7465438656052972822,7465438656052972822
7465558871357571862,2025-01-30 04:25:53,Schade das ihr nicht bereit wart die Mehrheitsmeinung des Volkes zu unterstützen Dann wäre dies nicht möglich gewesen Cum ex wollte auch keiner aber Olaf hatte bock,0,0,7465438656052972822,7465438656052972822
7465559228343288598,2025-01-30 04:27:02,Du findest es okay wenn täglich zusätzlich mal Menschen abgestochen werden Die nichts in Deutschland zu suchen haben die schwer kriminelle sind  Der Staat hat die Aufgabe das Volk zu schützen,0,0,7465438656052972822,7465438656052972822
7465559486603264770,2025-01-30 04:27:22,,0,0,7465438656052972822,7465438656052972822
7465560369772741398,2025-01-30 04:31:35,Endlich sieht dank cdu die Demokratie,0,0,7465438656052972822,7465438656052972822
7465561040282665750,2025-01-30 04:33:47,Warum ich nicht SPD wähle Weil ich nicht möchte dass unsere Kinder in Parks und auf Weihnachtsmärkten abgestochen werden,0,0,7465438656052972822,7465438656052972822
7465605159046529814,2025-01-30 07:22:16,Ich bin den Tränen nahe Aber nicht weil ich traurig bin,0,0,7465438656052972822,7465438656052972822
7465561626457326358,2025-01-30 04:36:00,Zieht ihr eure Anträge zurück wenn die AfD zustimmt,0,0,7465438656052972822,7465438656052972822
7465562084624925463,2025-01-30 04:40:00,Ab heute Opposition ,0,0,7465438656052972822,7465438656052972822
7465562478497366806,2025-01-30 04:40:04,StimmtMerz darf nicht Kanzler werden Aber als Vizekanzler hinter Alice Weidel und mit Björn Höcke als Bundespräsidenten  denke das wäre mal ne Konstellation voller Tatendrang sehr gut,0,0,7465438656052972822,7465438656052972822
7465562725130568470,2025-01-30 04:40:53,Das war die beste Entscheidung im Bundestag die passiert ist seit langem danke der AFD das sie zugestimmt hat,0,0,7465438656052972822,7465438656052972822
7465563321828180758,2025-01-30 04:41:32,Mimimimi ,0,0,7465438656052972822,7465438656052972822
7465562960884400918,2025-01-30 04:42:18,Es dürfen also nur noch Gesetze eingebracht werden bei denen sicher ist das die AfD dagegen ist,0,0,7465438656052972822,7465438656052972822
7465564409810256662,2025-01-30 04:46:21,,0,0,7465438656052972822,7465438656052972822
7465564273873306390,2025-01-30 04:47:01,Genau immer schön weiter hetzen und damit genau das Gegenteil bewirken,0,0,7465438656052972822,7465438656052972822
7465565090000306967,2025-01-30 04:48:19,Man muss auch wieder stolz sein dürfen Deutsch zu seinman ist dann nicht rechts,0,0,7465438656052972822,7465438656052972822
7465565356062098198,2025-01-30 04:50:12,Na da verliert jemand die Macht und jetzt wollen sie alles niederbrennen,0,0,7465438656052972822,7465438656052972822
7465565606395331350,2025-01-30 04:52:01,,0,0,7465438656052972822,7465438656052972822
7465566267174535958,2025-01-30 04:54:26,Weg mit dem linken Dreck,0,0,7465438656052972822,7465438656052972822
7465566763845976854,2025-01-30 04:54:27,Endlich ist es soweit,0,0,7465438656052972822,7465438656052972822
7465567104654148374,2025-01-30 04:55:38,Warum wird nirgendwo erwähnt das die blos das Volk schützen wollen ist das rassistisch ist es rechts die Bürger des Landes zu schützen,0,0,7465438656052972822,7465438656052972822
7465643904703447830,2025-01-30 09:52:43,Tabubruch Das war das beste was passieren konnte,0,0,7465438656052972822,7465438656052972822
7465640872699069206,2025-01-30 09:41:00,Radikale Ideologen die keine andere Meinungen akzeptieren und somit ausgrenzen nennt man wie Faschisten Und genau das sind SPDGRÜNE inzwischen Ja kenne die Definition,0,0,7465438656052972822,7465438656052972822
7465641103191360278,2025-01-30 09:41:33,Hört auf zu hetzen Mir reicht eure Politik schon lange Ich finde es richtig von der CDU daß wenigstens versucht wird zu handeln Ich will wieder ein Vaterland auf das ich stolz sein kann,0,0,7465438656052972822,7465438656052972822
7465641231982871318,2025-01-30 09:41:49,Ihr seid gegen die Demokratie Wieviele Menschen müssen noch sterben  Deutschland ist einfach nur noch lächerlich geworden erst recht seit der Ampel Koalition,0,0,7465438656052972822,7465438656052972822
7465641100784878358,2025-01-30 09:42:10,Endlich werden demokratische Mehrheiten gesucht Die Fraktionsübergreifende Verhinderungstaktik will die Mehrheit im Land nicht mehr Augen auf und mal drüber nachdenken,0,0,7465438656052972822,7465438656052972822
7465641276340978454,2025-01-30 09:42:23,Brandmauer muss weg Das ist Demokratie,0,0,7465438656052972822,7465438656052972822
7465641633578795798,2025-01-30 09:44:15,Ja wer hat denn 1933 den Tabubruch begangen und AH in den Sattel geholfen Die rote SPD ,0,0,7465438656052972822,7465438656052972822
7465642099052905238,2025-01-30 09:45:09,Bisher ist doch nicht einmal nachgewiesen das die AFD Rechtsextrem ist Legen Sie die Daten erst einmal offen,0,0,7465438656052972822,7465438656052972822
7465642404185113366,2025-01-30 09:46:45,Bitte nicht immer wieder die NSZeit verharmlosen Es war schrecklich und absolut nicht mit heute zu vergleichen,0,0,7465438656052972822,7465438656052972822
7465642592794002198,2025-01-30 09:47:07,linksnazi,0,0,7465438656052972822,7465438656052972822
7465642699790942998,2025-01-30 09:47:38,Die Brandmauerist ein zutiefst totalitärer und undemokratischer Vorgang,0,0,7465438656052972822,7465438656052972822
7465643125047067414,2025-01-30 09:49:19,AfD CDU und FDP sind die Mittel zusammengerechnet sind es mehr Wähler ,0,0,7465438656052972822,7465438656052972822
7465643352727094038,2025-01-30 09:50:24,Es ist eine Schande nicht den Bürger Willen zu folgen Mir ist die Brandmauer egal Ich wünsche eine absolute Änderung in der Migrationspolitik Ich fühle mich nicht mehr wohl im eigenen Land,0,2,7465438656052972822,7465438656052972822
7465643351226123030,2025-01-30 09:50:51,Heulbach,0,0,7465438656052972822,7465438656052972822
7465643584726876950,2025-01-30 09:51:31,Geschichte,0,0,7465438656052972822,7465438656052972822
7465643669537129239,2025-01-30 09:52:00,,0,0,7465438656052972822,7465438656052972822
7465640743002276630,2025-01-30 09:40:41,Es war ein hervorragender Tag für Deutschland ,0,0,7465438656052972822,7465438656052972822
7465644240488940310,2025-01-30 09:53:48,"Wenn man das Statement nicht versteht sollte man sich auch nicht äußern
Merz hat versucht die Zustimmung von SPD GRÜNEN usw zu erpressen und hat hierzu die AfD mit ins Boot genommen",0,0,7465438656052972822,7465438656052972822
7465644609214939926,2025-01-30 09:54:57,Ja war ja schon sehr lange sehr überfällig ,0,0,7465438656052972822,7465438656052972822
7465644836113974038,2025-01-30 09:56:14,Genau der richtige Mann,0,0,7465438656052972822,7465438656052972822
7465645013117158166,2025-01-30 09:56:30,Was ist eure Antwort auf Aschaffenburg,0,0,7465438656052972822,7465438656052972822
7465645018154402582,2025-01-30 09:56:32,Die Mehrheit der Bevölkerung interessiert die doch nicht  nur ihre Meinung zählt  Demokratie Fehlanzeige,0,0,7465438656052972822,7465438656052972822
7465645129903260438,2025-01-30 09:57:01,die roten schnaupen vor wut wie ein stier in der arena alles richtig gemacht ,0,0,7465438656052972822,7465438656052972822
7465645150749213462,2025-01-30 09:57:16,War das einzig richtige was passiert ist Die Sicherheit des Volkes steht auf dem Spiel und die Altparteien waren nicht in der Lage diese zu gewährleisten,0,0,7465438656052972822,7465438656052972822
7465645127253852950,2025-01-30 09:57:43,Die SPD und Scholz haben sich klar dafür entschieden nichts gegen das Abstechen der Bevölkerung durch kriminelle Asylanten Clans etc zu unternehmen  Die SPD ist unwählbar ,0,0,7465438656052972822,7465438656052972822
7465645614525940502,2025-01-30 09:59:03,Vor jeder Wahl beschäftigt mich nur eine Frage Warum immer erst kurz davor kämpfen Wirksamkeit zeigt sich in Taten nicht durch Wahlkampf,0,0,7465438656052972822,7465438656052972822
7465645665289470742,2025-01-30 09:59:05,Hier wird ein antidemokratisches Weltbild propagiert,0,0,7465438656052972822,7465438656052972822
7465646918350258966,2025-01-30 10:03:55,Ein demokratischer Abstimmungsverfahren hat nichts mit Nazis zu tun,0,0,7465438656052972822,7465438656052972822
7465646859269882646,2025-01-30 10:03:55,,0,0,7465438656052972822,7465438656052972822
7465646793058943766,2025-01-30 10:03:55,"An der Ostfront werden Kämpfer gesucht
",0,0,7465438656052972822,7465438656052972822
7465646868771210007,2025-01-30 10:04:10,Tabu sollte in einer Demokratie eine Brandmauer sein Die ist nur ein Zeichen der Unfähigkeit zu überzeugen bei den Wählern und zu punkten im Diskurs,0,0,7465438656052972822,7465438656052972822
7465636637914596118,2025-01-30 09:24:22,Nennt man Demokratie nicht ganz verstanden,0,0,7465438656052972822,7465438656052972822
7465632676841194242,2025-01-30 09:09:19,Den letzten Satz würde ich mittragen Dieser Mann darf nicht Kanzler werden,0,0,7465438656052972822,7465438656052972822
7465632822855074582,2025-01-30 09:09:29,,0,0,7465438656052972822,7465438656052972822
7465633366894428950,2025-01-30 09:11:38,Gegen wen willst du denn kämpfen Gegen die Mehrheit des Volkes Ich habe die DDR überlebt und ich möchte mit euch linken Pa nichts mehr zu tun habenUnd genau so geht es der Mehrheit dieses Volkes,0,0,7465438656052972822,7465438656052972822
7465633752561402646,2025-01-30 09:13:41,Es hat nichts mit Tabubruch zu tun sondern den Wählerwillen demokratisch zu akzeptieren und nur dies zählt in einer Demikratie was Deutschland nicht mehr ist,0,0,7465438656052972822,7465438656052972822
7465633999935947542,2025-01-30 09:13:51,Ich weiß gar nicht wie traurig ich schauen soll ,0,0,7465438656052972822,7465438656052972822
7465633885902258966,2025-01-30 09:14:01,Diese Babbel immer Es wurde demokratisch abgestimmt und fertig Diese Wahnsinn muss auch mal aufhören Und der Anfang wurde damit gemacht,0,0,7465438656052972822,7465438656052972822
