id,create_time,text,like_count,reply_count,parent_comment_id,video_id
7457991843842704150,2025-01-09 18:57:32,Sindy Bauer Männel  florentine_rhl schaut den haben wir heute gesehen,3,0,7457964665100848406,7457964665100848406
7457988971038180118,2025-01-09 18:46:23,Selbst Bürgergeld ist höher als die Rente Mindestlöhne nützen gar nichts bei den steigenden Sozialabgaben und Steuern Bürokratie wurde gar nicht abgebaut ist noch mehr als vorher,3,0,7457964665100848406,7457964665100848406
7457968415019402006,2025-01-09 17:26:43,Die spd macht Politik für niemanden  Nur Sprüche kloppen mehr nicht  egal was sie sich vornehmen nix klappt,2,1,7457964665100848406,7457964665100848406
7457966101298807574,2025-01-09 17:17:46,Nein die SPD hat Politik gegen Rentner gemacht oder wo kommt die Altersarmut her War die Böse CDU alleine oder,2,0,7457964665100848406,7457964665100848406
7458205532437578518,2025-01-10 08:48:21,Ich schätze eure Arbeit sehr,1,0,7457964665100848406,7457964665100848406
7457989698553021206,2025-01-09 18:49:14,Für Arbeitgeber wird noch teurer oder warum erklären Sie die Stellenstreichungen Werden Firmen noch mehr belastet dann wandern die Firmen ab und noch Strafen mit Wegzugssteuern  Unternehmerfeindlic,1,0,7457964665100848406,7457964665100848406
7457988828029174550,2025-01-09 18:45:50,Umgekehrt SPD regiert gegen die Renter,1,0,7457964665100848406,7457964665100848406
7457987846243959574,2025-01-09 18:42:05,Märchenstunde ,1,0,7457964665100848406,7457964665100848406
7457980345771295510,2025-01-09 18:12:58,Das bin ja ich,1,1,7457964665100848406,7457964665100848406
7457967194335200022,2025-01-09 17:22:01,Ja das stimmt nicht mit nur Politik für Remtner Die SPD macht Nur Politik für sich selbst für ihre Diäten und für sonstige Einnahmen Denkt dran wer hat euch verraten aSozialdemokraten die Abzocker,1,1,7457964665100848406,7457964665100848406
7458009369197232918,2025-01-09 20:05:35,für Rentner  Für Kinder Für Arbeitnehmer ,0,1,7457964665100848406,7457964665100848406
7458003268225778454,2025-01-09 19:41:55,SPD ist unwälbar,0,1,7457964665100848406,7457964665100848406
7457995802768245506,2025-01-09 19:12:58,Lügenpartei,0,0,7457964665100848406,7457964665100848406
7457992958118937366,2025-01-09 19:01:54,die SPD kann man nicht mehr wählen,0,2,7457964665100848406,7457964665100848406
7457626446275412758,2025-01-08 19:19:40,niemals alt Parteien,9,0,7457599380011355414,7457599380011355414
7457601232351527702,2025-01-08 17:41:54,Man siehts denen an,3,0,7457599380011355414,7457599380011355414
7458177738077225750,2025-01-10 07:00:44,Keine Altparteien mehr,1,0,7457599380011355414,7457599380011355414
7458031615581094678,2025-01-09 21:32:03,Ich mag die spd weil die sind nicht rasestisch ganz tolle Menschen ,1,0,7457599380011355414,7457599380011355414
7457628504572101399,2025-01-08 19:27:40,Niemals,1,0,7457599380011355414,7457599380011355414
7457628136462320406,2025-01-08 19:26:13,Ihr müsst demnächst stempeln gehen,1,0,7457599380011355414,7457599380011355414
7458170071970956054,2025-01-10 06:30:15,,0,0,7457599380011355414,7457599380011355414
7457788627914687254,2025-01-09 05:49:35,Ihr habt genug kaputt gemacht,0,1,7457599380011355414,7457599380011355414
7457651136922845974,2025-01-08 20:55:32,Seit Jahrzehnten mit  das gleiche alles nur WahlpropagandaDirekt nach der Wahl ist sofort wieder alles vergessen und es gibt neue Steuererhöhungen und weitere Verbote für das eigene Volk ,0,1,7457599380011355414,7457599380011355414
7457643030859547415,2025-01-08 20:24:00,Ich wähle keine Altparteien mehr ihr habt uns Jahrzehnte nur belogen und betrogen,0,0,7457599380011355414,7457599380011355414
7457640640911442710,2025-01-08 20:14:45,Scholz Antwort auf die böllerverbotsdebatte hat mit den Rest gegeben Man merkt direkt wie weit weg er von der Realität ist Mit gefällt das Wahlprogramm total aber dieser Typ geht null als Kanzler,0,0,7457599380011355414,7457599380011355414
7457640157626336022,2025-01-08 20:12:48,Wieder Steuergelder verbrennen ,0,0,7457599380011355414,7457599380011355414
7457636201849684758,2025-01-08 19:57:34,niemals SPD,0,0,7457599380011355414,7457599380011355414
7457634707179897622,2025-01-08 19:51:46,,0,0,7457599380011355414,7457599380011355414
7457632325871616790,2025-01-08 19:42:30,ihr traut euch,0,0,7457599380011355414,7457599380011355414
7457631987890340630,2025-01-08 19:41:11,ich macht alle so nett es ist immer das gleiche Spiel mich blendet ihr nicht was ist den zum Beispiel bei euch noch sozial,0,1,7457599380011355414,7457599380011355414
7457630230783050518,2025-01-08 19:34:19,Werdet lauter   ,0,0,7457599380011355414,7457599380011355414
7457627383342088982,2025-01-08 19:23:21,Die SPD hat in Leipzig nichts erreicht Leipzig ist versifft und dreckig Aber die roten Bonzen im Rathaus juckt das nichtschauen Sie sich nur die Stadtteile an,0,2,7457599380011355414,7457599380011355414
7457625753960039190,2025-01-08 19:17:04,Nein nie wider SPD ,0,1,7457599380011355414,7457599380011355414
7457624804147053334,2025-01-08 19:13:22,Brechwürg,0,0,7457599380011355414,7457599380011355414
7457624572071330582,2025-01-08 19:12:22,,0,0,7457599380011355414,7457599380011355414
7457618701350404886,2025-01-08 18:49:37,Die Handlanger der GrünenSekte Nein danke,0,1,7457599380011355414,7457599380011355414
7461621749332722454,2025-01-19 13:44:08,Selenskyj hat Boucha selbst organisiert da worden Oppositionelle ermordet wie 2014 Maidan,6,0,7461603882112683266,7461603882112683266
7461632906873455382,2025-01-19 14:27:26,,3,0,7461603882112683266,7461603882112683266
7461647265695073046,2025-01-19 15:22:59,stimmt zum Teil  jedoch wird nicht erwähnt was wir vorher gemacht haben also nicht alles glauben was hier verbreitet wird,2,3,7461603882112683266,7461603882112683266
7461637905607279382,2025-01-19 14:46:54,niemals,2,2,7461603882112683266,7461603882112683266
7461648497156293398,2025-01-19 15:28:04,Dem muss ich wiedersprechen Die Russen haben die UA nicht angegriffen Die dort lebenden Naz haben ihre eigenen Leute gequält vgl z B den Brand in Odessa am 02052014,1,0,7461603882112683266,7461603882112683266
7461645619657753366,2025-01-19 15:16:42,ihr koennt nichtg gegen putin gewinnen niemals er macht uns pleite,1,1,7461603882112683266,7461603882112683266
7461645454137557782,2025-01-19 15:15:58,Durch die Waffen Lieferung gibt es aber immer mehr Tote egal auf welche Seite Wie wäre es den mal mit diplomatischen Lösungen als immer mehr Waffen liefern,1,1,7461603882112683266,7461603882112683266
7461644821016855318,2025-01-19 15:13:56,immer schön weiterlügen,1,0,7461603882112683266,7461603882112683266
7461643746771190550,2025-01-19 15:09:32,alles nur unbestätigte Behauptungen,1,0,7461603882112683266,7461603882112683266
7461633760922665750,2025-01-19 14:30:29,Wir möchten dass die SPDwieder zusammen mit den Grünen und den Linken regiert ,1,0,7461603882112683266,7461603882112683266
7461622317316096790,2025-01-19 13:46:01,Genau so und nicht anders Ihr macht alles richtig,1,4,7461603882112683266,7461603882112683266
7461608998321062678,2025-01-19 12:54:32,Genauso Sag ich auch immer,1,0,7461603882112683266,7461603882112683266
7461692851865355030,2025-01-19 18:19:38,stimmt wieder nur die Hälfte ,0,0,7461603882112683266,7461603882112683266
7461652427258397462,2025-01-19 15:43:16,Lügen Waffen bringen keinen Frieden Ukraine braucht Frieden und keine Waffen und die kämpft nicht für uns lüge es begann alles 2024 ,0,2,7461603882112683266,7461603882112683266
7461641955107635990,2025-01-19 15:02:45,,0,0,7461603882112683266,7461603882112683266
7460543399482835717,2025-01-16 15:59:12,Messi,1,0,7460542041924160790,7460542041924160790
7460190754133951254,2025-01-15 17:11:11,Meine Stimme habt ihr eh,3,0,7460189010313383190,7460189010313383190
7460204698555286295,2025-01-15 18:05:10,"Was hat Olaf als Finanzminister gesagt die neue Grundsteuer wird für keinen teurer
Und nun zahle ich fast das doppelte Wer einmal lügt dem glaubt man nicht Zum Glück gibt es eine Alternative",2,0,7460189010313383190,7460189010313383190
7460222391604921110,2025-01-15 19:13:37,Ihr habt alleine im Pflegesystem unglaublich viel gemacht danke,1,1,7460189010313383190,7460189010313383190
7460205672505099030,2025-01-15 18:08:47, Kindergelderhöhung Rente von der man leben kann echt,1,1,7460189010313383190,7460189010313383190
7460204770445706006,2025-01-15 18:05:43,Was bringt es wenn alles erhöht wird und es von den Steuern wieder verschlungen wird Der kleine Arbeitgeber kann das nicht stemmen Woher soll er das Geld nehmen Von dem Kunden der auch nichts hat,1,1,7460189010313383190,7460189010313383190
7462738746322174742,2025-01-22 13:58:54,Ihr habt so garnichts auf die Reihe bekommen all die jahre man kann sich das aber schön reden Zahltag ist am Wahltag ,0,1,7460189010313383190,7460189010313383190
7460292953862750998,2025-01-15 23:50:12,Mehr Gerechtigkeit Anhebung der Sozialabgaben Ihr habt in den letzten 26 Jahren 22 Jahre regiert mitregiert und das Fazit Den Meisten im Land geht es schlechter Danke für den Abstieg,0,1,7460189010313383190,7460189010313383190
7460256181236728598,2025-01-15 21:24:53,Das Versprechen die roten seit Jahren ,0,2,7460189010313383190,7460189010313383190
7460226424110564118,2025-01-15 19:29:40,Ihr verteilt unser Geld in die ganze Welt,0,1,7460189010313383190,7460189010313383190
7460219465126265622,2025-01-15 19:02:29,SPD steht für Ukraine und Israel und Syrien nicht für Deutschland Scholz hat Deutschland ruiniert unwählbar,0,0,7460189010313383190,7460189010313383190
7460207208841003798,2025-01-15 18:14:44,Wir haben die Schnauze voll von euren leeren Versprechen ihr habt uns in den Abgrund gewirtschaftet ,0,1,7460189010313383190,7460189010313383190
7460196898856076054,2025-01-15 17:34:52, 40 Jahre in Regierungsverantwortung  Niemand mag Wahloh sorry wir haben uns versprochen,0,3,7460189010313383190,7460189010313383190
7459753854671258390,2025-01-14 12:55:19,,1,0,7459419744932728086,7459419744932728086
7459118515090916118,2025-01-12 19:49:43,Das ist wohl ein Witz nach drei Jahren Desaster,11,1,7459115623688195350,7459115623688195350
7459118429086925590,2025-01-12 19:49:25,SPD war jetzt in der Regierung und hat Deutschland an die Wand gefahren Jetzt soll es besser werden noch einmal die SPD Niemals,7,1,7459115623688195350,7459115623688195350
7459117195869455126,2025-01-12 19:44:39,Den Hass tragen Sie und Ihre Anhänger auch die finanzierte Antifa täglich in die Öffentlichkeit,7,1,7459115623688195350,7459115623688195350
7459127557591581462,2025-01-12 20:24:53,bei mir ist es umgekehrt komisch,4,0,7459115623688195350,7459115623688195350
7459117164176982806,2025-01-12 19:44:30, Volksverräter ,4,0,7459115623688195350,7459115623688195350
7459141614856045334,2025-01-12 21:19:31,Und das aus deren Münder die viele Jahre nur mist gebaut haben,3,1,7459115623688195350,7459115623688195350
7459155995554497302,2025-01-12 22:15:11,Die SPD hat uns Bürger verraten u verkauft  niemals wieder ist jetzt ,2,2,7459115623688195350,7459115623688195350
7459165135381070614,2025-01-12 22:51:07,Och nö  Danke aber drei Jahre Olaf als Chancellor of Germany sind genug,0,0,7459115623688195350,7459115623688195350
7459160918784312087,2025-01-12 22:34:32,Der hat TOMATEN auf den Augen,0,0,7459115623688195350,7459115623688195350
7459025154161967894,2025-01-12 13:47:27,"Waaas das sind man wie Diplomatie man in der Ukraine macht
Es wurde gesagt das keine Waffen geliefert werden
Ihr Betrügt das Volk ihr lügt
Niemals SPD niemals CDU und nie wieder die Grünen",4,15,7459023047488507158,7459023047488507158
7459065571573777174,2025-01-12 16:24:11,und wieder mal ein Beispiel für Inzest,3,0,7459023047488507158,7459023047488507158
7459048287078515478,2025-01-12 15:17:21,Das sagt ihr jetzt vor der Wahl  SPD hat aber die Bürger verraten u verkauft,2,2,7459023047488507158,7459023047488507158
7459050707761627926,2025-01-12 15:26:36,niemals wieder Alt Parteien,1,1,7459023047488507158,7459023047488507158
7459077510233801494,2025-01-12 17:10:49,,0,0,7459023047488507158,7459023047488507158
7459076040422441750,2025-01-12 17:04:53,Wie kann man nur so antworten Herr Scholz Frau Bärbock und viele andere Ampel Politiker müssen täglich versuche mit Putin in kontakt treten Was passiert nix,0,0,7459023047488507158,7459023047488507158
7459071234689712918,2025-01-12 16:46:13,ok die Ukraine ist aber auch in Russland mit unseren Waffen Oder sind die da bloß Pilze suchen,0,3,7459023047488507158,7459023047488507158
7459068678240830230,2025-01-12 16:36:22,Die SPD soll ihre Vergangenheitsbewältigung in der Gruppentherapie und nicht im Kanzleramt angehen Hätte Herr Scholz Seiner Zeitenwänderede Taten folgen lassen wäre in der Ukraine längst Frieden,0,0,7459023047488507158,7459023047488507158
7459066653260776214,2025-01-12 16:28:41,Oli hattehat seinen Laden nicht im Griff,0,0,7459023047488507158,7459023047488507158
7459063488982172438,2025-01-12 16:16:13,SPD trägt Milliarden in die Ukraine und setzt damit Menschenleben aufs Spiel,0,3,7459023047488507158,7459023047488507158
7459036751445656342,2025-01-12 14:32:25,Sara Wagenknecht labert sowas auch aber ist ja Putin verliebt SPD ist schon immer meine Wahl gewesen Und hätte es lindner nicht gegeben hätten wir den Schlamassel nicht,0,1,7459023047488507158,7459023047488507158
7465413512878375702,2025-01-29 18:57:42,Merz ist als deutscher Politiker insgesamt untragbar Sonst habe ich nur noch Worte dafür die man kaum mit respektvoll in Verbindung bringen kann Der Mann ist in jeder Beziehung ERLEDIGT,15,0,7465391936522784022,7465391936522784022
7465402528507724566,2025-01-29 18:15:02,Das ist Demokratie Die Mehrheit des Volkes unterstützt diesen Antrag Alles andere ist ParteiTaktiererei,14,12,7465391936522784022,7465391936522784022
7465510902130344726,2025-01-30 01:18:51,Merz ist untragbar hab ich schon vor Monaten gesagt,3,0,7465391936522784022,7465391936522784022
7465441613591708438,2025-01-29 20:46:55,Nicht die Demokratie die Du persönlich gerne hättest Warte das wird noch viel besser Die Leute haben den Rand voll von diesem woken Wahnsinn Es werden immer mehr,2,1,7465391936522784022,7465391936522784022
7465398169947456278,2025-01-29 17:58:25,,2,0,7465391936522784022,7465391936522784022
7465782790153618198,2025-01-30 18:50:56,Nennt sich Demokratie sind Sie Lichtjahre von entfernt,1,0,7465391936522784022,7465391936522784022
7465623806201561878,2025-01-30 08:35:07,Das ist wahre Demokratie denn lt Umfragen wünschen 67 der Deutschen aber so Man vertritt auch Interesse und Mehrheit der Bevölkerung nicht die Minderheit,1,0,7465391936522784022,7465391936522784022
7465601238944449302,2025-01-30 07:06:34,,1,0,7465391936522784022,7465391936522784022
7465529345068614422,2025-01-30 02:34:03,,1,0,7465391936522784022,7465391936522784022
7465393516764660502,2025-01-29 17:40:10,Warum Das ist die einzigste Partei die Deutschland retten will ,1,2,7465391936522784022,7465391936522784022
7465768999839105814,2025-01-30 17:57:19,10 jahre nich mal das wort asylanten probleme in den mund genommen und jetzt soll merz schuld sein,0,0,7465391936522784022,7465391936522784022
7465767780370694934,2025-01-30 17:52:41,Demokratie pur freie Wahl von demokratisch gewählten Abgeordneten,0,0,7465391936522784022,7465391936522784022
7465687872622347030,2025-01-30 12:43:15,Die Schande ist doch die SPD die wieder einmal gegen das Wohl für Deutschland gestimmt hat Zum kotzen mit der links faschistischen Partei Helmut Schmidt dreht sich im Grab um,0,0,7465391936522784022,7465391936522784022
7465669012145881878,2025-01-30 11:30:10,Merz muss weg genau wie die Weiden,0,0,7465391936522784022,7465391936522784022
7465646454733226774,2025-01-30 10:02:15,Beste was er jemals gemacht hat,0,0,7465391936522784022,7465391936522784022
7465622641040655126,2025-01-30 08:30:34,Welche Rechtsextremen Sowas gibt es nicht in Bundestag ,0,0,7465391936522784022,7465391936522784022
7465613646955463446,2025-01-30 07:55:42,Nur weil Merz unsere mehr als marode Einwanderungspolitik anpacken will ist die CDU nicht faschistisch Und wer für ihn bzw den Antrag stimmt kann er nicht beeinflussen,0,0,7465391936522784022,7465391936522784022
7465606588323119894,2025-01-30 07:28:07,Die 7 nicht abgegebenen Stimmen der SPD haben zur Mehrheit verholfen Ein Schelm der Böses dabei denkt ,0,0,7465391936522784022,7465391936522784022
7465580962983068438,2025-01-30 05:48:38, Mehr als schwarz  ,0,0,7465391936522784022,7465391936522784022
7465573364951089942,2025-01-30 05:19:46,Wann kommt endlich die Brandmauer im Steuerrecht Kein Steuergeld von Rechtsextremen und CDU Wir linke schaffen das auch allein,0,0,7465391936522784022,7465391936522784022
7465548923663794966,2025-01-30 03:48:14,Ja mit Demokratie können die links grünen Kommunisten nicht umgehen ,0,0,7465391936522784022,7465391936522784022
7465489055838536470,2025-01-29 23:52:43,Na endlich,0,0,7465391936522784022,7465391936522784022
7465483948274844438,2025-01-29 23:32:18,,0,0,7465391936522784022,7465391936522784022
7465458521811829526,2025-01-29 21:52:26,Mit Hendrik Wüst wäre das niemals passiert,0,1,7465391936522784022,7465391936522784022
7465452818704253718,2025-01-29 21:30:30,Ein guter Tag für Deutschland und die echte Demokratie ,0,0,7465391936522784022,7465391936522784022
7465396731035960086,2025-01-29 17:52:35,,0,0,7465391936522784022,7465391936522784022
7465393290381493014,2025-01-29 17:39:19,,0,0,7465391936522784022,7465391936522784022
7465712473607340822,2025-01-30 14:18:17,Ey wo lebst du ,0,0,7465391936522784022,7465391936522784022
7465381422137803542,2025-01-29 16:53:29,Was wir brauchen ist bessere Integration Schneller Asylanträge bessere Möglichkeiten in den Arbeitsmarkt einzusteigen bessere Anerkennung von Abschlüssen einfachere Ausbildung und studiumsplätze,6,1,7465357374551772438,7465357374551772438
7465374248858977046,2025-01-29 16:25:46,Danke für ihr klares und besonnenes Statement  Sie haben einen Follower gewonnen,2,0,7465357374551772438,7465357374551772438
7465394450556732182,2025-01-29 17:44:00,Sie vergleichen wirklich die Flucht im 2 Weltkrieg und des kalten Krieges mit der aktuellen Situation Ihnen ist nicht mehr zu helfen,0,0,7465357374551772438,7465357374551772438
7465389688804967191,2025-01-29 17:25:26,Bitte mal nachlesen was Demokratie ist bei den Kommentaren scheint es keiner zu wissen SPD und Grüne wissen es nicht mehr beschüft das Volk wabal,0,0,7465357374551772438,7465357374551772438
7465362325731836694,2025-01-29 15:39:34,Franz von Papen lässt grüßen ,0,0,7465357374551772438,7465357374551772438
7465339415211148034,2025-01-29 14:10:37,,1,0,7465291957888126230,7465291957888126230
7465321897279390487,2025-01-29 13:02:25,nicht wählbar,1,2,7465291957888126230,7465291957888126230
7465315545291424534,2025-01-29 12:37:59,Ja klar Hieß es nicht das die das Personal mitbringen,1,1,7465291957888126230,7465291957888126230
7465302081747550998,2025-01-29 11:45:48,niemals SPD und Grüne,1,2,7465291957888126230,7465291957888126230
7466092619682562838,2025-01-31 14:53:39,SPD nie und nimmer ,0,0,7465291957888126230,7465291957888126230
7465322026829529878,2025-01-29 13:03:12,Aber wieder in der Abhängigkeit eines Ausland,0,0,7465291957888126230,7465291957888126230
7465319890111988502,2025-01-29 12:54:45,,0,1,7465291957888126230,7465291957888126230
7464926434962178838,2025-01-28 11:28:35,Nie wieder SPD,6,1,7464919652439756054,7464919652439756054
7464955234290516758,2025-01-28 13:19:56,Für alles nur noch Steuern  Steuern Steuern  Euch kann man nicht mehr Wählen Da ein paar Euros mehr und woanders wird einem das wieder weggenommen ,3,0,7464919652439756054,7464919652439756054
7464951562944119574,2025-01-28 13:05:28,der Mindestlohn ist Unsinn was bringt der auf 15 wenn dadurch alle Preise auch steigen die Lohnnebenkosten müssen gesenkt werden das bei gleichem lohnt mehr über bleibt,2,0,7464919652439756054,7464919652439756054
7464922402188329750,2025-01-28 11:12:25,Mit jeder Mindestlohnanhebung kommt auch eine Preisanhebung im Einzelhandel Wer profitiert also Krankenkassen und Finanzämter,2,0,7464919652439756054,7464919652439756054
7465029495209739041,2025-01-28 18:07:23,,1,0,7464919652439756054,7464919652439756054
7465029482165535520,2025-01-28 18:07:22,,1,0,7464919652439756054,7464919652439756054
7465029453564838688,2025-01-28 18:07:19,,1,0,7464919652439756054,7464919652439756054
7464971531786568470,2025-01-28 14:22:57,,1,0,7464919652439756054,7464919652439756054
7464940797711614722,2025-01-28 12:24:07,SPD ,1,0,7464919652439756054,7464919652439756054
7464927833980289814,2025-01-28 11:33:50,ich kann das nicht mehr hörenMindeslohn was soll das heißenEs werden Arbeitnehmer zum kleinst möglichen Lohn ausgebeutet Anstatt sie weiter zu bildenDas ihnen die Chanc geben würde mehr zu verdien,1,0,7464919652439756054,7464919652439756054
7464927545189712662,2025-01-28 11:32:37,,1,0,7464919652439756054,7464919652439756054
7466089397676606230,2025-01-31 14:40:57,Nie wieder SPD ,0,0,7464919652439756054,7464919652439756054
7465317753382830870,2025-01-29 12:46:31,ihr habt nix gemacht,0,0,7464919652439756054,7464919652439756054
7465286576756917014,2025-01-29 10:46:16,SPD SPD SPD SPD SPD SPD SPD SPD SPD SPD SPD SPD SPD SPD SPD SPD SPD SPD SPD SPD SPD SPD SPD SPD,0,0,7464919652439756054,7464919652439756054
7465268765933929238,2025-01-29 09:37:00,jetzt auf einmalwas habt ihr die letzten 3jahre gemacht,0,0,7464919652439756054,7464919652439756054
7465199044516823830,2025-01-29 05:07:05,wer hat regiert irgendwie haben alle Sozen das vergessen,0,1,7464919652439756054,7464919652439756054
7465183992891917078,2025-01-29 04:10:22,Dôner 850 EUR  wird der MLohn noch mehr wirds noch teurer,0,1,7464919652439756054,7464919652439756054
7465007293470622486,2025-01-28 16:41:27,Warum ich nicht SPD wähle Weil ich nicht möchte dass unsere Kinder in Parks und auf Weihnachtsmärkten abgestochen werden,0,0,7464919652439756054,7464919652439756054
7464982663024886550,2025-01-28 15:06:09,"Schweiz 
Deutsche Firmen in der Schweiz produzieren für EULänderwobei jährlich über 300 Milliarden Franken Gewinn in der Schweiz verbleiben
Politik Politiker haben keine Intresse daran",0,0,7464919652439756054,7464919652439756054
7464982606917501698,2025-01-28 15:05:46,"RenteLohn 
Grundrente  Betriebsrente für alle
Nach Muster Schweiz
Grundrente 45 von Arbeitgeber Arbeitnehmer von Bruttolohn
Mindesten Lohn 3500 Euro pro Monat  13
3500 174  2012 Euro",0,0,7464919652439756054,7464919652439756054
7464968979468124951,2025-01-28 14:12:47,Arbeit muss attraktiver werden minimum 2400Netto Punkt aus dann gibt es auch kein faulenzer mehr  aufgrund steigende Kosten Energie Inflation Miete kv Beiträge Sprite Preise usw,0,0,7464919652439756054,7464919652439756054
7464968878764589846,2025-01-28 14:12:30,ohne Worte ,0,2,7464919652439756054,7464919652439756054
7464965717692891926,2025-01-28 14:00:30,Nie wieder SPD ,0,1,7464919652439756054,7464919652439756054
7464959769067389718,2025-01-28 13:37:37,Super Mindestlohn angehoben und somit die Inflation immens mit angefeuert,0,0,7464919652439756054,7464919652439756054
7464951148475826966,2025-01-28 13:03:51,Über 340000 mehr Steuereinnahmen wirklich mehr haben die Arbeiter davon nicht den die Preise steigen weil der Mindestlohn gestiegen ist der Arbeitgeber muss die Kosten ja irgendwie umlegen,0,2,7464919652439756054,7464919652439756054
7464934312783299350,2025-01-28 11:58:34,Aber wer muss die Mindestlohn denn zahlen Zahlt es die SPD nur mal ne Frage,0,0,7464919652439756054,7464919652439756054
7464930650653426455,2025-01-28 11:44:37,Mindestlohn Jeder der mehr Lohn zahlen muss wird seine Leistung die Preise ERHÖHEN das heißt ALLES WIRD FÜR UNS TEURER STEUERN RUNTER dann bleibt vieleicht etwas mehr im Geldbeutel,0,1,7464919652439756054,7464919652439756054
7464928840477836054,2025-01-28 11:37:13,Im leben wähle ich die nichtdie haben die Rentensteuer eingeführt,0,0,7464919652439756054,7464919652439756054
7464927431947666198,2025-01-28 11:32:15,SPD UNWÄHLBAR ,0,0,7464919652439756054,7464919652439756054
7464926036918502166,2025-01-28 11:27:09,ihr habt für die Menschen gar nichts gemachtaber erzählt habt ihr viel,0,1,7464919652439756054,7464919652439756054
7464922017620493058,2025-01-28 11:10:51,Der Mindestlohn ist so eine Schwachsinnige idee Reduziert die steuern und macht wohnen und energie bezahlbar Ihr wälzt eure Verantwortung auf Arbeitgeber ab,0,0,7464919652439756054,7464919652439756054
7464590579210601238,2025-01-27 13:44:48,Die Eingrauchten,0,0,7464548543177444630,7464548543177444630
7463910902997123862,2025-01-25 17:47:05,nie wieder SPD ,2,1,7463901157874863382,7463901157874863382
7463906627139158806,2025-01-25 17:30:38,Als  2005 abgewählt wurde hatten wir 5 Mio Arbeitslose und Soldaten im Kosovo und Afghanistan  Jedesmal wenn  regiert fahren sie die Wirtschaft gegen die Wand und verwickeln uns in Kriege,2,0,7463901157874863382,7463901157874863382
7463902201887654678,2025-01-25 17:13:08,Die Wichtel Partei Niemals,2,1,7463901157874863382,7463901157874863382
7463998210344911638,2025-01-25 23:25:57,SPD ,1,0,7463901157874863382,7463901157874863382
7463989062099256086,2025-01-25 22:50:53,Moin weiter so ,1,0,7463901157874863382,7463901157874863382
7463939414848209686,2025-01-25 19:37:42,korrekt wichtig ,1,0,7463901157874863382,7463901157874863382
7463931637585363734,2025-01-25 19:07:36,Hängt sie alle höher ,1,0,7463901157874863382,7463901157874863382
7463929167266382614,2025-01-25 18:58:09,nee,1,1,7463901157874863382,7463901157874863382
7463905512418444054,2025-01-25 17:26:05,weg mit den roten Faschisten Hitler ist durch sie damals an die Macht gekommen wir wollen es nicht mehr wir wollen keinen Krieg,1,0,7463901157874863382,7463901157874863382
7463948593427792662,2025-01-25 20:13:18,Weiter so damit es noch mehr den Bach runter geht ,0,0,7463901157874863382,7463901157874863382
7463940843293524758,2025-01-25 19:43:09,Ich bin raus,0,1,7463901157874863382,7463901157874863382
