id,create_time,text,like_count,reply_count,parent_comment_id,video_id
7458601502534451990,2025-01-11 10:23:56,"darum seid ihr auch der EUVorgabe gefolgt und habt die Kuchensteuer an Schulen umgesetzt
das sorgt endlich für mehr Gerechtigkeit
sind ja nur 17 Millionen Menschen in Armut in Deutschland",0,0,7458399845229874465,7458399845229874465
7458600291274818326,2025-01-11 10:19:39,die Rentner werden es euch danken,0,0,7458399845229874465,7458399845229874465
7458598841097650966,2025-01-11 10:13:42,Also legt jetzt die Politik die Höhe der Löhne fest ,0,0,7458399845229874465,7458399845229874465
7458596801106084630,2025-01-11 10:06:01,IHRE LEEREN WORTHÜLSEN SIND NICHT NUR ABGEDROSCHEN SONDERN LÜGEN JAHRZEHNTELANGE ,0,0,7458399845229874465,7458399845229874465
7458594450603180823,2025-01-11 09:57:07,Duke RainWumpsDoppel wumpsBazookaZeitenwendeAbschiebe OffensiveInnere SicherheitWohnungsbaucom excumcumCo2 Geld an Bürger zurück zahlenIndistrie VernichtungMigrationFacharbeiter SPD NE,0,0,7458399845229874465,7458399845229874465
7458588940020417302,2025-01-11 09:35:54,Alles nur Wahlkampflüge,0,0,7458399845229874465,7458399845229874465
7458588727763256086,2025-01-11 09:34:52,Warum war das die letzte 3 Jahre nicht wichtig Fahrradwege in den Hochanden und anderen fremdländischen Unsinn war und ist wichtiger Immer vor Wahlen entdeckt ihr den deutschen Bürger,0,0,7458399845229874465,7458399845229874465
7458588641682998038,2025-01-11 09:34:14,Ah ja die SPD entlastet also den Steuerzahler Da kommt mir sofort ein Stosslachen ,0,0,7458399845229874465,7458399845229874465
7458583527161971478,2025-01-11 09:14:42,Also falsches Instrument die Steuern müssen in allen Bereichen runter,0,0,7458399845229874465,7458399845229874465
7458583480902337302,2025-01-11 09:14:15,Hier nochmal welcher kleiner Betrieb soll 15 Euro zahlen wenn dazu noch höhere Sozialabgaben kommen Und was muss dann eine Fachkraft erhalten Wer zahlt das dann wieder Der Endverbraucher,0,5,7458399845229874465,7458399845229874465
7458582135911056150,2025-01-11 09:09:22,Immer das gleiche gesülze,0,0,7458399845229874465,7458399845229874465
7458579575531438870,2025-01-11 08:59:12,Waffenlieferungen,0,0,7458399845229874465,7458399845229874465
7458578125208552214,2025-01-11 08:53:49,Herr Miersch schleudert immer die gleichen leeren Phrasen raus da kommt nix mehr SPD eine Stillstandspartei,0,0,7458399845229874465,7458399845229874465
7458576022049784598,2025-01-11 08:45:30,,0,0,7458399845229874465,7458399845229874465
7458575570965381921,2025-01-11 08:42:59,bla bla blabla bla bla,0,0,7458399845229874465,7458399845229874465
7458572583614268182,2025-01-11 08:32:25,Erhöhung von Mindestlohn dient nur dem Statt Für Arbeiter Lohnerhöhung zahlt Arbeitgeber dadurch muss er seine Preise an Endverbraucher erhöhen und Arbeitnehmer wird mehr Geld haben aber mehrausgeben,0,2,7458399845229874465,7458399845229874465
7458572419885318934,2025-01-11 08:31:40,Es sollte mal darum gehen nicht ständig über die Lohnnebenkosten und ständige Steuererhöhungen Grundsteuer etc den Leuten mehr von ihren Lohn zu lassen,0,0,7458399845229874465,7458399845229874465
7458570982015812374,2025-01-11 08:26:36,Es geht nur darum eine neue Regierung zu wählen Aber nie wieder die Altparteien ,0,0,7458399845229874465,7458399845229874465
7458569666715124502,2025-01-11 08:21:09,"Sorryaber als normal denkender deutscher kann man nur noch die AfD wählen 
",0,0,7458399845229874465,7458399845229874465
7458560601955320598,2025-01-11 07:45:53,Es ist einfach unfassbar dass ihr nicht mit eurem besten Kandidaten antritt ,0,0,7458399845229874465,7458399845229874465
7458560177819534102,2025-01-11 07:44:28,Bla bla bla,0,0,7458399845229874465,7458399845229874465
7458557822290428695,2025-01-11 07:35:30,richtig ,0,0,7458399845229874465,7458399845229874465
7458554369056473878,2025-01-11 07:22:14,ihr wollt könnt es aber nicht,0,0,7458399845229874465,7458399845229874465
7458553819000079126,2025-01-11 07:20:31,spd ist der untergang trotzdem bezahlen die arbeitenden Menschen den aufgeblähten Sozialstaat da gibt es immer mehr davon sie sind lachhaft,0,0,7458399845229874465,7458399845229874465
7458552948361724694,2025-01-11 07:16:40,Die SPD ist nicht wählbar Es ist so einfach Co2 und ökosteuer abschaffen Maut Erhöhung zurück nehmen Zigaretten Steuer halbieren Atomkraftwerke wieder ans Netz und wieder Gas und Rohstoffe aus Ru,0,0,7458399845229874465,7458399845229874465
7458552961045005078,2025-01-11 07:16:29,Ach die SPD hat die Arbeiter und Familien entdeckt  Das ist ja ganz rechts schreibt die SPD jetzt auch schon bei der AFD ab Wo ist die Politik für Diverse Bürgergeldempfänger lgbtqt und und,0,0,7458399845229874465,7458399845229874465
7458551977636184854,2025-01-11 07:13:00,DREI JAHRE lang in die Rezession geschliddert,0,0,7458399845229874465,7458399845229874465
7465381653160133398,2025-01-29 16:54:29,Klare Worte von unserem Generalsekretär und Bundestagsabgeordneten ,14,0,7465366753862847777,7465366753862847777
7465369457016455958,2025-01-29 16:06:53,Mein Vater hat früher schon gesagt nicht christlich sondern scheinheilig ,11,0,7465366753862847777,7465366753862847777
7465396297842393879,2025-01-29 17:51:11,nie wieder rot,9,0,7465366753862847777,7465366753862847777
7465370650431472406,2025-01-29 16:11:53,,9,0,7465366753862847777,7465366753862847777
7465420898536669974,2025-01-29 19:26:29,Ach so  Auf Wiedersehen ,7,0,7465366753862847777,7465366753862847777
7465368467106054934,2025-01-29 16:03:00,Streich mal das D aus SPD RAUS,7,1,7465366753862847777,7465366753862847777
7465665470545543958,2025-01-30 11:15:50,Alice für Deutschland ,6,1,7465366753862847777,7465366753862847777
7468286111858164503,2025-02-06 12:45:16,niemals SPD,5,0,7465366753862847777,7465366753862847777
7465425639169934102,2025-01-29 19:44:56,Time is over,4,0,7465366753862847777,7465366753862847777
7465407758676181782,2025-01-29 18:35:41,,4,0,7465366753862847777,7465366753862847777
7465374295007511318,2025-01-29 16:25:37,SPD  Spalter Partei Deutschlands,4,0,7465366753862847777,7465366753862847777
7465739748812964630,2025-01-30 16:03:45,"es klingelt zur Pause machen Sie und die gesamte Partei ein paar Legislaturperioden Pause
Deutschland muss sich erstmal wirtschaftlich und gesellschaftspolitisch erholen
BITTE",3,0,7465366753862847777,7465366753862847777
7465561615225029398,2025-01-30 04:35:45,Alice Bitte erlöse uns davon ,4,2,7465366753862847777,7465366753862847777
7465468615619281686,2025-01-29 22:32:14,Auf Wiedersehen,2,0,7465366753862847777,7465366753862847777
7487345820045656854,2025-03-29 21:25:56, Kirche sollte erstmal ihre Probleme aufarbeiten Haben ja genug in die Jugend gesteckt,1,0,7465366753862847777,7465366753862847777
7477175851409998615,2025-03-02 11:41:26,Das C steht für Chaos ,1,0,7465366753862847777,7465366753862847777
7473646248911078166,2025-02-20 23:25:29,Christlich bedeutet Keine Leute aus 57 isl Ländern ohne Religionsfreiheit Frauenrechte  Demokratie Pressefreiheit mehr ins Land lassen,1,0,7465366753862847777,7465366753862847777
7465684240454796054,2025-01-30 12:28:43,wo war die SPD ist Boykott wichtiger wie die Sicherheit in Deutschland,1,0,7465366753862847777,7465366753862847777
7465669713973773078,2025-01-30 11:32:32,,1,0,7465366753862847777,7465366753862847777
7465649537753219862,2025-01-30 10:14:43,,1,0,7465366753862847777,7465366753862847777
7465432507704836866,2025-01-29 20:11:38,Das ist total christlich Alles zu tun für christliche Deutsche,1,0,7465366753862847777,7465366753862847777
7465415202806498070,2025-01-29 19:04:33,rumheulerei jetzt auch noch mit der Kirche kommen das Volk hat die Schnauze voll von dieser Politik,1,0,7465366753862847777,7465366753862847777
7465374272279495446,2025-01-29 16:25:48,Im Baumarkt gibt es ein Angebot Besen zum kehren vor der eigenen Haustür Ksuf einen besser Zwei,1,1,7465366753862847777,7465366753862847777
7465373471683527446,2025-01-29 16:22:42,Richtig christlich was sie die letzten 10 Jahre mit der Bevölkerung machen,1,0,7465366753862847777,7465366753862847777
7465370146203697942,2025-01-29 16:09:35,Die Kirchen sollten sich daraus halten Gott ist für alle da auch für schwarze Schafe Sowas zu sagen geht gar nicht Darum bin ich ausgetreten,1,0,7465366753862847777,7465366753862847777
7465368942665892630,2025-01-29 16:05:15,Vielleicht sollte die HartzIVPartei mal das S aus ihrem Parteinamen streichen Scheinheiligkeit in Reinkultur,1,0,7465366753862847777,7465366753862847777
7477569232508306198,2025-03-03 13:07:56,Was soll das Wer war für die geplanten Diätenerhöhung nicht die AFD das ist die SPD,0,0,7465366753862847777,7465366753862847777
7471239909264704278,2025-02-14 11:47:49,httpsapollonewsnetscholzbepoebeltebetrunkenjournalistenkanzleramtschefpackteihnderbundeskanzlergehtjetztinsbett,0,0,7465366753862847777,7465366753862847777
7470100036766155542,2025-02-11 10:04:54,an dieser Stelle vielleicht auch an das S ihrer Partei erinnern,0,0,7465366753862847777,7465366753862847777
7468680715904664342,2025-02-07 14:16:35, auch nie wieder SPD  Nur noch ,0,0,7465366753862847777,7465366753862847777
7468637941272347414,2025-02-07 11:30:43,,0,0,7465366753862847777,7465366753862847777
7467738142343349014,2025-02-05 01:21:06,Und Ihr habt das S im Namenund vergessen,0,0,7465366753862847777,7465366753862847777
7466821378085110550,2025-02-02 14:01:14,Nein genau so sind Christen schon immer gewesen Dafür sind sie bekannt,0,0,7465366753862847777,7465366753862847777
7465718187024958230,2025-01-30 14:40:24,Wo ist bitte die SPD wenn es um das Verbotsverfahren gegen die AfD geht Matthias Miersch  noafd afdverbotjetzt,0,0,7465366753862847777,7465366753862847777
7465686715312292630,2025-01-30 12:38:22,,0,0,7465366753862847777,7465366753862847777
7465669821293331222,2025-01-30 11:32:53,nur die AFD wird stärkste Partei ,0,0,7465366753862847777,7465366753862847777
7465659753487024918,2025-01-30 10:53:53,SPD versucht gerade von der Eigenen Unfähigkeit abzulenken,0,0,7465366753862847777,7465366753862847777
7465622517085192982,2025-01-30 08:29:16,Wie aufgescheucht sie alle sind Versagt würde ich sagen Ich Feier das nicht aber bei der Selbstgefälligkeit bitter nötig Der Wähler ist entscheidend nicht eure Ideologie,0,0,7465366753862847777,7465366753862847777
7465496107092296470,2025-01-30 00:20:20,richtig gut Herr Miersch und super wichtig auch dass er Schärfer die Femizide zum Schluss erwähnte Darüber berichtet keinerund Überraschung  sind Deutsche,0,0,7465366753862847777,7465366753862847777
7465449259060871958,2025-01-29 21:16:30,Die Kirche sollte sich neutral verhalten Die sollen erst mal den Missbrauch an Kindern in der Kirche aufarbeiten Das zum Thema Christen,0,0,7465366753862847777,7465366753862847777
7465443387437957910,2025-01-29 20:53:43,Sachthemen sind außer Mode gekommen HAUPTSACHE Ideologie Stigma und gegen Mehrheiten laut Polternd Verbote formulieren,0,0,7465366753862847777,7465366753862847777
7465436364663980822,2025-01-29 20:26:38,C in CDU steht für cash,0,0,7465366753862847777,7465366753862847777
7465435467582194454,2025-01-29 20:23:11,Die Kirchen haben sich rauszuhalten Gott sei Dank steht das Wasser ihnen und ihrer SPD bis zum Hals,0,0,7465366753862847777,7465366753862847777
7465432958221714198,2025-01-29 20:13:15,Genug geredet ich brauche 1000 Euro für meine Familie Brot und Wasser kaufen ,0,0,7465366753862847777,7465366753862847777
7465431719093486358,2025-01-29 20:08:17,Wer ist denn dieser Willi,0,0,7465366753862847777,7465366753862847777
7465429743074427670,2025-01-29 20:00:58,,0,0,7465366753862847777,7465366753862847777
7465427900176532226,2025-01-29 19:53:32,Vielleicht solltet Ihr euer S und D in euren Parteinamen mal hinterfragen damit Politik für das Volk gemacht wird,0,0,7465366753862847777,7465366753862847777
7465416433867899670,2025-01-29 19:09:13,Mimimi,0,0,7465366753862847777,7465366753862847777
7465380630345007894,2025-01-29 16:50:18,Die Kirche hat soviel Kinder auf dem Gewissen das sie einfach mal die Schnauze halten sollten,0,0,7465366753862847777,7465366753862847777
7465380571058815766,2025-01-29 16:50:11,Warum ich nicht SPD wähle Weil ich nicht möchte dass unsere Kinder in Parks und auf Weihnachtsmärkten abgestochen werden,0,0,7465366753862847777,7465366753862847777
7465374653013066518,2025-01-29 16:27:09,Und ihr habt Sozial in eurem Namen ,0,0,7465366753862847777,7465366753862847777
7465374398935335682,2025-01-29 16:26:12,Des Teufels Advokat und die Kirchen ,0,0,7465366753862847777,7465366753862847777
7465373016424448790,2025-01-29 16:20:38,Die Hosen sind randvoll gefüllt Sie zeigen zunehmend ihr wahres Gesicht und versuchen alles die Wahrheit zu verhindern,0,0,7465366753862847777,7465366753862847777
7465371964150383382,2025-01-29 16:16:43,Die SPD ist so ne Lachnummer geworden Zum Glück wird Merz in 1 Monat dieses Land wieder in bessere Zeiten führen,0,0,7465366753862847777,7465366753862847777
7465383845106615062,2025-01-29 17:02:39,Merz ist komplett rückgratlos solange er an die Macht kommt würde er alles tun,20027,33,7465339893573569824,7465339893573569824
7465418014666736406,2025-01-29 19:15:07,Merkel hatte ihre Gründe warum sie Merz in kein politisches Amt gelassen hat,9500,21,7465339893573569824,7465339893573569824
7465401864263074583,2025-01-29 18:12:46,Merz Rücktritt SOFORT,7663,24,7465339893573569824,7465339893573569824
7465390016279020310,2025-01-29 17:26:48,merz will einfach nur Kanzler werden Deutschland ist ihm doch total egal,6220,22,7465339893573569824,7465339893573569824
7465413339330806550,2025-01-29 18:57:04,ich hoffe die CDU Wähler wachen auf,2732,33,7465339893573569824,7465339893573569824
7465364901281366806,2025-01-29 15:49:20,Das ist Demokratie liebe SPD ,2318,53,7465339893573569824,7465339893573569824
7465361666592015126,2025-01-29 15:36:45,euer Gerede kann man nicht mehr hören fragt doch mal die Bürger was sie möchten,1234,101,7465339893573569824,7465339893573569824
7465622587953152790,2025-01-30 08:30:12,Nazis raus aus Deutschland,1175,100,7465339893573569824,7465339893573569824
7465409794820768534,2025-01-29 18:43:15,Merz will wie Trump sein mit allem Mitteln ,1110,3,7465339893573569824,7465339893573569824
7465408276433322774,2025-01-29 18:37:39,Der wurde doch Deutschland durch den Fleischwolf drehen nur um ein einziges Mal eine Regierungsposition zu haben Hat schon einen Grund warum den Jahrzehnte lang keiner wollte,933,6,7465339893573569824,7465339893573569824
7465460931331326742,2025-01-29 22:02:14,Deswegen NUR die linke,905,21,7465339893573569824,7465339893573569824
7465399390569120534,2025-01-29 18:03:02,Merz ist unwählbar,898,4,7465339893573569824,7465339893573569824
7465408551876674326,2025-01-29 18:38:30,Ab heute kann ich den Weg der CDU nicht mehr mitgehen Frau Merkel wusste wie man mit Merz umgehen Ich vermisse Mutti Merkel,778,19,7465339893573569824,7465339893573569824
7465380218854474518,2025-01-29 16:48:42,Sehr gut Was die Union da abzieht ist fahrlässig und viele sind zurecht wütend,678,1,7465339893573569824,7465339893573569824
7465344528908780310,2025-01-29 14:30:07,Das nennt man Demokratie Aber Olaf Scholz hat damals gesagt die Mehrwertsteuer wird nie wieder erhöht keine Panzer in die Ukraine bla bla bla,564,36,7465339893573569824,7465339893573569824
7465378987955553046,2025-01-29 16:43:45,halt einfach die,541,74,7465339893573569824,7465339893573569824
7465391565125583638,2025-01-29 17:32:31,Die Altparteien haben fertig,518,1,7465339893573569824,7465339893573569824
7465405766250496790,2025-01-29 18:27:35,korrupt und verlogen es hat sich ausgemerzt ,502,0,7465339893573569824,7465339893573569824
7465413427302236950,2025-01-29 18:57:25,Ein Mann der sein Wort bricht ist ehrenlos,448,3,7465339893573569824,7465339893573569824
7465424127357158146,2025-01-29 19:38:51,Nur noch ,428,4,7465339893573569824,7465339893573569824
7465433768079557398,2025-01-29 20:16:35,Wenn Friedrich Merz Guten Morgen sagt ist es entweder kein guter oder es ist bereits Nachmittag Soviel zu seiner Glaubwürdigkeit,388,3,7465339893573569824,7465339893573569824
7465399068052243222,2025-01-29 18:01:46,Freude Dankeschön,382,2,7465339893573569824,7465339893573569824
7465422757718197015,2025-01-29 19:33:50,Ich habe ihm schon vorher nicht geglaubt jetzt erst recht nicht Er will MACHT  er hat kein Interesse an den Menschen in Deutschland,370,3,7465339893573569824,7465339893573569824
7465352747019387670,2025-01-29 15:02:23,Wenn man Angst um seine Macht hatdann kommt sowas ,308,2,7465339893573569824,7465339893573569824
7465447998819009312,2025-01-29 21:11:23,OMG die Angst Schweiz Perlen aus der Stirn ,292,15,7465339893573569824,7465339893573569824
7465521277589472022,2025-01-30 02:02:33,Alice für Deutschland ,291,16,7465339893573569824,7465339893573569824
7465410977891779350,2025-01-29 18:47:58,SPD hat fertig,250,0,7465339893573569824,7465339893573569824
7465360485380375318,2025-01-29 15:32:27,Demokratie ist ihnen nur wichtig wenn es nach ihrer Nase geht ,234,2,7465339893573569824,7465339893573569824
7465414061225870102,2025-01-29 19:00:03,Merz würde uns auch bunte Einhörner versprechen Hauptsache er wird gewählt ,151,0,7465339893573569824,7465339893573569824
7465344378414269206,2025-01-29 14:30:02,Der Platz reicht hier nicht aus um alles zu schreiben was die SPD schon so alles gesagt hat,140,1,7465339893573569824,7465339893573569824
7465406525503669014,2025-01-29 18:30:40,Ich werde meine Stimme an die SPD geben ,127,19,7465339893573569824,7465339893573569824
7465398493264233238,2025-01-29 17:59:21,Warum stimmt ihr dann nicht für das Verbotsverfahren Ich verstehe es null,119,6,7465339893573569824,7465339893573569824
7465427496167539479,2025-01-29 19:51:51,Genauso ist es Merz ist einfach gefährlich,99,0,7465339893573569824,7465339893573569824
7465421238111273750,2025-01-29 19:27:40,Merz Rücktritt sofort,97,1,7465339893573569824,7465339893573569824
7465455937466843926,2025-01-29 21:42:36,habeck4kanzler ,85,8,7465339893573569824,7465339893573569824
7465453557963309846,2025-01-29 21:33:30,Dann macht doch mal ein Volksentscheid  Aber ihr Politiker habt ja ein ernsthaftes Problem mit echter Demokratie ,74,40,7465339893573569824,7465339893573569824
7465385532119892758,2025-01-29 17:09:35,"
Alice für Deutschland 
",74,18,7465339893573569824,7465339893573569824
7465657074049204998,2025-01-30 10:43:20,Bundeskanzlerin ,70,0,7465339893573569824,7465339893573569824
7465406598123750166,2025-01-29 18:30:56,Als Sozialdemokraten würde ich mir ab jetzt sehr gut überlegen ob man mit der jetzigen Union nochmal in eine Koalition geht Egal ob als Junior oder Seniorpartner Ich würde davon stark abraten,64,1,7465339893573569824,7465339893573569824
7465391333194515222,2025-01-29 17:32:00,Es geht doch darum das richtige für Deutschland zu tun egal wo die Mehrheit her kommt die SPD will anscheinend nicht das richtige für Deutschland,62,49,7465339893573569824,7465339893573569824
7465407690282730262,2025-01-29 18:35:08,SPD hat so oft Tabu gebrochen ist das Herrlich das ist Demokratie obs schmeckt oder nicht ,61,51,7465339893573569824,7465339893573569824
7465542325928067862,2025-01-30 03:25:18,da hat aber einer Panik ,56,0,7465339893573569824,7465339893573569824
7465551709814948630,2025-01-30 04:00:42,Das nennt sich Demokratie,52,1,7465339893573569824,7465339893573569824
7465550709351416598,2025-01-30 03:56:08,So geht Demokratie,51,1,7465339893573569824,7465339893573569824
7465390689448002326,2025-01-29 17:29:21,Genau so ist es gekommen und das ist auch gut so,50,0,7465339893573569824,7465339893573569824
7465451697138811670,2025-01-29 21:26:08,Habt ihr das überhaupt noch nicht begriffen es geht um das Deutsche Volk nicht um euch Politiker,49,25,7465339893573569824,7465339893573569824
7465420680516829974,2025-01-29 19:25:42,Das Wort von Merz ist nichts wert,48,2,7465339893573569824,7465339893573569824
7465364910626603808,2025-01-29 15:49:16,Sie sollten mal nachschlagen was man unter dem Wort Demokratie versteht,46,1,7465339893573569824,7465339893573569824
7465473864681898774,2025-01-29 22:52:53,Alice für Deutschland ,44,0,7465339893573569824,7465339893573569824
7465470196461142806,2025-01-29 22:38:36,Ui da brauchen jetzt sehr viele ein Taschentuch ,44,0,7465339893573569824,7465339893573569824
7465545008138011414,2025-01-30 03:32:27,Das ist Demokratie,41,0,7465339893573569824,7465339893573569824
7465397642135913238,2025-01-29 17:56:18, CL wagt es die Grünen als Steigbügelhalter zu bezeichnen Schämen soll er sich,41,0,7465339893573569824,7465339893573569824
7465614529445233430,2025-01-30 07:59:04,Merz will die Macht egal mit welchen Mitteln Ekliger Mensch,40,0,7465339893573569824,7465339893573569824
7465447984299377430,2025-01-29 21:11:45,Demokratie ,37,0,7465339893573569824,7465339893573569824
7465439779047277335,2025-01-29 20:39:59,Deshalb BSW,37,7,7465339893573569824,7465339893573569824
7465665344691569430,2025-01-30 11:15:31,Alice für Deutschland ,36,0,7465339893573569824,7465339893573569824
7465479784241054486,2025-01-29 23:15:48,Und ich freu mich drauf,36,0,7465339893573569824,7465339893573569824
7465343931057373974,2025-01-29 14:28:05,Ich glaube die wollen sich echt selbst abschaffen,34,1,7465339893573569824,7465339893573569824
7465414227609879298,2025-01-29 19:00:38,Kapiert er endlich Der Wähler will eiuch nicht mehr,32,0,7465339893573569824,7465339893573569824
7465549177399247638,2025-01-30 03:51:52,Die grünen und die SPD haben kein einziges Wort gehalten nie,31,1,7465339893573569824,7465339893573569824
7465412833598374678,2025-01-29 18:55:06,Er redet mir von der Seele Merz darf niemals Kanzler werden,30,1,7465339893573569824,7465339893573569824
7465372883855672086,2025-01-29 16:20:16,Bitte den Herren mehr in talk Shows dann gehts straight auf die 10 Prozent zu,29,0,7465339893573569824,7465339893573569824
7465417668490740502,2025-01-29 19:13:59,Das ist der Anfang ,25,1,7465339893573569824,7465339893573569824
7465791552246711062,2025-01-30 19:24:44,Nur noch ,21,0,7465339893573569824,7465339893573569824
7465366111949931286,2025-01-29 15:53:55,Demokratie,19,0,7465339893573569824,7465339893573569824
7465502685124248342,2025-01-30 00:46:36,Scholz hat uns auch alle belogen und ab heute haben wir eine echte Demokratie ,18,8,7465339893573569824,7465339893573569824
7465376987507786518,2025-01-29 16:36:08,Das ist Demokratie,18,1,7465339893573569824,7465339893573569824
7465690203744912150,2025-01-30 12:52:09,afd ,17,0,7465339893573569824,7465339893573569824
7465580486179717910,2025-01-30 05:46:59,Gebrochen hat die Ampel,17,0,7465339893573569824,7465339893573569824
7465424898669642518,2025-01-29 19:42:01,Merz hat uns verraten,16,0,7465339893573569824,7465339893573569824
7465579939015361302,2025-01-30 05:44:59,Das nennt man Demokratie     ,15,0,7465339893573569824,7465339893573569824
7465443458536588054,2025-01-29 20:54:13,Merz ist unwählbar dem gehts nur um sein Ego ,15,1,7465339893573569824,7465339893573569824
7465362233330909974,2025-01-29 15:39:03,Nennt sich Demokratie des Volkes Wille umsetzen damit hat die SPD natürlich nichts am Hut Her Merz hat verstanden,14,23,7465339893573569824,7465339893573569824
7465746945280574210,2025-01-30 16:32:02,ständig reden die von Demokratie aber wissen nicht mal was Demokratie ist ,13,1,7465339893573569824,7465339893573569824
7465502714039943958,2025-01-30 00:46:59,Alice für Deutschland ,13,0,7465339893573569824,7465339893573569824
7465725881316934422,2025-01-30 15:10:25,Welches tabu soll das sein Demokratie funktioniert doch so oder bin ich fehlinformiert,12,24,7465339893573569824,7465339893573569824
7465547513660080918,2025-01-30 03:41:47,mmachtverlust tut weh ,10,0,7465339893573569824,7465339893573569824
7465424999887176470,2025-01-29 19:42:34,Merz macht Gesetze die das Volk will wie undemokratisch,10,9,7465339893573569824,7465339893573569824
7465410552315020034,2025-01-29 18:46:31,So funktioniert Demokratie,10,0,7465339893573569824,7465339893573569824
7465452668002042646,2025-01-29 21:29:40,OMG ein Politiker hält sein Wort nicht mal was ganz neues,8,5,7465339893573569824,7465339893573569824
7465394496987022102,2025-01-29 17:44:11,Danke für ihre klaren WorteNur warum weigert SPD sich den Verbotsantrag zur Prüfung an die Richter des Bundesverfassungsgericht zu übergebenDas ist auch hochfahrlässig,8,1,7465339893573569824,7465339893573569824
7465651873796031254,2025-01-30 10:23:54,Merz würde dieses land an den meist bietenden verkaufen Keine stimme für Merz,7,0,7465339893573569824,7465339893573569824
7465483395860382486,2025-01-29 23:30:25,Arbeitsamt ruft   ,7,3,7465339893573569824,7465339893573569824
7465431480501371670,2025-01-29 20:07:33,Es geht nicht um die Befindlichkeiten der SPD sondern um die Sicherheit der Bürger dieses Landes ,7,11,7465339893573569824,7465339893573569824
7465365534214701846,2025-01-29 15:51:52,Ich finde das Merz komplett richtig liefert Merz ist klasse ,7,0,7465339893573569824,7465339893573569824
7465584092436824854,2025-01-30 06:00:15,man sieht die Angst machtverlust,6,0,7465339893573569824,7465339893573569824
7465460255783518998,2025-01-29 21:59:20,Die aktuelle Regierung bricht täglich ihren Eid,6,54,7465339893573569824,7465339893573569824
7465458013845095170,2025-01-29 21:50:37,Merz hat schon mehrmals seine Aussagen zurückgenommen wer soll ihm noch glauben ICH nicht ,6,0,7465339893573569824,7465339893573569824
7465457036386665238,2025-01-29 21:46:45,"Deshalb Habeck für Deutschland

𝗞𝗔𝗡𝗭𝗟𝗘𝗥2025
",6,1,7465339893573569824,7465339893573569824
7465409830330811158,2025-01-29 18:43:40,Welcher Politiker der Altparteien hat sein Wort noch nicht gebrochen  Ihr belügt das Volk doch ständig lügen lügen und lügen ist auch Wortbruch ,6,3,7465339893573569824,7465339893573569824
7465807981198164758,2025-01-30 20:28:46,CDU will zu Macht kommen ihm interessiert es nicht was das Volk willsehr schade,5,0,7465339893573569824,7465339893573569824
