id,create_time,text,like_count,reply_count,parent_comment_id,video_id
7465441104692495126,2025-01-29 20:44:58,Schmidt konnte so freundlich und vernichtend Leute beschimpfen ich liebe es,914,5,7465215719811157270,7465215719811157270
7465323671138419478,2025-01-29 13:09:20,Er hat schon vor 60 Jahren die heutige CDU Politik durchschaut Respekt Helmut Schmidt ,394,5,7465215719811157270,7465215719811157270
7465473998940537622,2025-01-29 22:52:51,Unglaublich Merz ist nicht mehr wählbar,373,5,7465215719811157270,7465215719811157270
7465345636670767894,2025-01-29 14:34:32,Schade das es so einen kompetenten Politiker nicht mehr gibt,219,11,7465215719811157270,7465215719811157270
7465665155147318038,2025-01-30 11:15:04,Wir brauchen wieder einen Helmut Schmidt und das kann im Moment nur Robert Habeck sein ,163,44,7465215719811157270,7465215719811157270
7465435203487466262,2025-01-29 20:22:09,Helmut Schmidt war schon immer seiner Zeit voraus ,77,0,7465215719811157270,7465215719811157270
7465547899247936278,2025-01-30 03:46:38,Helmut Schmidt hat es früher schon erfasst,62,0,7465215719811157270,7465215719811157270
7465495787054990102,2025-01-30 00:19:40,Eine Wahre Legende der in die Zukunft schauen konnte,41,0,7465215719811157270,7465215719811157270
7465660837563548438,2025-01-30 10:57:55,Kein Merz im Februar,40,1,7465215719811157270,7465215719811157270
7465434275711812374,2025-01-29 20:18:32,Olaf hätte bei ihm noch nicht mal Kaffee kochen dürfen,34,1,7465215719811157270,7465215719811157270
7465251316346848023,2025-01-29 08:29:34,nie wieder altparteien,25,12,7465215719811157270,7465215719811157270
7465598188630082326,2025-01-30 06:55:40,Menschliche nicht selbstherrliche Kräfte scheint es im Moment in der gesamten CDUCSU nicht zu geben sonst würden sie ohne Umschweife austreten oder sich Herrn Merz entgegenstellen,23,0,7465215719811157270,7465215719811157270
7465265761523745558,2025-01-29 09:24:49,Welch unglaubliche Unterschiede der Persönlichkeiten,22,0,7465215719811157270,7465215719811157270
7465494041858949910,2025-01-30 00:12:05,Helmut digga komm zurück bitte wir brauchen dich schwing dein arsch rüber aus himmel und mach noch 4 Jahre bro pls ich knie vor dir mit 100 schachteln mentol kippen,20,0,7465215719811157270,7465215719811157270
7465303040222987030,2025-01-29 11:49:49,Helmut Schmidt war weitsichtig und klug  Seine Nachfolgergenossen sollten sich an Aussagen von Schmidt erinnern  Die SPD hat den richtigen Pfad kontinuierlich verlassen ,20,3,7465215719811157270,7465215719811157270
7465414695622296342,2025-01-29 19:02:24,"Wahre Worte von Helmut Schmidt einem Staatsmann und Politiker einem Bundeskanzler wie wir ihn heute dringend bräuchten 
Er wird unvergesslich bleiben ",19,0,7465215719811157270,7465215719811157270
7465664285499458326,2025-01-30 11:11:07,Die Realität hat sich geändert die SPD hätte ja mitmachen können eine SPD unter Schmidt war deutlich weiter rechts als die SPD heute,15,42,7465215719811157270,7465215719811157270
7465827620334355222,2025-01-30 21:45:08,Ratet mal warum dMerkel den Merz kleingehalten hatte Sie wußte über seinen Charakter und Überzeugung bescheid Merz darf nicht Bundeskanzler werden,12,0,7465215719811157270,7465215719811157270
7465679940294689558,2025-01-30 12:12:00,Ach Helmut einen so geraden ehrlichen erfolgreichen Politiker wie dich gibts nicht mehr Wie recht du damals schon hattest ,12,0,7465215719811157270,7465215719811157270
7465731127303684886,2025-01-30 15:30:24,sowas wie Helmut Schmidt bräuchten wir dringend ,9,0,7465215719811157270,7465215719811157270
7465449921605714710,2025-01-29 21:19:04,Merz ,9,0,7465215719811157270,7465215719811157270
7465612669481173782,2025-01-30 07:51:51,Helmut Schmidt Sie fehlen ,8,0,7465215719811157270,7465215719811157270
7465580917127201558,2025-01-30 05:48:55,Niemand hat die Absicht eine Mauer zu bauen ,8,7,7465215719811157270,7465215719811157270
7465732400812098326,2025-01-30 15:35:20,Bester Kanzler den wir jemals hatten ,7,0,7465215719811157270,7465215719811157270
7465224868721050390,2025-01-29 06:46:22,The one and only Helmut Schmidt  on point ,7,0,7465215719811157270,7465215719811157270
7465781868824511254,2025-01-30 18:47:28,Wir brauchen wieder einen Helmut Schmidt,6,0,7465215719811157270,7465215719811157270
7465466379623547670,2025-01-29 22:23:30,Helmut Schmidt bester Mann,6,0,7465215719811157270,7465215719811157270
7465407063641932566,2025-01-29 18:32:54,"Nicht mehr es war einmal 
",6,13,7465215719811157270,7465215719811157270
7465742067546440470,2025-01-30 16:12:56,Habeck und Schmidt vergleichen das ist Blasphemie ,5,0,7465215719811157270,7465215719811157270
7465706367544083222,2025-01-30 13:54:47,So lange her und trotzdem so aktuell wie nie,5,0,7465215719811157270,7465215719811157270
7465407063641146134,2025-01-29 18:32:42, Super der Mann ,5,0,7465215719811157270,7465215719811157270
7465819608315298582,2025-01-30 21:13:40,Habeck ist Helmut Schmidt dieser Zeit,4,8,7465215719811157270,7465215719811157270
7465741081474122518,2025-01-30 16:09:08,Die alle lügen doch ob es CDU SPD oder die Grünen sind alles nicht mehr wählbar,4,16,7465215719811157270,7465215719811157270
7465546822469124886,2025-01-30 03:42:05,nie wieder ist jetzt CDU auch unwählbar geworden,4,0,7465215719811157270,7465215719811157270
7465822165943517974,2025-01-30 21:23:43,Bester Mann ,3,0,7465215719811157270,7465215719811157270
7465807266160263958,2025-01-30 20:25:41,bester Kanzler ever Auch wenn er bei der SPD war der Mann wusste immer von was er spricht und wenn es nicht lief hatte er sich nicht weggeduckt ,3,0,7465215719811157270,7465215719811157270
7465772279399482135,2025-01-30 18:10:02,Schmidt hat alles gesagt,3,0,7465215719811157270,7465215719811157270
7465738304425755414,2025-01-30 15:58:31,Wie kann man nur jemanden wählen wollen der schon vor der Wahl sein Wort bricht ,3,0,7465215719811157270,7465215719811157270
7465683900044673814,2025-01-30 12:27:16,Aktuell sitzt ein einziger guter Mensch für die Union im Bundestag Antje ,3,0,7465215719811157270,7465215719811157270
7465550442844701462,2025-01-30 03:53:28,Die CDU müsste sich mal ihre Wahlwerbung aus den 70ern anschauen da war sie auch nicht weit von ganz weit rechts entfernt Aber sowas vergessen die lieber Merz  unwählbar ,3,0,7465215719811157270,7465215719811157270
7465514615830266646,2025-01-30 01:34:18,Ob der Merz auf ihn gehört hätte Wohl nicht ,3,0,7465215719811157270,7465215719811157270
7465477603030909718,2025-01-29 23:07:14,"Danke für diese kluge Zusammenfassung 
Deutschland braucht erst jetzt solche Politiker ",3,0,7465215719811157270,7465215719811157270
7465459612976825110,2025-01-29 21:56:41,Best maner hat es damals schon erklärt,3,16,7465215719811157270,7465215719811157270
7465243299068429078,2025-01-29 07:58:34,NIEMALS KANZLER,3,0,7465215719811157270,7465215719811157270
7466125982413308694,2025-01-31 17:02:27,For ever Helmut Schmidt,2,0,7465215719811157270,7465215719811157270
7465935906453947158,2025-01-31 04:47:35,danke für dieses Video danke HelmutWo sind die noch Anständigen in euren Reihen CDU,2,0,7465215719811157270,7465215719811157270
7465790616648762134,2025-01-30 19:21:05,"Es hat sich also seit geschätzt 45 Jahren in der CDU nichts geändert
außer vlt dass die ausgezeichneten Leute verschwunden sind",2,0,7465215719811157270,7465215719811157270
7465789030384501526,2025-01-30 19:15:10,Toller Videoschnitt HerStefan Schwartze  Danke dafür ,2,0,7465215719811157270,7465215719811157270
7465771245256164118,2025-01-30 18:06:10,Vor 50 Jahren war das noch so,2,0,7465215719811157270,7465215719811157270
7465769679791014678,2025-01-30 18:00:10,teamhabeck,2,0,7465215719811157270,7465215719811157270
7465687538620728086,2025-01-30 12:41:33,Das was Schmitt da gesagt hat trifft heute auf die spd zu ,2,0,7465215719811157270,7465215719811157270
7465668428956353302,2025-01-30 11:27:25,großartig,2,0,7465215719811157270,7465215719811157270
7465606684456010518,2025-01-30 07:28:04,Wie Recht er damals doch schon hatte ,2,0,7465215719811157270,7465215719811157270
7465591076495590166,2025-01-30 06:28:02,,2,0,7465215719811157270,7465215719811157270
7465523120070787862,2025-01-30 02:08:00, gut gemacht,2,0,7465215719811157270,7465215719811157270
7465481461103149846,2025-01-29 23:22:39,Wie ihr Schmidt Zitate nutzt er würde heute mit seinen Ansichten beschimpft und das obwohl er wohl der Beste war,2,2,7465215719811157270,7465215719811157270
7465449875627836162,2025-01-29 21:18:53,,2,0,7465215719811157270,7465215719811157270
7465439382679978774,2025-01-29 20:38:04,Weg mit Merz sofort,2,0,7465215719811157270,7465215719811157270
7465434568583168790,2025-01-29 20:19:36,,2,1,7465215719811157270,7465215719811157270
7465423414119957270,2025-01-29 19:36:04,afd wirkt,2,2,7465215719811157270,7465215719811157270
7465229485094339350,2025-01-29 07:04:48,"FaktenNews Studie von Wirtschaftsforscher und ZEW Pläne von AfD CDU FDP entlasten nur Reiche zu Lasten von Geringverdiener Rentnern und Kinder
httpssearchappiUegPWQyJZf9phzy5",2,0,7465215719811157270,7465215719811157270
7473408603643593494,2025-02-20 08:03:10,Taurus aber sofort,1,0,7465215719811157270,7465215719811157270
7468851188118749974,2025-02-08 01:20:59,Ich liebe diese Interview von Schmidt,1,0,7465215719811157270,7465215719811157270
7467830982877709078,2025-02-05 07:20:03,WÄHLT NICHT DIE CDU UND NICHT DIE CDU,1,0,7465215719811157270,7465215719811157270
7466516297633497858,2025-02-01 18:17:17,nur Respekt von den besten Politiker aber Er dreht sich im Grab was Seine Partei jetzt macht ,1,0,7465215719811157270,7465215719811157270
7466061893305778966,2025-01-31 12:54:20,"Vor Jahren gingen Politiker noch respektvoll um und wertschätzten sich trotz unterschiedlicher Anschauung
Er war ein sehr intelligenter Politiker",1,0,7465215719811157270,7465215719811157270
7466002596861543190,2025-01-31 09:04:49,Helmut Schmidt wäre heute nicht mehr in der SPD oder würde Sie reformieren,1,0,7465215719811157270,7465215719811157270
7465956984901763863,2025-01-31 06:08:02,Guter Beitrag und wie schnell man eine gute Meinung ins schlechte wandeln kann,1,0,7465215719811157270,7465215719811157270
7465918514492277526,2025-01-31 03:44:25,,1,0,7465215719811157270,7465215719811157270
7465918917031641878,2025-01-31 03:44:24,,1,0,7465215719811157270,7465215719811157270
7465847868931244822,2025-01-30 23:03:50,Das Affentheater von Scholz ist so lächerlicher Wahlkampf das man nur den Kopf schütteln kann,1,0,7465215719811157270,7465215719811157270
7465840625578574615,2025-01-30 22:35:28,Bin ein großer Fan von Herrn Schmidt Er hat recht dennoch und eigentlich bin ich mehr blau angehaucht hoffe ich dass Merz Kante zeigt Er könnte es davon bin ich überzeugt,1,2,7465215719811157270,7465215719811157270
7465839823671755522,2025-01-30 22:32:52,Nie wieder ist jetzt ,1,0,7465215719811157270,7465215719811157270
7465831645682975510,2025-01-30 22:00:41,Ich bin froh das ich ihn noch in mein Jugend erleben konnteUns fehlen derartige Persönlichkeiten,1,0,7465215719811157270,7465215719811157270
7465825790915068694,2025-01-30 21:38:08,Gott möge uns wieder einen Politiker wie  Schmidt schnauze bringen Es geht nicht um die Partei es geht um das Gewissen ,1,0,7465215719811157270,7465215719811157270
7465820992633373462,2025-01-30 21:18:58,Das war ein sehr schlauer Mann Schade das wir so einen Mann leider in unsere heutige Regierung nicht finden,1,0,7465215719811157270,7465215719811157270
7465820550502286102,2025-01-30 21:17:09,,1,0,7465215719811157270,7465215719811157270
7465814884371317526,2025-01-30 20:55:19,,1,0,7465215719811157270,7465215719811157270
7465813705407873814,2025-01-30 20:50:54,Ich mein he Leute hat euch der move von mertz wirklich überrascht,1,0,7465215719811157270,7465215719811157270
7465806627825713942,2025-01-30 20:23:20,"Adenauer hat mal gesagtwas interessiert mich mein Geschwätz von Gestern
Das hat auch heute noch Gültigkeit",1,0,7465215719811157270,7465215719811157270
7465798370425045782,2025-01-30 19:51:21,das war mal Helmut,1,0,7465215719811157270,7465215719811157270
7465774714557776662,2025-01-30 18:19:33,Zeiten ändern sich Politiker nicht Wer immer noch wählen geht hat es noch nicht begriffen,1,0,7465215719811157270,7465215719811157270
7465774126255735574,2025-01-30 18:17:07,Er ein so unglaublich weiser Mensch und der beste Bundeskanzler aller Zeiten ,1,0,7465215719811157270,7465215719811157270
7465774010675151638,2025-01-30 18:16:57,Merz macht momentan beste Wahlwerbung für SPD und Grüne So wortbrecherisch rechtswidrig und offensichtlich falsch kann man den ja nicht wählen,1,0,7465215719811157270,7465215719811157270
7465773703532479254,2025-01-30 18:15:24,,1,0,7465215719811157270,7465215719811157270
7465768595986055968,2025-01-30 17:55:34, Schmiddel hat es immer aufn Punkt gebracht ,1,0,7465215719811157270,7465215719811157270
7465767853317194518,2025-01-30 17:52:41,Er ist retorisch der Beste gewesen,1,0,7465215719811157270,7465215719811157270
7465762093498073878,2025-01-30 17:30:34,diesen Fundus gibt es faktisch nicht mehr,1,0,7465215719811157270,7465215719811157270
7465759549011641110,2025-01-30 17:20:51,Er hat alles voraus gesehen was gerade passiert,1,0,7465215719811157270,7465215719811157270
7465749970407850774,2025-01-30 16:43:34,Die SPD vergleicht sich mit der alten von Schmidt LOL,1,0,7465215719811157270,7465215719811157270
7465744921233703702,2025-01-30 16:24:08,"Deshalb ist es so wichtig
GEHT BITTE ALLE WÄHLEN FÜR EIN BUNTES DEMOKRATISCHES DEUTSCHLAND

HERZ STATT MERZ UND WEIDEL",1,0,7465215719811157270,7465215719811157270
7465741965604455190,2025-01-30 16:12:45,Das hat Helmut Schmidt schon damals gesehen,1,0,7465215719811157270,7465215719811157270
7465723497936405270,2025-01-30 15:00:52,Er war eben ein Kluger Mann ,1,0,7465215719811157270,7465215719811157270
7465720803436692246,2025-01-30 14:50:48,genau wie die SPD oder die grünen und FDP Schmidt war noch ein Kanzler mit Format nicht wie heute,1,3,7465215719811157270,7465215719811157270
7465706328356242198,2025-01-30 13:54:28,Merz koaliert mit der AfD Das predige ich seit 1 Jahr,1,0,7465215719811157270,7465215719811157270
7465703139431105302,2025-01-30 13:42:10,Ein echt kluger Mensch,1,0,7465215719811157270,7465215719811157270
7465702807624041238,2025-01-30 13:40:50,ehrenmann,1,0,7465215719811157270,7465215719811157270
7465701336244830998,2025-01-30 13:34:59,Sie beklagen sich über Karneval aber wie Goebbels argumentieren ist okay,1,0,7465215719811157270,7465215719811157270
7465698076050113302,2025-01-30 13:22:11,,1,0,7465215719811157270,7465215719811157270
7465687691603706646,2025-01-30 12:42:11,CDU Niemals,1,0,7465215719811157270,7465215719811157270
7465686025311879958,2025-01-30 12:35:51,,1,0,7465215719811157270,7465215719811157270
7465681454568325910,2025-01-30 12:17:46,Helmut Schmidt hat rechtMerz ist doch egal was aus Deutschland wird ,1,0,7465215719811157270,7465215719811157270
7465680165592187670,2025-01-30 12:13:04,Ich habe ihn sehr geschätzt Ein sehr kluger Kopf Hatte innenpolitisch bis auf jetzt die schwerste Zeit Könnten ihn heute wieder gut gebrauchen,1,0,7465215719811157270,7465215719811157270
7465674272142508822,2025-01-30 11:50:21,Er war hellsher,1,0,7465215719811157270,7465215719811157270
7465652210212668182,2025-01-30 10:25:09,Wieso wird er nicht in anderen Dingen zitiert Der SPD würde so ein Politker sehr gut tun habt ihr nur leider nicht,1,0,7465215719811157270,7465215719811157270
7465642540060115734,2025-01-30 09:47:11,,1,0,7465215719811157270,7465215719811157270
7465640404573782786,2025-01-30 09:39:24,Und das war schon in den 1930ern mit der Vorgängerpartei der Deutschen Zentrumspartei so die Steigbügelhalter der NSDAP,1,0,7465215719811157270,7465215719811157270
7465631253765784342,2025-01-30 09:03:11,,1,0,7465215719811157270,7465215719811157270
7465630890124182294,2025-01-30 09:02:09,Niemals CDU CSU AfD FDP BSW,1,0,7465215719811157270,7465215719811157270
7465629605563958038,2025-01-30 08:57:00,Der linder ist ein Kasper das ist schon lange klar Aber das der Fritz ein Kasper ist der mit dem Feuer spielt ist neu,1,0,7465215719811157270,7465215719811157270
7465628235062936342,2025-01-30 08:52:00,Er hatte Stiel Schmidt wußte und stand zu dem was er sagte ,1,0,7465215719811157270,7465215719811157270
7465627580621882134,2025-01-30 08:49:36,Ausgezeichnete Politiker schieben keine Grundsätze und Überzeugungen nicht beiseite,1,0,7465215719811157270,7465215719811157270
7465615110351880982,2025-01-30 08:01:07,Das war ein sehr weiser Mann er hat damals schon gewusst wie die CDU und die FDP ticken ,1,0,7465215719811157270,7465215719811157270
7465585218784756502,2025-01-30 06:05:22,Also wer jetzt noch CDU wählt ist auch braun,1,0,7465215719811157270,7465215719811157270
7465580847036449558,2025-01-30 05:48:44,,1,0,7465215719811157270,7465215719811157270
7465576783033139990,2025-01-30 05:33:37,,1,0,7465215719811157270,7465215719811157270
7465565223395918614,2025-01-30 04:49:00,,1,0,7465215719811157270,7465215719811157270
7465535708985557783,2025-01-30 02:57:24,Merz ist mittlerweile genauso verlogen wie die AfD,1,0,7465215719811157270,7465215719811157270
7465504468407812886,2025-01-30 00:53:19,Merz hat sich ins Knie geschossen,1,0,7465215719811157270,7465215719811157270
7465501692726592278,2025-01-30 00:42:26,er war so klug,1,1,7465215719811157270,7465215719811157270
7465494344172339990,2025-01-30 00:13:56,Er fehltHelmut,1,0,7465215719811157270,7465215719811157270
7465486015168676630,2025-01-29 23:40:10,Und jetzt zeigen sie was er über Migration gesagt hat ,1,0,7465215719811157270,7465215719811157270
7465480979378520854,2025-01-29 23:20:32,Helmut Schmidt wird sich im Grab umdrehen und jeden heimsuchen,1,0,7465215719811157270,7465215719811157270
7465479475589808918,2025-01-29 23:14:05,Also wer ist denn in der CDU der ausgezeichnet Klöckner Spahn,1,12,7465215719811157270,7465215719811157270
7465475993990497026,2025-01-29 23:00:33,Merz mein Bundeskanzler ,1,0,7465215719811157270,7465215719811157270
7465475105284670230,2025-01-29 22:57:09,die CDU CSU sieht es wahrscheinlich umgekehrt ,1,0,7465215719811157270,7465215719811157270
7465459759781921558,2025-01-29 21:57:24,Merz ist das verlogenste Stück seit LindnerW I D E R L I C H,1,0,7465215719811157270,7465215719811157270
7465459321381815062,2025-01-29 21:56:06,Echte Demokraten geschlossen gegen die AfD und CDU ,1,0,7465215719811157270,7465215719811157270
7465448453453120278,2025-01-29 21:13:32,So ist es Absolut kein Ehrenmann der Herr Merz Setzt sich auf das Pferd was ihm gerade recht kommt obwohl er vorher was ganz anderes erzählt hat Das ist wirklich zum kotzen,1,0,7465215719811157270,7465215719811157270
7465443615633277718,2025-01-29 20:54:36,er fehlt sehr,1,0,7465215719811157270,7465215719811157270
7465435796705051414,2025-01-29 20:24:28,,1,0,7465215719811157270,7465215719811157270
7465435314560484118,2025-01-29 20:22:22,Unser Helmut Schmidt ,1,0,7465215719811157270,7465215719811157270
7465434503251641110,2025-01-29 20:19:07,Er war der beste so einen wird es nie wieder geben ein Unikat möge Er in Frieden ruhen ,1,0,7465215719811157270,7465215719811157270
7465431128439046934,2025-01-29 20:05:59,,1,0,7465215719811157270,7465215719811157270
7465427623851475734,2025-01-29 19:52:38,Was ist eigentlich mit dem C in ihrer Partei Herr Merz Als Christ sollten Sie die Frage stellen what would Jesus do ,1,0,7465215719811157270,7465215719811157270
7465423578129826582,2025-01-29 19:36:42,Er würde sich aber heute Schämen und Toben was aus dieser SPD geworden ist SPD zerstört sein Andenken durch ihre wir stehen über dem Glauben Gesetz des Volkes ,1,1,7465215719811157270,7465215719811157270
7465422799202910998,2025-01-29 19:34:03,,1,0,7465215719811157270,7465215719811157270
7465395952267608854,2025-01-29 17:49:43,Schade das man gewisse Leute nicht auferstehen lassen kann ,1,0,7465215719811157270,7465215719811157270
7465382264290263830,2025-01-29 16:56:36,Schmidt wusste bereits der Islam wird zum Problem werden Seine Kinder und Enkel scheinen es vergessen zu haben,1,0,7465215719811157270,7465215719811157270
7465349434517127958,2025-01-29 14:49:26,Helmut Schmidt ein man seiner zeit voraus ein großer Politiker ,1,0,7465215719811157270,7465215719811157270
7465347045429412630,2025-01-29 14:40:17,wenn schwarz sich in blau umwandelt,1,0,7465215719811157270,7465215719811157270
7465339613722657558,2025-01-29 14:11:36,Teilen Teilen Teilen Teilen Teilen Teilen,1,0,7465215719811157270,7465215719811157270
7478146469251007254,2025-03-05 02:29:18,Ach würde er nur von den Toten auferstehen ne Fluppe anzünden und dann die Ärmel hochkrempeln ,0,0,7465215719811157270,7465215719811157270
7469862899480822551,2025-02-10 18:43:54,"
 Linke2025 
",0,0,7465215719811157270,7465215719811157270
7467187559829275414,2025-02-03 13:42:30,Das war einmal,0,0,7465215719811157270,7465215719811157270
7466576906701423382,2025-02-01 22:12:37,Merz  Schmerz,0,0,7465215719811157270,7465215719811157270
7466575669024047894,2025-02-01 22:07:25,Nie wieder Merz,0,0,7465215719811157270,7465215719811157270
7466516539942159126,2025-02-01 18:18:18,Wacht auf nur blau,0,0,7465215719811157270,7465215719811157270
7466505276566815510,2025-02-01 17:34:46,Heute nicht mehr ,0,0,7465215719811157270,7465215719811157270
7466482662384501526,2025-02-01 16:06:49, herrlich Trauer keine Politiker,0,0,7465215719811157270,7465215719811157270
7466477261900268310,2025-02-01 15:46:12,Längst am rechten Rand angekommen die CDU,0,0,7465215719811157270,7465215719811157270
7466418490514473750,2025-02-01 11:57:43,wo sind die Politiker die wir brauchen ich sehe sie nicht,0,0,7465215719811157270,7465215719811157270
7466415076743086870,2025-02-01 11:44:49,So geil Im Kanzler Merz  Er kommt aus dem Sauerland Finde ich gut Reicht mir ihn zu wählen Der Rest ist mir egal,0,0,7465215719811157270,7465215719811157270
7466413482435674902,2025-02-01 11:38:09,Darum AfD für ein Sicheres und Friedliches Leben in Deutschland,0,0,7465215719811157270,7465215719811157270
7466406480481403670,2025-02-01 11:11:06,war der beste Mann und inteligent,0,0,7465215719811157270,7465215719811157270
7466383822451475202,2025-02-01 09:43:41,,0,0,7465215719811157270,7465215719811157270
7466372871250854678,2025-02-01 09:00:46,Zum Glück hat sicher Herr Merz VOR der Wahl entlarvt Ich kann ihn nicht mehr ertragen,0,0,7465215719811157270,7465215719811157270
7466348333846954774,2025-02-01 07:26:00,,0,0,7465215719811157270,7465215719811157270
7466329552865805078,2025-02-01 06:14:44,Stelle mal eine Frage Wäre Herr Helmut Schmidt mit seiner Einstellung HEUTE in der SPD,0,0,7465215719811157270,7465215719811157270
7466277535191008023,2025-02-01 02:54:58,Nicht Raucher ,0,0,7465215719811157270,7465215719811157270
7466258668074959638,2025-02-01 01:40:19,Das wars mit der cdu Wählt links ,0,0,7465215719811157270,7465215719811157270
7466244954245071638,2025-02-01 00:46:39,Er war der Wahnsinn,0,0,7465215719811157270,7465215719811157270
7466241112500437782,2025-02-01 00:30:12,Schade das wir keinen Politiker mehr haben wie einen Helmut SchmidtMerz ist nicht tragbar,0,0,7465215719811157270,7465215719811157270
7466221738183983894,2025-01-31 23:14:25,Helmut Schmidt würde sich angesichts der Politik der SPD im Grabe rumdrehen,0,0,7465215719811157270,7465215719811157270
7466219133421421314,2025-01-31 23:04:22,Wir müssen jetzt die cdu wählen Ich bin links aber cdu ist die einzige Partei die eine reale Chance gegen die AfD hat Wir dürfen die cdu jetzt nicht schwächen ,0,0,7465215719811157270,7465215719811157270
7466214141788603158,2025-01-31 22:45:07,Wenn er seineSPD sehen könntewürde er sich schämenDerInhalt desCDUAntrags steht fast wörtlich so imSPDProgrammdie lehnen den aus wahltaktischenGründen abSoviel zuÜberzeugungen,0,0,7465215719811157270,7465215719811157270
7466209277289448214,2025-01-31 22:26:10,Schaut euch einen Staatsmann an wie H Schmidt einer gewesen war und dann stellt den Merz daneben,0,0,7465215719811157270,7465215719811157270
7466134133472920342,2025-01-31 17:34:24,Herr Merz darf nicht Bundeskanzler werdener lügt und betrügt Die Machtgier ist zu extrem,0,0,7465215719811157270,7465215719811157270
7466128153565070102,2025-01-31 17:11:05,Leider wird es nicht mehr möglich seien einen derartigen Bundeskanzler geben,0,0,7465215719811157270,7465215719811157270
7466107227595817750,2025-01-31 15:50:13,Leider kommen solche tollen Politiker niemals mehr wieder Er war der Beste Kanzler aller Zeiten,0,0,7465215719811157270,7465215719811157270
7466098430773297942,2025-01-31 15:16:08,Die SPD unter Schmidt würde natürlich NICHT weiter rechts stehen das ist eine beliebte rechte Legende  sie hat sich unter Schröder schon so weit nach rechts verschoben  da gibt es nichts mehr rechts davon was noch SPD sein könnte,0,0,7465215719811157270,7465215719811157270
7466085647842640662,2025-01-31 14:26:20,john cena am k right,0,0,7465215719811157270,7465215719811157270
7466074412203606806,2025-01-31 13:42:36,Genau wie die Grünen Keine Waffen in Kriegsgebieten und was ist jetzt ,0,0,7465215719811157270,7465215719811157270
7466072097647837974,2025-01-31 13:33:32,Die CDU arbeitet nach wie vor nicht mir der AFD zusammen,0,0,7465215719811157270,7465215719811157270
7466068022806020886,2025-01-31 13:17:39,Bester Kanzler alle Zeiten,0,0,7465215719811157270,7465215719811157270
7466053452307563287,2025-01-31 12:21:30,War der nicht selbst Mitglied der NSDAP und der Wehrmacht damals,0,0,7465215719811157270,7465215719811157270
7466037442518418198,2025-01-31 11:19:41,,0,0,7465215719811157270,7465215719811157270
7466029928640283415,2025-01-31 10:50:10,Das ist ein Staatsmann  Sowas gibt es nicht mehr,0,0,7465215719811157270,7465215719811157270
7466022689133232918,2025-01-31 10:22:19,Der beste Kanzler,0,0,7465215719811157270,7465215719811157270
7466017070830289686,2025-01-31 10:00:54,Oh Gott er fehlt so sehr,0,0,7465215719811157270,7465215719811157270
